"content","cmp_code","eu_code"
"Da sempre la nostra forza è stata quella di trasformare con il gusto, la duttilità, la tecnica e la creatività, materie prime spesso acquistate all’estero.","416",0
"Il decennio appena trascorso è stato particolarmente pesante per il nostro sistema produttivo.","416",0
"L’ingresso nell’Euro e la fine della svalutazione competitiva hanno prodotto, con la concorrenza della rendita finanziaria, una caduta degli investimenti in innovazione tecnologica e nella capitalizzazione delle imprese, con l’aumento dell’esportazione di capitali.","416",0
"Anche in questo caso è tempo di cambiare spartito e ridare centralità alla produzione.",NA,0
"Una politica industriale “integralmente ecologica” è la prima e più rilevante di queste scelte.","416",0
"Noi immaginiamo un progetto-Paese che individui grandi aree d’investimento, di ricerca, di innovazione verso le quali orientare il sistema delle imprese, nell’industria, nell’agricoltura e nei servizi.","416",0
"La qualità e le tipicità, mobilità sostenibile, risparmio ed efficienza energetica, le tecnologie legate alla salute, alla cultura, all’arte, ai beni di valore storico e alla nostra tradizione, l’agenda digitale.","416",0
"Bisogna inoltre dare più forza e prospettiva alle nostre piccole e medie imprese aiutandole a collegarsi fra loro, a capitalizzarsi, ad accedere alla ricerca e alla internazionalizzazione.","402",0
"Beni comuni",NA,0
"Per noi salute, istruzione, sicurezza, ambiente, sono campi dove, in via di principio, non deve esserci il povero né il ricco.","606",0
"Perché sono beni indisponibili alla pura logica del mercato e dei profitti.","606",0
"Sono beni comuni  di tutti e di ciascuno e definiscono il grado di civiltà e democrazia del Paese.","606",0
"I referendum del 2011 hanno affermato il principio dell’acqua come bene non privatizzabile.","606",0
"L’energia, il patrimonio culturale e del paesaggio, le infrastrutture dello sviluppo sostenibile, la rete dei servizi di welfare e formazione, sono beni che devono vivere in un quadro di programmazione, regolazione e controllo sulla qualità delle prestazioni.","606",0
"Per tutto questo, introdurremo normative che definiscano i parametri della gestione pubblica o, in alternativa, i compiti delle autorità di controllo a tutela delle finalità pubbliche dei servizi.","606",0
"In ogni caso non può venir meno una responsabilità pubblica dei cicli e dei processi, che garantisca l’universalità di accesso e la sostenibilità nel lungo periodo.","403",0
"La difesa dei beni comuni è la risposta che la politica deve a un bisogno di comunità che è tornato a manifestarsi anche tra noi.","403",0
"I referendum della primavera del 2011 ne sono stati un’espressione fondamentale.","403",0
"È tramontata l’idea che la privatizzazione e l’assenza di regole siano sempre e comunque la ricetta giusta.","403",0
"Non si tratta per questo di tornare al vecchio statalismo o a una diffidenza preventiva verso un mercato regolato.","403",0
"Il punto è affermare l’idea che questi beni riguardano il futuro dei nostri figli e chiedono pertanto una presa in carico da parte della comunità.","403",0
"In questo disegno la maggiore razionalità e la valorizzazione del tessuto degli enti locali sono essenziali, non solo per la funzione regolativa che sono chiamati a svolgere, ma perché il presidio di democrazia, partecipazione e servizi che assicurano è in sé uno dei beni più preziosi per i cittadini.","301",0
"Superare le duplicazioni, riqualificare la spesa, devono perciò accompagnarsi a un nuovo e rigoroso investimento sul valore dell’autogoverno locale che, soprattutto nella crisi, non va visto, così come ha fatto la destra, come una specie di malattia, ma piuttosto come una possibile medicina.","301",0
"A sua volta l’autogoverno locale deve offrire spazi e occasioni alla sussidiarietà, alle forme di partecipazione civica, ai protagonisti del privato sociale e del volontariato.","301",0
"Diritti",NA,0
"Il principio della dignità inviolabile della persona e il rispetto dei diritti umani fondamentali sono la cornice generale entro cui trovano posto tutte le nostre scelte di programma.","201",0
"In particolare, noi ci sentiamo al fianco della lotta di popoli interi per la difesa dei diritti umani, a iniziare da quelli delle donne.","201",0
"Crediamo sia compito dei democratici e dei progressisti affermare l’indivisibilità dei diritti  politici, civili e sociali e di farlo valorizzando il principio costituzionale della laicità dello Stato.","201",0
"Nel nostro caso questo significa l’impegno a perseguire il contrasto verso ogni violenza contro le donne, un fenomeno che affonda le sue radici in modelli inaccettabili del rapporto tra i generi e che costituisce una vera e propria violazione dei diritti umani.","201",0
"Sul piano dei diritti di cittadinanza l’Italia attende da troppo tempo una legge semplice ma irrinunciabile: un bambino, figlio d’immigrati, nato e cresciuto in Italia, è un cittadino italiano.","201",0
"L’approvazione di questa norma sarà simbolicamente il primo atto che ci proponiamo di compiere nella prossima legislatura.","201",0
"Daremo sostanza normativa al principio riconosciuto dalla Corte Costituzionale, per il quale una coppia omosessuale ha diritto a vivere la propria unione ottenendone il riconoscimento giuridico.","201",0
"È inoltre urgente una legge contro l’omofobia.","201",0
"Siamo per il rispetto della vita umana e quindi vogliamo che la condizione dei detenuti sia rispettosa della Costituzione.","201",0
"Responsabilità",NA,0
"L’Italia ha bisogno di un governo e di una maggioranza stabili e coesi.","303",0
"Di conseguenza l’imperativo che democratici e progressisti hanno di fronte è quello dell’affidabilità e della responsabilità.","303",0
"Per questa ragione, nel momento stesso in cui chiamiamo a stringere un patto di governo movimenti, associazioni, liste civiche, singole personalità e cittadini che condividono le linee di questo progetto, vogliamo assumere insieme, dinanzi al Paese, alcuni impegni espliciti e vincolanti.","303",0
"Le forze della coalizione, in un quadro di lealtà e civiltà dei rapporti, si dovranno impegnare a: sostenere in modo leale e per l’intero arco della legislatura l’azione del premier scelto con le primarie;","303",0
"affidare a chi avrà l’onere e l’onore di guidare la maggioranza, la responsabilità di una composizione di governo snella, sottratta a logiche di spartizione e ispirata a criteri di competenza, rinnovamento e credibilità interna e internazionale;","303",0
"vincolare la risoluzione di controversie relative a singoli atti o provvedimenti rilevanti a una votazione a maggioranza qualificata dei gruppi parlamentari convocati in seduta congiunta;","303",0
"assicurare la lealtà istituzionale agli impegni internazionali e ai trattati sottoscritti dal nostro Paese, fino alla verifica operativa e all’eventuale rinegoziazione degli stessi in accordo con gli altri governi;","107",0
"appoggiare l’esecutivo in tutte le misure di ordine economico e istituzionale che nei prossimi anni si renderanno necessarie per difendere la moneta unica e procedere verso un governo politico-economico federale dell’eurozona.","303",0
