"content","cmp_code","eu_code"
"Noi, cittadine e cittadini democratici e progressisti, ci riconosciamo nella Costituzione repubblicana, in un progetto di società di pace, di libertà, di eguaglianza, di laicità, di giustizia, di progresso e di solidarietà.","305",0
"Vogliamo contribuire al cambiamento dell’Italia, alla ricostruzione delle sue istituzioni, a un forte impegno del nostro Paese per un’Europa federale e democratica.","305",0
"Crediamo nel valore del lavoro, nello spirito solidaristico e nel riconoscimento del merito.","305",0
"Vogliamo sconfiggere ogni forma di populismo.","305",0
"In nome di questi valori ispirati al Bene comune dell’Italia e per raggiungere questi obiettivi abbiamo promosso le elezioni primarie che il 2 dicembre 2012 hanno indicato il segretario del Partito Democratico Pier Luigi Bersani come il candidato dei democratici e dei progressisti alla guida del governo del nostro Paese.","305",0
"Ci candidiamo come alternativa politica e civica al lungo periodo berlusconiano, responsabile di aver lasciato un cumulo di macerie nel Paese e un contesto sociale gravemente deteriorato.","305",0
"I ripetuti scandali hanno sconvolto la coscienza civile del Paese e fatto crescere il distacco dei cittadini dalla politica.","305",0
"Si chiede giustamente un rinnovamento profondo, non di facciata.","305",0
"Non è solo una questione generazionale, ma si rende necessaria una rivoluzione morale e civica che deve penetrare in profondità la politica e i partiti.","304",0
"Questo è il vero rinnovamento che impone la piena attuazione dell’art. 49 della Costituzione che richiama la disciplina giuridica delle formazioni politiche.","304",0
"Oggi siamo noi i protagonisti del cambiamento e ne sentiamo la responsabilità.","305",0
"La politica non è tutta uguale.","305",0
"Vogliamo che i nostri rappresentanti siano scelti per le loro capacità e per la loro onestà.","305",0
"Chiediamo che i candidati al Parlamento rispettino gli impegni contenuti nella Carta d’Intenti e nel Codice etico che seguono.","305",0
"La prossima legislatura dovrà affrontare tre compiti decisivi.","305",0
"Guidare l’economia fuori dalla crisi.","410",0
"Ridare autorità, efficienza e prestigio alle istituzioni e alla politica, ripartendo dai principi della Costituzione.","203",0
"Rilanciare l’unità e l’integrazione politica dell’Unione Europea.","108",0
"Noi non crediamo alle bugie delle promesse facili, quelle vendute nel decennio disastroso della destra.","305",0
"Crediamo, invece, in un risveglio della fiducia, a cominciare dai giovani e dalle donne.","305",0
"I problemi sono enormi e il tempo per aggredirli si accorcia.","305",0
"Le scelte da compiere non sono semplici né scontate.","305",0
"Ma la speranza che ci muove vive tutta nella convinzione che si possano combinare cambiamento e affidabilità, uguaglianza e rigore nelle scelte.","305",0
"Il nostro posto è in Europa.","108",0
"Noi collocheremo sempre più saldamente l’Italia nel cuore di un’Europa da ripensare su basi democratiche.","108",0
"In “casa” dovremo colmare la faglia che si è scavata tra cittadini e politica.","202",0
"Qui non bastano le parole.","202",0
"Serviranno i comportamenti, le azioni, le coerenze.","202",0
"Faremo in modo che buona politica e riscossa civica procedano affiancate.","202",0
"Il traguardo è ricostruire quel patrimonio collettivo che la destra e i populismi stanno disgregando: la qualità della democrazia, la legalità, la cittadinanza, la partecipazione.","202",0
"La realtà è che mai come oggi nessuno si salva da solo.","503",0
"E nessuno può stare bene davvero, se gli altri continuano a stare male: è questo il principio base del nostro progetto, sia nella sfera morale e civile che in quella economica e sociale.","503",0
"Vogliamo che il destino dell’Italia sia figlio della migliore civiltà europea e vogliamo sentirci vicino a chi nel mondo si batte per la libertà e l’emancipazione di ogni essere umano.","201",0
"Oggi, in un mondo in subbuglio, pace, cooperazione, accoglienza devono ispirare di nuovo l’agire politico.","107",0
"Nella coscienza delle donne e degli uomini come nella diplomazia degli Stati.","107",0
"Con questa visione noi, democratici e progressisti, ci candidiamo alla guida dell’Italia.","305",0
"Europa",NA,0
"L’immagine e la credibilità dell’Italia nel mondo sono state lesionate dalla cupa stagione berlusconiana.","305",0
"Proseguire nell’azione di recupero pieno del ruolo e del prestigio che compete al nostro Paese è un dovere civico e politico che ci consente di guardare al futuro con la convinzione di poter esprimere compiutamente la grande tradizione europeista dell’Italia fino al suo approdo federale, come postulato con visione profetica da Alcide De Gasperi, Luigi Einaudi e Altiero Spinelli.","108",0
"Dalla crisi non si esce con le ricadute nell’euroscetticismo, ma con più Europa.","108",0
"Attraverso, dunque, il governo dell’Euro e la sua stabilizzazione; attraverso la sottolineatura che non può esserci benessere senza lavoro; attraverso la capacità reale di mettere la finanza sotto controllo, perché gli affari non possono essere condotti senza regole:  sono questi i termini di una visione europeista moderna e solidale che giustifica una razionale e misurata cessione di sovranità nazionale.","108",0
"La crisi che scuote il mondo mette a rischio l’Europa e le sue conquiste di civiltà.","108",0
"Ma noi siamo l’Europa, nel senso che da lì viene la sola possibilità di salvare l’Italia: le sorti dell’integrazione politica coincidono largamente col nostro destino.","108",0
"Non c’è futuro per l’Italia se non dentro la ripresa e il rilancio del progetto europeo.","108",0
"La prossima maggioranza dovrà avere ben chiara questa bussola: nulla senza l’Europa.","108",0
"Per riuscirci agiremo in due direzioni.","108",0
"In primo luogo, rafforzando la piattaforma dei progressisti europei.","108",0
"Se l’austerità e l’equilibrio dei conti pubblici, pur necessari, diventano un dogma e un obiettivo in sé – senza alcuna attenzione per occupazione, investimenti, ricerca e formazione – finiscono per negare se stessi.","108",0
"Adesso c’è bisogno di correggere la rotta, accelerando l’integrazione politica, economica e fiscale, vera condizione di una difesa dell’Euro e di una riorganizzazione del nostro modello sociale.","108",0
"In secondo luogo, bisogna portare a compimento le promesse tradite della moneta unica e integrare la più grande area economica del pianeta in un modello di civiltà che nessun’altra nazione o continente è in grado di elaborare.","108",0
"Salvare l’Europa nel pieno della crisi significa condividere il governo dell’emergenza finanziaria secondo proposte concrete che abbiamo da tempo avanzato assieme ai progressisti europei.","108",0
"Tali proposte determinano una prospettiva di coordinamento delle politiche economiche e fiscali.","108",0
"E dunque nuove istituzioni comuni, dotate di una legittimazione popolare e diretta.","108",0
"A questo fine i progressisti devono promuovere un patto costituzionale con le principali famiglie politiche europee.","108",0
"Anche per l’Europa, infatti, la prossima sarà una legislatura costituente in cui il piano nazionale e quello continentale saranno intrecciati stabilmente.","108",0
"Una legislatura nella quale l’orizzonte ideale degli Stati Uniti d’Europa dovrà iniziare ad acquistare concretezza in una nuova architettura istituzionale dell’eurozona.","108",0
"Qui vive la ragione più profonda che ci spinge a cercare un terreno di collaborazione con le forze del centro liberale.","108",0
"Per questo i democratici e i progressisti s’impegnano a promuovere un accordo di legislatura con queste forze, sulla base della loro ispirazione costituzionale ed europeista e di una responsabilità comune di fronte al passaggio storico, unico ed eccezionale, che l’Italia e l’Europa dovranno affrontare nei prossimi anni.","108",0
"Collocare il progetto di governo italiano nel cuore della sfida europea significa costruire un progetto alternativo alle regressioni nazionaliste, anti-europee e populiste, da sempre incompatibili con le radici di un’Europa democratica, aperta, inclusiva.","108",0
"Democrazia",NA,0
"Dobbiamo sconfiggere l’ideologia della fine della politica e delle virtù prodigiose di un uomo solo al comando.","202",0
"E’ una strada che l’Italia ha già percorso, e sempre con esiti disastrosi.","202",0
"Per noi il populismo è il principale avversario di una politica autenticamente popolare.","202",0
"In questi ultimi anni esso è stato alimentato da un liberismo finanziario che ha lasciato i ceti meno abbienti in balia di un mercato senza regole.","202",0
"La destra populista ha promesso una illusoria protezione dagli effetti del liberismo finanziario innalzando barriere culturali, territoriali e a volte xenofobe.","202",0
"La sola vera risposta al populismo è la partecipazione democratica.","202",0
"La crisi della democrazia non si combatte con “meno” ma con “più” democrazia.","202",0
"Più rispetto delle regole, una netta separazione dei poteri, una vera democrazia paritaria e l’applicazione corretta e integrale di quella Costituzione che rimane tra le più belle e avanzate del mondo.","202",0
"Siamo convinti che il suo progetto di trasformazione civile, economica e sociale sia vitale e per buona parte ancora da mettere in atto.","202",0
"L’autonomia, la responsabilità e la libertà femminile sono una leva per la crescita e una risposta alla crisi democratica.","202",0
"C’è un nesso strettissimo tra il maschilismo e l’offesa alla dignità delle donne incarnati in questi anni dal berlusconismo e il degrado delle istituzioni democratiche.","202",0
"Il riconoscimento della soggettività femminile e l’attuazione del principio della democrazia paritaria sono oggi condizioni essenziali per la ricostruzione del Paese.","202",0
"Vogliamo dare segnali netti all’Italia onesta che cerca nelle istituzioni un alleato contro i violenti, i corruttori e chiunque si appropri di risorse comuni mettendo a repentaglio il futuro degli altri.","605",0
"Per noi ciò equivarrà alla difesa intransigente del principio di legalità, a una lotta decisa all’evasione fiscale, al contrasto severo dei reati contro l’ambiente, al rafforzamento della normativa contro la corruzione e a un sostegno più concreto agli organi inquirenti e agli amministratori impegnati contro mafie e criminalità, vero piombo nelle ali per l’intero Paese.","605",0
"Vogliamo contrastare tutte le mafie, reprimendone sia l’azione criminale che l’immensa forza economica.","605",0
"La presenza dei capitali mafiosi, a maggior ragione in un momento di crisi, è un elemento devastante per ogni prospettiva di rilancio del Paese.","605",0
"Va reciso ogni legame o sospetto di complicità di alcuni rappresentanti politici.","605",0
"La rigorosa applicazione del codice etico approvato dalla Commissione antimafia è per noi inderogabile per le candidature a tutti i livelli.","605",0
"Sulla riforma dell’assetto istituzionale, siamo favorevoli a un sistema parlamentare semplificato e rafforzato, con un ruolo incisivo del governo e la tutela della funzione di equilibrio assegnata al Presidente della Repubblica.","605",0
"Riformuleremo un federalismo responsabile e bene ordinato che faccia delle autonomie un punto di forza dell’assetto democratico e unitario del Paese.","301",0
"Sono poi essenziali norme stringenti in materia di conflitto d’interessi, legislazione antitrust e libertà dell’informazione.","403",0
"Daremo vita a un percorso riformatore che assicuri concretezza e certezza di tempi alla funzione costituente della prossima legislatura.","203",0
"Infine, ma non è l’ultima delle priorità, la politica deve recuperare autorevolezza, promuovere il rinnovamento, ridurre i suoi costi e la sua invadenza in ambiti che non le competono.","303",0
"Ad esempio, attraverso una riforma profonda dei servizi pubblici locali bisogna avere l’attenzione di incidere su di un sistema di potere assai consolidato che alimenta e incoraggia i costi perversi della politica.","303",0
"Serve una politica sobria perché se gli italiani devono risparmiare, chi li governa deve farlo di più.","303",0
"A ogni livello istituzionale non sono accettabili emolumenti superiori alla media europea.","303",0
"Ma anche questo non basta.","303",0
"Va approvata una riforma dei partiti, che alla riduzione del finanziamento pubblico","303",0
"affianchi una legge di attuazione dell’articolo 49 della Costituzione, che assicuri la democrazia dei e nei partiti, che devono riformarsi per essere strumento dei cittadini e non luogo opaco di interessi particolari.","202",0
"Bisogna agire per la semplificazione e l’alleggerimento del sistema istituzionale e amministrativo.","303",0
"Occorrono piani industriali per ogni singola amministrazione pubblica al fine di produrre efficienza e risparmio.","303",0
"Riconoscere il limite della politica e dei partiti significa anche aprire il campo alle richieste d’impegno e mobilitazione che maturano nella società e alle competenze che si affermano.","303",0
"Tutto ciò dovrà essere messo in atto a cominciare dalle nomine in enti, società pubbliche e autorità di sorveglianza e da rinnovati criteri di selezione nelle funzioni di governo.","303",0
"Lavoro",NA,0
"La nostra visione assume il lavoro come parametro di tutte le politiche.","701",0
"Cuore del nostro progetto è la dignità del lavoratore da rimettere al centro della democrazia, in Italia e in Europa.","701",0
"Questa è anche la premessa per riconoscere la nuova natura del conflitto sociale.","701",0
"Fulcro di quel conflitto non è più solo l’antagonismo classico tra impresa e operai, ma il mondo complesso dei produttori, cioè delle persone che pensano, lavorano e fanno impresa.","701",0
"E questo perché anche lì, in quella dimensione più ampia, si stanno creando forme nuove di sfruttamento.","701",0
"Il tutto, ancora una volta, per garantire guadagni e lussi alla rendita finanziaria.","701",0
"Bisogna perciò costruire alleanze più vaste.","701",0
"La battaglia per la dignità e l’autonomia del lavoro, infatti, riguarda oggi la lavoratrice precaria come l’operaio sindacalizzato, il piccolo imprenditore o artigiano non meno dell’impiegato pubblico, il giovane professionista sottopagato al pari dell’insegnante o della ricercatrice universitaria.","701",0
"Il primo passo da compiere è un ridisegno profondo del sistema fiscale che alleggerisca il peso sul lavoro e sull’impresa, attingendo alla rendita dei grandi patrimoni finanziari e immobiliari.","701",0
"Quello successivo è contrastare la precarietà, rovesciando le scelte della destra nell’ultimo decennio e in particolare l’idea di una competitività al ribasso del nostro apparato produttivo, quasi che, rimasti orfani della vecchia pratica che svalutava la moneta, la risposta potesse stare nella svalutazione e svalorizzazione del lavoro.","701",0
"Il terzo passo è spezzare la spirale perversa tra bassa produttività e compressione dei salari e dei diritti, aiutando le produzioni a competere sul lato della qualità e dell’innovazione, punti storicamente vulnerabili del nostro sistema.","701",0
"Quarto passo è mettere in campo politiche fiscali a sostegno dell’occupazione femminile, ancora adesso uno dei differenziali più negativi per la nostra economia, in particolare al Sud.","701",0
"Serve un grande piano per aumentare e migliorare l’occupazione femminile, contrastare la disparità nei redditi e nelle carriere, sradicare i pregiudizi sulla presenza delle donne nel mondo del lavoro e delle professioni.","701",0
"A tale scopo è indispensabile alleggerire la distribuzione del carico di lavoro e di cura nella famiglia, sostenendo una riforma del welfare, politiche di conciliazione e condivisione e varando un programma straordinario per la diffusione degli asili nido.","701",0
"Anche grazie a politiche di questo tipo sarà possibile sostenere concretamente le famiglie e favorire una ripresa della natalità.","701",0
"Insomma sul punto non servono altre parole: bisogna fare del tasso di occupazione femminile e giovanile il misuratore primo dell’efficacia di tutte le nostre strategie.","701",0
"Infine, il lavoro è oggi per l’Italia lo snodo tra questione sociale e questione democratica.","701",0
"Fondare sul lavoro e su una più ampia democrazia nel lavoro la ricostruzione del Paese non è solo una scelta economica, ma l’investimento decisivo sulla qualità della nostra democrazia.","701",0
"Occorre una legge sulla rappresentanza che consenta l’esercizio effettivo della democrazia per chi lavora.","701",0
"Non possiamo consentire né che si continui con l’arbitrio della condotta di aziende che discriminano i lavoratori, né che ci sia una rappresentanza sindacale che prescinda dal voto dei lavoratori sui contratti.","701",0
"Uguaglianza",NA,0
"L’Italia è divenuta negli anni uno dei Paesi più diseguali del mondo occidentale.","503",0
"La crisi stessa trova origine  negli Stati Uniti come in Europa da un aumento senza precedenti delle disuguaglianze.","503",0
"E dunque esiste, da tempo oramai, un problema enorme di redistribuzione che investe il rapporto tra rendita e lavoro, mettendo a rischio i fondamenti del welfare.","503",0
"Sull’altro fronte, la ricchezza finanziaria e immobiliare è diventata sempre più inafferrabile, capace com’è di sfuggire a ogni vincolo fiscale e solidale.","503",0
"Non si esce dalla crisi se chi ha di più non è chiamato a dare di più.","503",0
"È la crisi stessa a insegnarci che la giustizia sociale non è pensabile come derivata della crescita economica, ma ne costituisce il presupposto.","503",0
"Ciò significa che la ripresa economica richiede politiche di contrasto alla povertà, anche in un Paese come il nostro dove il fenomeno sta assumendo caratteri nuovi e dimensioni angoscianti.","503",0
"I “nuovi poveri”, per altro, continuano ad assistere allo scandalo di rendite o emolumenti cresciuti a livelli indecenti, a ricchezze e proprietà smodate che si sottraggono a qualunque vincolo di solidarietà.","503",0
"A tutto questo bisogna finalmente mettere un argine.","503",0
"Per noi parlare di uguaglianza significa guardare la società con gli occhi degli “ultimi”.","503",0
"Di coloro che per vivere faticano il doppio: perché sono partiti da più indietro o da più lontano o perché sono persone con disabilità.","503",0
"Se poi guardiamo alle generazioni più giovani, il tema dell’uguaglianza si presenta prima di tutto come possibilità di scelta e parità delle condizioni di accesso alla formazione, al lavoro, a un’affermazione piena e libera della loro personalità.","503",0
"Superare le disuguaglianze di genere è indispensabile per ricostruire il Paese su basi moderne e giuste.","503",0
"Non a caso, ancora una volta, il simbolo più forte di una riscossa civica e morale è venuto dal movimento delle donne.","503",0
"Su questo piano la politica, il Parlamento e il governo devono assumere la democrazia paritaria come traguardo della democrazia tout court.","503",0
"Nessun discorso sull’uguaglianza sta in piedi se non si rimette il Mezzogiorno al centro dell’agenda.","503",0
"L’Italia è cresciuta quando Sud e Nord hanno scelto di avanzare assieme.","503",0
"Viceversa quando la forbice si è allargata, l’Italia tutta si è distanziata dall’Europa.","503",0
"Sostenere, come la destra ha fatto per anni, che il Nord poteva farcela da solo si è rivelato un grave errore, che ha impoverito il Sud e il Nord insieme.","503",0
"Tutt’altra cosa è combattere sprechi e inefficienze con una nuova strategia nazionale d’intervento.","503",0
"Il punto è farlo assieme al senso di responsabilità di tante amministrazioni e movimenti meridionali, per correggere le storture di vecchi regionalismi e localismi clientelari e per promuovere legalità, civismo e lavoro.","503",0
"Anche le politiche sociali ed economiche incentrate sulla difesa dei più deboli e sulla promozione di un sistema di pari opportunità richiedono che il merito diventi la bussola di una competizione positiva sul terreno della responsabilità e che ogni cittadino sia chiamato a corrispondere ai doveri fiscali in relazione al proprio patrimonio con fermezza e severità.","503",0
"Infine, al capitolo dell’uguaglianza è legata a filo doppio la questione di una giustizia civile e penale al servizio del cittadino.","503",0
"Su questo piano è superfluo ricordare che gli anni della destra al governo hanno sprangato ogni spiraglio a un intervento riformatore.","503",0
"Diciamo che si sono occupati pochissimo dello stato di diritto e molto del diritto di uno soltanto che si riteneva proprietario dello Stato.","503",0
"Ma così a pagare due volte sono stati i cittadini più deboli: quelli che hanno davvero bisogno di una giustizia civile e penale rapida, imparziale, efficiente.","503",0
"Nella prossima legislatura il tema dovrà essere affrontato dal punto di vista della dignità e dei diritti di tutti e non più dei potenti alla ricerca d’impunità.","503",0
"Libertà",NA,0
"Per noi libertà è anzitutto la possibilità concreta per le giovani generazioni di costruire il proprio progetto di vita e realizzare le proprie vocazioni.","503",0
"Il nostro progetto non sarà retoricamente per i giovani, ma dovrà essere soprattutto dei giovani.","503",0
"Quegli stessi che oggi, pur ricchi di talento ed energie, trovano le strade sbarrate e sono sistematicamente esclusi.","503",0
"Il tema del merito non può essere contrapposto a quello dell’eguaglianza delle opportunità.","503",0
"Libertà dei progetti di vita e valorizzazione del merito sono i presupposti di una società più aperta ed eguale.","503",0
"Attraverso l’introduzione di misure più incisive, ciò deve valere nel campo delle professioni, della scuola e dell’università, dell’amministrazione pubblica e dell’impresa privata.","503",0
"Negli anni del berlusconismo l’appello alla libertà è stato utilizzato a difesa di privilegi e vantaggi privati.","503",0
"Noi vogliamo liberare le energie della creatività e del merito individuale contro le chiusure corporative e familistiche della società italiana.","503",0
"Consideriamo essenziali il rispetto della libertà e della responsabilità delle donne.","503",0
"Occorre superare gli aspetti giuridicamente insostenibili della legge 40 in materia di procreazione assistita","604",0
"e garantire piena applicazione alla legge 194 sull’interruzione volontaria di gravidanza.","604",0
"Su temi che riguardano la vita e morte delle persone, la politica deve coltivare il senso del proprio limite e il legislatore deve intervenire sempre sulla base di un principio di cautela e di laicità del diritto.","604",0
"Per evitare i guasti di un pericoloso “bipolarismo etico” che la destra ha perseguito in questi anni, è necessario assumere come riferimento i principi scolpiti nella prima parte della nostra Costituzione e, a partire da quelli, procedere alla ricerca di punti di equilibrio condivisi, fatte salve la libertà di coscienza e l’inviolabilità della persona nella sua dignità.","604",0
"Sapere",NA,0
"La dignità del lavoro e la lotta alle disuguaglianze s’incrociano nel primato delle politiche per l’istruzione e la ricerca.","506",0
"Non c’è futuro per l’Italia senza un contrasto alla caduta drammatica della domanda d’istruzione registrata negli ultimi anni.","506",0
"È qualcosa che trova espressione nell’abbandono scolastico, nella flessione delle iscrizioni alle nostre università, nella sfiducia dei ricercatori e nella demotivazione di un corpo insegnante sottopagato e sempre meno riconosciuto nella sua funzione sociale e culturale.","506",0
"In questo caso più che dalle tante indicazioni programmatiche, conviene partire da un principio: nei prossimi anni, se vi è un settore per il quale è giusto che altri ambiti rinuncino a qualcosa, è quello della ricerca e della formazione.","506",0
"Dalla scuola dell’infanzia e dell’obbligo alla secondaria e all’università: la sfida è avviare il tempo di una società della formazione lunga e permanente che non abbandoni nessuno lungo la via della crescita, dell’aggiornamento, di possibili esigenze di mobilità.","506",0
"Solo così, del resto, si formano classi dirigenti all’altezza, e solo così il sapere riacquista la sua fondamentale carica di emancipazione e realizzazione di sé.","506",0
"A fronte di questo impegno, garantiremo processi di riqualificazione e di rigore della spesa, avendo come riferimento il grado di preparazione degli studenti e il raggiungimento degli obiettivi formativi.","506",0
"La scuola e l’università italiane, già fiaccate da un quindicennio di riforme inconcludenti e contraddittorie, hanno ricevuto nell’ultima stagione un colpo quasi letale.","506",0
"Ora si tratta di avviare un’opera di ricostruzione vera e propria.","506",0
"Nella prossima legislatura partiremo da un piano straordinario contro la dispersione scolastica, soprattutto nelle zone a più forte infiltrazione criminale, dal varo di misure operative per il diritto allo studio,","506",0
"da un investimento sulla ricerca avanzata nei settori trainanti e a più alto contenuto d’innovazione.","506",0
"Tutto ciò nel quadro del valore universalistico della formazione, della promozione della ricerca scientifica e della ricerca di base in ambito umanistico.","506",0
"Sviluppo sostenibile",NA,0
"Sviluppo sostenibile per noi vuol dire valorizzare la carta più importante che possiamo giocare nella globalizzazione, quella del saper fare italiano.","416",0
"Se una chance abbiamo, è quella di una Italia che sappia fare l’Italia.","416",0
