"content","cmp_code","eu_code"
"L'ITALIA E L'EUROPA CHE VOGLIAMO",NA,0
"VISIONE, MISSIONE E PROGRAMMA DEL CENTRO DEMOCRATICO",NA,0
"LA NOSTRA VISIONE",NA,0
"L’Italia si appresta a una campagna elettorale che senza enfasi è paragonabile a quella del 1948.","305",0
"Ora come allora il Paese si trova a doversi risollevare dalle macerie di una stagione politica e sociale lacerante, che oltre ad averlo spinto nella retroguardia delle economie avanzate, ne ha minato alla base i principi dell’etica pubblica.","305",0
"E ora come allora gli italiani saranno chiamati a scegliere tra diverse idee di democrazia, di progresso e di futuro.","305",0
"Da una parte, un blocco conservatore, ispirato a una concezione leaderistica, tecnocratica e liberista, che vede primeggiare una persona sola al comando, con l’unico compito di tenere in ordine i conti pubblici e di lasciare fare al libero mercato ciò che lo Stato non può più permettersi.","305",0
"Dall’altra, un polo riformatore, animato da un’idea partecipativa della dimensione politica, che vede nei diritti e nelle libertà, coniugati assieme ai doveri e alle responsabilità, la chiave di volta per ricostruire un tessuto civile degno di un Paese moderno.","305",0
"La scelta che abbiamo dinanzi è quella tra un’Italia chiusa in se stessa, gelosa della propria sovranità e prigioniera dei propri egoismi – territoriali, generazionali, economici e sociali -, e un’Italia aperta, protagonista in Europa e nel mondo e portavoce di un nuovo modello di sviluppo responsabile e solidale.","107",0
"E’ la scelta tra un modello di sviluppo che guarda alle generazioni future e vuole cambiare in profondità un sistema di produzione e consumo che non garantisce né un’equa distribuzione della ricchezza, né un uso oculato dei beni della terra, e un modello incentrato solo sul profitto e la competizione, che considera ineluttabile il perpetrarsi di un capitalismo ove la finanza ha occupato il posto dell’economia e l’economia ha eroso gli spazi propri della politica.","503",0
"Oggi la democrazia e la politica italiana sono fragili perché hanno smarrito l’orizzonte globale entro il quale si collocano le grandi questioni che determinano il destino dei popoli, e così facendo hanno perso le proprie radici.","202",0
"Le migliori tradizioni politiche, popolari, socialdemocratiche, liberali e riformiste, sono state relegate in un cono d’ombra da un ventennio in cui al centro della politica e della società è stato posto l’interesse individuale, più spesso quello personale, l’interesse delle lobby e delle corporazioni, piuttosto che l’interesse generale.","305",0
"La crisi dell’Italia, prima ancora che una crisi economica, è, in questo senso, una crisi politica, culturale e morale.","305",0
"Una crisi che nasce da un bipolarismo muscolare, connotato da una forte vis polemica tra le coalizioni avversarie, che ha avuto l’unico esito di dividere e frammentare, piuttosto che unire, le migliori energie del paese.","305",0
"Un bipolarismo che ha svilito la politica a un semplice elenco domestico di cose da fare nell’interesse di singoli blocchi sociali, perdendo di vista l’orizzonte globale e, con esso, i problemi strutturali dell’economia e della società italiana.","305",0
"La politica è stata una cattiva maestra, che ha preferito perseguire convenienze di breve respiro, anziché essere d’esempio e di stimolo alla crescita, spirituale e materiale, della collettività nazionale.","305",0
"Il ventennio berlusconiano ha esaltato l’individualismo esasperato, l’utilitarismo, la furbizia e, non da ultimo, il qualunquismo.","305",0
"La sua politica ha parlato, illudendola, alla sola “pancia” del paese, diffondendo un modello culturale e sociale che in modo più o meno subdolo ha tentato di legittimare la violazione dei più elementari precetti della convivenza civile: pagare le tasse e rispettare le sentenze della magistratura.","305",0
"Lentamente, è come se si fosse cercato, grazie anche un sistema dei media assai poco libero e indipendente, di minare la capacità di pensare degli italiani e di rendere normale ciò che, nei paesi avanzati, è semplicemente illegale.","305",0
"Allo stesso tempo, la politica ha troppo a lungo sottovalutato i problemi dell’economia, rinviando continuamente le riforme strutturali necessarie a ricondurre l’Italia su un sentiero di crescita.","305",0
"L’avvento del Governo Monti ha spezzato il cortocircuito etico e finanziario in cui si era avvitato il Paese, restituendo all’Italia quell’affidabilità internazionale senza la quale oggi saremmo stati travolti dalla speculazione dei mercati.","305",0
"I sacrifici chiesti agli italiani hanno consentito di consolidare un percorso di risanamento dei conti pubblici che è, tuttavia, tutt’altro che concluso.","305",0
"Nei prossimi anni ci aspettano ancora scelte difficili.","305",0
"Il macigno del debito pubblico e della spesa per gli interessi limiterà molto gli spazi di manovra, mentre dovremmo fronteggiare gli esiti di una crisi che ha intaccato pesantemente, talvolta in modo permanente, le capacità produttive del Paese.","305",0
"Il lavoro impostato dal professor Monti, integrato da una forte spinta sociale, poteva costituire una valida base da cui ripartire, cui certamente anche il centro-sinistra avrebbe dato il suo contributo positivo.","305",0
"Ma così, purtroppo, non è stato, perché la cosiddetta “agenda Monti”, facendosi parte, è diventata un simbolo della contesa elettorale.","305",0
"E in ogni caso crediamo che per vincere le sfide che ci aspettano, non basteranno il buon senso e un approccio tecnocratico.","305",0
"Serietà, professionalità, rigore, sono necessari per ripristinare le basi essenziali dell’etica pubblica, ma non sufficienti per avviare una stagione di autentico cambiamento.","305",0
"Il Paese, per voltare pagina e ricominciare a prosperare, ha bisogno di una rivoluzione culturale.","305",0
"Ha bisogno di cambiare mentalità e di scrollarsi di dosso comode abitudini, per affermare l’idea che il benessere è legato al lavoro e non alla furbizia, che gli affari non si possano condurre senza regole e senza etica, che i diritti camminano sulle gambe dei doveri.","305",0
"Ha bisogno di trasformare propria la scala dei valori e di abbracciare nuovi stili di vita e abitudini di consumo.","305",0
"E soprattutto ha bisogno, per realizzare tutto questo, di una buona Politica, che oltre a dare risposte puntuali ai problemi dei cittadini, sappia infondere ottimismo e speranza e imprimere un forte slancio morale al cambiamento.","305",0
"Il CENTRO DEMOCRATICO intende delineare una cornice ideale e programmatica, che nel solco delle grandi culture politiche liberali e riformiste possa arricchire il confronto, integrando e completando l’agenda Monti per offrire agli italiani una solida e credibile prospettiva di governo di centro-sinistra.","305",0
"L’ITALIA IN CUI CREDIAMO",NA,0
"In un contesto di persistente e severa crisi economica, lo scenario politico e sociale è caratterizzato, rispetto al passato, da una sempre più intensa disaffezione alla politica e da una crescente insicurezza, sul piano individuale e collettivo, che generano fenomeni inversi: da un lato forti pulsioni populistiche, volte a destrutturare il sistema, anche in chiave antieuropeista;","305",0
"dall’altro, nuove istanze di mobilitazione della società civile, alimentate da un ritorno di impegno civico e da una forte richiesta di soluzioni e risposte chiare e nette – “si si”, “no no”, - sulle grandi questioni  che determinano il destino della comunità (economia, lavoro, povertà, istruzione, ambiente).","305",0
"Il CENTRO DEMOCRATICO nasce per dare una rappresentanza e una voce autorevole a quella parte della società civile che non si lascia incantare dalle sirene della demagogia, né si limita a protestare rifugiandosi nell’astensionismo, ma che è invece disposta a mettersi in gioco per rifondare, in modo radicale, le istituzioni politiche, sociali ed economiche del Paese.","305",0
"Noi crediamo, infatti, che esista un’Italia che vuole parlare il linguaggio della verità e dell’onestà, che non si fa ingannare dalle bugie e dalle false promesse e che non intende rimanere silenziosa spettatrice del malcostume dilagante.","305",0
"Noi crediamo in un’Italia saggia, che vuole impegnarsi per difendere i valori della Costituzione, della vita, della famiglia, del rispetto del pianeta.","305",0
"Noi crediamo in un’Italia che non vuole privilegi e rendite di posizione e non si rassegna alla legge del più forte e alla precarietà dei diritti.","305",0
"Noi crediamo nell’Italia che non specula, ma produce ricchezza, paga le tasse, sostiene il volontariato, investe i propri denari in società che rispettano le persone e l’ambiente e che protegge e mette a frutto l’immenso capitale artistico che ha ereditato.","305",0
"Nonostante i pessimi esempi offerti da una parte della classe politica che ha perso ogni pudore e dignità, noi crediamo che esista ancora un’Italia concreta, che chiede a gran voce una nuova stagione di partecipazione democratica per reagire a un declino che non è inesorabile.","305",0
"E’ a questa Italia che il CENTRO DEMOCRATICO vuole rivolgersi, per indicare una via, possibile e praticabile, per rimettere in moto le energie dormienti del Paese.","305",0
"LA NOSTRA MISSIONE",NA,0
"Tra le tante cose venute a mancare dopo questi lunghi anni di bipolarismo muscolare, ciò che colpisce maggiormente è la scomparsa di un comune senso d’appartenenza alla nazione e la totale assenza di una visione politica capace di unire, piuttosto che di dividere.","606",0
"L’artificiosa e rozza divisione della politica tra “tifosi” di due opposti schieramenti ha impedito l’emergere di una strategia innovativa, originale e condivisa di valorizzazione delle risorse, delle energie e dei talenti straordinari di cui l’Italia è ricca.","606",0
"Una strategia che può nascere solo dalla consapevolezza di come di fronte alla complessità del mondo globalizzato del XXI° secolo, i paradigmi, le icone e le tradizionali categorie politiche siano ormai superati.","606",0
"Ciò non significa, certo, che siamo destinati a essere governati da tecnocrazie prive di principi ideali e di legittimazione democratica, quanto piuttosto che oggi mondi e dimensioni apparentemente distanti - come Stato e mercato, capitalismo e solidarietà, economia ed ecologia, finanza ed etica, pprofit  e no  profit  -possono abbracciarsi in modo nuovo, perseguendo sinergicamente obiettivi comuni.","606",0
"Le moderne politiche pubbliche sono assai più sofisticate del passato e richiedono un approccio integrato e multidisciplinare, che porta a sintesi, senza annullarle, le differenti sensibilità di stampo ideologico.","606",0
"In Italia le resistenze al cambiamento nascono da un sistema politico in cui ciascuna parte assume aprioristicamente una bandiera, protegge un determinato interesse, si fa portavoce di un segmento della società e dell’economia, prescindendo da una visione strategica complessiva.","606",0
"Ed è così che c’è chi sposa acriticamente il metodo della concertazione sindacale, e chi, altrettanto acriticamente, considera il mondo del lavoro e dei sindacati come un blocco conservatore da tenere a bada per non frenare la crescita e lo sviluppo.","606",0
"In tutte le questioni politiche il confronto sembra minato da un pregiudizio.","606",0
"Lo sviluppo economico e la solidarietà sociale sono troppo spesso trattati in modo disgiunto, come se l’uno potesse prescindere dall’altra.","606",0
"Analogamente, anche le questioni ambientali, da cui dipende larga parte del nostro futuro, sono da alcuni ritenute solo un insieme di vincoli e oneri impropri a carico del mondo produttivo, e da altri come la panacea di tutti i mali e l’unico fattore di modernizzazione dell’economia.","501",0
"La missione del CENTRO DEMOCRATICO è spezzare questi schemi di sterile contrapposizione ideologica e ricondurre gli ideali della politica alla realtà dei fatti.","606",0
"La politica senza principi è un pragmatismo senza speranza.","606",0
"Ma la politica senza soluzioni, concrete e praticabili, rende il futuro senza speranza.","606",0
"E’ con questa filosofia che il CENTRO DEMOCRATICO, assieme alle altre forze della coalizione di centro-sinistra, si candida a far ripartire l’Italia.","606",0
"Una ripartenza che riguarderà il modo di essere dell’Italia in Europa e nel mondo e che interesserà trasversalmente i diversi comparti dell’economia e della società italiana: dall’ammodernamento dello Stato Sociale all’energia, dal fisco alla finanza, dalla giustizia all’istruzione, dai trasporti all’edilizia, dal turismo alla cultura, dall’agricoltura alle infrastrutture, passando per tutte le diverse articolazioni della pubblica amministrazione.","606",0
"E’ in tutti questi comparti che vogliamo realizzare le grandi opere di cui il paese ha davvero bisogno.","411",0
"Grandi opere che possono essere attuate solo attraverso politiche di sviluppo che assumano l’equità, l’efficienza e la sostenibilità come principi guida della regolazione.","411",0
"Noi crediamo, infatti, che vincoli di bilancio ed esigenze di rilancio dell’economia, politiche d’inclusione e coesione sociale e di sostenibilità ambientale, non siano tra loro in conflitto, ma possano invece integrarsi in modo nuovo, per generare un valore aggiunto per il sistema paese e avviare una nuova stagione di cambiamento.","606",0
"Ed è su queste fondamenta, incentrate sul principio, d’ispirazione comunitaria, dello Sviluppo Responsabile, che si basa il Programma del CENTRO DEMOCRATICO.","606",0
"Un Programma fatto di soluzioni e impegni concreti, e coerente con la strategia per la crescita e l’occupazione dell’Unione Europea, che prevede, fin dagli inizi della prossima Legislatura, una terapia d’urto, tesa a ristabilire quel clima di fiducia, tra i cittadini e nei mercati, e di speranza nel futuro, indispensabile per far ripartire l’Italia che vogliamo.","606",0
"Il PROGRAMMA DEL CENTRO DEMOCRATICO",NA,0
"CCOSTRUIAMO  INSIEME  IL  GIORNO  MIGLIORE",NA,0
"IL GIORNO MIGLIORE",NA,0
"1. Quando l’Europa è più unita, solidale e democratica",NA,0
"Il Centro Democratico crede che un futuro prospero per l’Italia possa realizzarsi solo all’interno della cornice europea e che ogni pulsione antieuropeista fa male al paese e disonora le nostre stesse radici storiche, culturali e religiose.","108",0
"Cionondimeno, non possiamo far finta di non accorgerci che l’Unione europea è ancora purtroppo percepita da larga parte degli italiani solo come una tecnocrazia inflessibile, che assume le vesti di un guardiano severo dei nostri conti pubblici.","110",0
"Una tecnocrazia che chiede continuamente sacrifici agli italiani, assolutizzando la dimensione della disciplina di bilancio e del rispetto di rigide regole sul deficit, il debito e la spesa pubblica.","110",0
"Tale percezione non è del tutto priva di basi oggettive, poiché, almeno fino a pochi mesi fa, l’obiettivo di costruire un’Unione europea unita, solidale e democratica, capace di assicurare una crescita economica sostenuta, sostenibile e inclusiva, promuovere la competitività e potenziare l'occupazione, è stato posto in secondo piano rispetto a una logica monetarista, tesa esclusivamente a ripristinare la stabilità dei mercati finanziari sulla base di ricette di politica economica improntate al rigore e all’austerità di bilancio.","110",0
"Ricette che hanno contribuito ad attenuare, in via emergenziale, il circolo vizioso, all’origine dell’attuale crisi, tra finanza privata e debiti pubblici, ma che non hanno impedito la caduta in una profonda recessione dell’economia dell’eurozona, con tutte le conseguenti ricadute sul piano sociale.","110",0
"Di fronte a questa realtà, essere europeisti non significa, per noi, aderire acriticamente a tutti gli indirizzi che hanno sinora governato i processi decisionali dell’Unione.","110",0
"Noi riteniamo, infatti, che nel corso della crisi economico-finanziaria siano emerse tutte le fragilità della costruzione europea:a) sul piano politico, perché l’Unione ha reagito in ritardo e in modo ondivago al contagio che aveva colpito paesi come la Grecia, mostrandosi, agli occhi del mondo e dei mercati, come un insieme di Stati nazione privi di un vincolo solidaristico e di una solida architettura istituzionale e finanziaria;","110",0
"b) sul piano economico, perché l’UE, nel tentativo di superare le turbolenze sui mercati e le tensioni sui debiti sovrani, ha imposto ai paesi membri più fragili, tra cui l’Italia, l’adozione di manovre di consolidamento dei conti pubblici drastiche e accelerate, che in prima battuta hanno inibito il potenziale di crescita del prodotto e amplificato tendenze recessive già in atto.","110",0
"Manovre che sono state invocate senza tenere adeguatamente conto del fatto, evidenziato da recenti e qualificati studi di politica economica, che soprattutto per le economie in recessione e che registrano, come l’Italia, elevati oneri sul debito pubblico, sono di gran lunga preferibili aggiustamenti dei conti morbidi e graduali, rispetto a risanamenti aggressivi concentrati nel breve periodo, poiché in questi casi la chiave del successo del risanamento è favorire la crescita del prodotto, che è il comune denominatore dei parametri di finanza pubblica.","110",0
"Noi crediamo che questa impostazione, politica ed economica, dell’Unione europea, non abbia agevolato una più rapida uscita dalla crisi e che l’Italia abbia pagato in termini di spread i timori degli operatori finanziari relativi alla tenuta dell’euro, ovvero alla possibilità che l’Unione europea, prigioniera degli egoismi degli Stati nazionali, rinunciasse a una moneta unica e si frammentasse in un continente a diverse velocità.","110",0
"La speculazione finanziaria che ha colpito il nostro Paese nel novembre del 2011 non è derivata da una congiura internazionale orchestrata da chissà quali oscuri poteri forti, ma è il frutto di un freddo calcolo, che ha condotto gli operatori ad aggredire le parti marginalmente più deboli di un sistema politico, istituzionale ed economico – l’UE - che nel complesso non è percepito come coeso e solidale e in cui si sente la mancanza di forti istituzioni politiche, democraticamente legittimate e presidiate una banca centrale che assuma funzioni di garanzia e vesti di prestatore di ultima istanza, sul modello della Federal reserve statunitense.","110",0
"Per queste ragioni noi crediamo che oggi sia quanto mai necessario rilanciare, con molta più ambizione, il cammino dell’integrazione europea, per costruire una vera Unione politica, economica, fiscale e monetaria.","108",0
"I recenti progressi compiuti con l’introduzione del Semestre europeo e il rafforzamento della governance e delle procedure per il coordinamento delle politiche economiche degli Stati membri e la vigilanza comune del sistema bancario, vanno consolidati e affinati, ma occorre avere chiara la prospettiva di medio termine.","108",0
"All’avvio di una più intensa e comune disciplina di bilancio - determinato dalla riforma del Patto di stabilità e crescita, dalle nuove modalità di sorveglianza multilaterale e coordinamento delle politiche (i c.d. “six pack” e “two pack”) e, da ultimo, dall’approvazione del c.d. Fiscal Compact -deve corrispondere, simmetricamente, l’impegno di tutti gli Stati membri a proseguire sul sentiero dell’unificazione delle politiche e di una maggiore solidarietà.","108",0
"Il nostro Paese non può accettare di cedere ulteriori spazi di sovranità se non all’interno di un progetto politico complessivo e condiviso di superamento delle logiche intergovernative e di rilancio dell’Unione europea su basi federali, volto a conferire una piena legittimazione democratica alle sue Istituzioni e a dotarle di nuovi strumenti operativi per l’attuazione delle politiche di bilancio, monetarie, fiscali, per la condivisione dei rischi, per la difesa comune, la coesione sociale e la sostenibilità ambientale.","108",0
"La prospettiva degli Stati Uniti d’Europa, guidati da istituzioni scelte da cittadini e sostenute da una solida e autorevole banca centrale, è l’unica via percorribile non solo per sterilizzare gli attacchi speculativi sui debiti sovrani dei singoli Stati, ma, soprattutto, per preservare il modello sociale europeo e rilanciare, in tutto il continente, una crescita sostenibile e duratura.","108",0
"In assenza di questa prospettiva, l’Italia si ritroverebbe, nei prossimi anni, a dover semplicemente negoziare con le burocrazie europee, entro margini contabili sempre più ristretti, la propria politica economica e di bilancio, e anche il colore dei governi di volta in volta eletti perderebbe di significato, non potendo imprimere il proprio originale indirizzo politico.","108",0
"Per evitare che ciò accada occorre fin d’ora impostare le basi di un lavoro costituente della nuova Europa, che dovrà essere portato a compimento nella prossima legislatura, per far si che il nobile obiettivo dell’Unione di diventare un'economia intelligente, sostenibile e solidale, indicato nella Strategia Europa 2020, non rimanga scritto solo sulla carta.","108",0
"Nell’immediato, il consolidamento dell'Unione economica e monetaria presuppone non solo che ne sia completata l'architettura, ma anche che siano perseguite politiche di bilancio differenziate e volte a promuovere la crescita.","108",0
"A tal fine, compatibilmente con il principio del pareggio di bilancio, che dal 2014 assumerà una valenza costituzionale, il Governo che noi sosterremo dovrà far valere maggiormente in sede europea le ragioni dello sviluppo e della coesione sociale, sfruttando tutte le possibilità offerte dal vigente quadro normativo dell'UE per:a)  armonizzare la disciplina di bilancio con l’esigenza di far ripartire investimenti pubblici produttivi nei settori delle infrastrutture, della formazione, della ricerca, dell’innovazione e della cultura, escludendo dal computo del saldo rilevante ai fini del rispetto del Patto di stabilità e crescita e dall’aggregato di riferimento della regola sulla spesa, tutte le nuove spese destinate a tali finalità;","402",0
"b)   negoziare la possibilità, a fronte di un quadro congiunturale ancora recessivo, di discostarsi temporaneamente di almeno un punto percentuale dal proprio obiettivo di medio termine – ossia il pareggio di bilancio in termini strutturali – per realizzare una grande riforma strutturale del sistema tributario – da discutere ex ante  con le istituzioni UE - volta ad allargare le basi imponibili e ridurre le aliquote, per rilanciare consumi e investimenti e ridimensionare l’evasione fiscale e contributiva, con la previsione di un contestuale piano di rientro e di un meccanismo automatico di reversibilità dell’intervento qualora dallo stesso non discendessero gli esiti attesi in termini di crescita del prodotto e di mantenimento del gettito;","402",0
"c)  ottenere la facoltà, in particolare per sostenere il Mezzogiorno e le altre aree sottoutilizzate, di istituire ulteriori zone franche, di introdurre forme più estese e differenziate di fiscalità di vantaggio e di utilizzare in modo più flessibile i fondi strutturali europei;","402",0
"d)  negoziare la possibilità di escludere temporaneamente ed entro determinati limiti dalla nuova regola del debito le passività connesse alle garanzie statali accordate a banche e istituzioni finanziarie, quali ad esempio la Cassa depositi e prestiti, per la concessione di finanziamenti per l’attuazione di investimenti ambientali e macro progetti di sviluppo sostenibile, in particolare nei settori dell’energia e del ciclo delle acque e dei rifiuti.","402",0
"Queste richieste prioritarie, coerenti con la Strategia Europa 2020, dovrebbero essere avanzate subito dall’Italia in sede comunitaria, senza sbattere i pugni, ma a testa alta e con la consapevolezza di presentarsi con tutte le carte in regola: con un bilancio in pareggio strutturale e stabilizzato nel breve come nel lungo termine, anche grazie alla sostenibilità del suo sistema previdenziale e all’introduzione nella Costituzione del principio dell’equilibrio tra le entrate e le spese;","414",0
"con un sistema bancario assai più solido rispetto a quello di altri paesi;","414",0
"con un patrimonio pubblico molto vasto, un debito privato, di famiglie e imprese, inferiore del 20 per cento alla media europea, e un livello di ricchezza netta privata che è il quadruplo del suo debito pubblico e tra i più alti delle economie avanzate;","414",0
"con un sistema produttivo fatto di migliaia d’imprese, con una forte vocazione all’export, e con nicchie di eccellenza che tutto il mondo ci invidia nell’innovazione e nella ricerca scientifica e tecnologica.","401",0
"L’Italia non deve avere paura di far valere le proprie ragioni e di difendere un interesse nazionale che è perfettamente compatibile con quello dell’Europa.","107",0
"Ed è su queste fondamenta, ideali e programmatiche, che vogliamo riaffermare il prestigio e la leadership dell’Italia per una nuova Europa in un mondo che cambia.","107",0
"IL GIORNO MIGLIORE",NA,0
"2. Quando c’è più coesione sociale nello sviluppo",NA,0
"Le politiche che intendiamo adottare a livello nazionale riflettono direttamente la nostra concezione dell’Europa.","503",0
"Noi crediamo che il benessere e il progresso dei popoli non si misurino solo attraverso il livello del PIL.","503",0
"Così come il livello di civiltà e le virtù di una nazione non si risolvono nella sua capacità di tenere in ordine i conti pubblici.","503",0
