"content","cmp_code","eu_code"
"uno Statuto dei diritti delle persone con disabilità, recante l’indicazione dei livelli essenziali delle prestazioni assistenziali, dei sussidi e delle rete di servizi a sostegno e per la piena integrazione delle persone disabili e per coloro che abbiano dipendenze da droghe, alcol e farmaci.","504",0
"In questa imponente opera di riordino del Welfare italiano intendiamo porre al centro della nostra agenda il rafforzamento delle tutele per i bambini, le donne, gli anziani non autosufficienti e i disabili, che devono essere rese più incisive laddove maggiore è il bisogno effettivo di assistenza, incentrando i servizi su base comunale e rafforzando le forme di integrazione tra assistenza pubblica e associazioni nno-profit.","504",0
"In questo quadro, particolare attenzione dovrà essere posta al tema della natalità, per la quale il nostro impegno è un incremento del 10 per cento rispetto al trend degli ultimi anni, da promuovere attraverso un fisco modulato in base alle esigenze della famiglia (nei termini sopra indicati), una rete di protezione sociale avanzata e capillare e specifiche misure di sostegno, quali:il riordino selettivo e il rifinanziamento degli istituti di sostegno al reddito familiare (assegni per i nuclei familiari, indennità di maternità, ecc.) e il potenziamento di istituti quali i congedi parentali;","504",0
"l’introduzione di un bonus di 1000 euro annui per i primi tre anni di vita per ciascun nuovo figlio nato in nuclei familiari in possesso di un ISEE non superiore a 33.000 euro annui;","504",0
"l’introduzione di un assegno aggiuntivo di maternità pari a 300 euro mensili per 5 anni dalla nascita del figlio a favore delle puerpere in condizione di forte disagio economico, finalizzato a prevenire l’interruzione volontaria di gravidanza dettata dalla mancanza di risorse per il sostentamento della prole, da elargire attraverso il coinvolgimento dei consultori familiari, prendendo a riferimento il modello adottato nella regione Lombardia;","504",0
"l’attuazione di un piano straordinario di incremento annuo di 30.000 nuovi posti di asilo nido, con priorità nel Mezzogiorno, per raggiungere l’obiettivo europeo di 33 posti di asilo nido ogni 100 bambini da 0-3 anni;","504",0
"il potenziamento dei servizi socio-educativi per la prima infanzia, anche attraverso la ridefinizione della mission, l’accorpamento, ove necessario, e il rifinanziamento dei seguenti fondi: Fondo politiche per la famiglia; Fondo per l’infanzia e l’adolescenza; Fondo di credito per i nuovi nati; Fondo di solidarietà per i mutui per l’acquisto per la prima casa; Fondo genitori precari.","504",0
"Nell’ambito di un disegno complessivo di riordino dello Stato Sociale dovranno, infine, essere regolamentate le unioni civili, prevedendo per le persone dello stesso sesso legate da vincoli affettivi l’attribuzione di diritti, in particolare in materia di legislazione fiscale, regime patrimoniale e successorio e prestazioni sociali, e di doveri, in termini d’impegno a condurre una vita in comune e di aiuto e sostegno reciproco,","604",0
"senza tuttavia riconoscere alcuna prerogativa in tema di adozioni e senza confondere tali unioni con la famiglia tradizionale, che è e deve rimanere il cardine del sistema di protezione sociale.","603",0
"IL GIORNO MIGLIORE",NA,0
"7. Quando la giustizia e la legalità sono motori dello sviluppo",NA,0
"Una giustizia che funziona è condizione essenziale per la tutela dei diritti dei cittadini, per un sistema capitalistico efficiente e per una società equa.","303",0
"Queste finalità non sono adeguatamente assolte dal sistema giudiziario italiano, che costituisce uno storico tallone d’Achille del nostro Paese, che genera alti costi in termini civici ed economici.","303",0
"In Italia i processi sono troppi, lenti e farraginosi.","303",0
"Il contenzioso pendente civile è nell’ordine di 5 milioni di cause; il numero di processi avviati per abitante è doppio rispetto a quello della Francia, cinque volte superiore a quello della Danimarca e dieci volte superiore a quello della Svezia.","303",0
"La durata media di un giudizio civile d'appello è arrivata nel 2010 a quasi tre anni, con punte di quattro.","303",0
"Nello stesso anno, la prescrizione nel settore penale – che registra circa 3 milioni e mezzo di cause pendenti -ha interessato oltre 140 mila procedimenti.","303",0
"Il processo penale è vissuto dai suoi attori come una rincorsa a conseguire o a evitare la prescrizione del reato; gli imputati tendono più a difendersi “dal” processo che “nel” processo.","303",0
"L’organico della magistratura ordinaria non è ancora tutto coperto.","303",0
"Il restante personale addetto all’amministrazione giudiziaria è insufficiente o impiegato in modo inefficiente.","303",0
"Il processo d’infrastrutturazione informatica e digitalizzazione dei procedimenti non è ancora decollato.","303",0
"I cittadini sono sfiduciati, le aziende penalizzate e gli investitori esteri scoraggiati.","303",0
"Oltre ai costi sociali, l’arretratezza del sistema delle tutele giudiziarie ha un impatto negativo rilevante sulla crescita del prodotto, poiché incide sul clima di fiducia degli operatori, alterando le relazioni commerciali e deprimendo gli investimenti e la stessa crescita dimensionale delle imprese.","303",0
"Per affrontare il problema bisogna ricondurre l’efficienza e l’efficacia del servizio giustizia al centro dell’azione di Governo, investendo energie per valorizzare un asset fondamentale per il recupero di competitività del Paese.","303",0
"Le recenti iniziative intraprese in tema di accelerazione del processo civile, tribunale per le imprese e lotta alla corruzione, non risolvono i nodi del sistema in termini attese di giustizia, civile e penale, e di contrasto all’illegalità.","605",0
"A tal fine occorre anzitutto prendere atto che a distanza di venti anni dall’avvio delle inchieste di Mani Pulite non si è ancora riuscito a spezzare il circolo vizioso che lega -attraverso la zona grigia delle connivenze, delle infiltrazioni, dell’evasione e del sommerso – la criminalità economica, la corruzione e la criminalità organizzata.","605",0
"Anzi, nella lotta alla prima si sono compiuti sostanziali passi indietro, eliminando, di fatto, il falso in bilancio e gli altri delitti contro l’economia;","605",0
"la lotta alla corruzione ha ricevuto una risposta tardiva e largamente insufficiente con la legge approvata nei mesi scorsi;","605",0
"soltanto la lotta al crimine organizzato ha registrato un qualche progresso, grazie anche alle misure per l’informazione antimafia e la prevenzione patrimoniale.","605",0
"Bisogna invece agire per rafforzare in modo sinergico tutte queste attività, modificando le fattispecie delittuose, potenziando l’impianto sanzionatorio e mettendo in rete strumenti e risorse investigative.","605",0
"Quanto alla “irragionevole” durata dei processi – che ha causato all’Italia la condanna in innumerevoli ricorsi presso la Corte Europea dei Diritti dell’Uomo - occorre in primo luogo semplificare i riti e introdurre misure per la deflazione del contenzioso.","303",0
"Nel processo civile va valorizzato lo strumento della mediazione, intesa come “alternativa” alla giustizia (ossia confronto tra interessi, non controversia sui diritti) e non come una giustizia alternativa di secondo rango.","303",0
"Sul piano organizzativo, ferma restando l’esigenza di rafforzare la strumentazione informatica e di digitalizzare tutte le fasi del processo, occorre prevedere presso ogni ufficio giudiziario l’istituzione di un organismo manageriale che organizzi il lavoro secondo il metodo della programmazione e della efficiente ripartizione dei tempi e delle risorse, tecniche e umane.","303",0
"Deve essere ulteriormente ristretto il novero delle cause appellabili e deve essere resa effettiva la sanzione per le liti temerarie.","303",0
"Il Tribunale delle imprese, allo stato istituito solo in forma di sezione specializzata, deve essere potenziato e dotato di strumenti propri e agili;","303",0
"lo stesso assetto potrebbe essere esteso in altri ambiti, favorendo la specializzazione dei magistrati, istituendo, ad esempio, il tribunale della famiglia.","303",0
"Nel processo penale, oltre a una nuova disciplina delle intercettazioni, che va resa coerente con il diritto alla privacy, occorre riequilibrare il rapporto tra garanzie ed efficienza, in parte abusato in nome del malinteso principio costituzionale del giusto processo.","303",0
"La vittima del reato deve tornare al centro del processo penale;","303",0
"i termini di prescrizione devono essere ampliati e vanno scoraggiate le pratiche dilatorie.","303",0
"La cooperazione giudiziaria internazionale deve essere intensificata e occorre dare maggiori poteri ad Eurojust.","605",0
"Infine, per una Giustizia giusta il superamento dello stato di inciviltà e illegalità delle carceri – in termini di condizioni strutturali e sovraffollamento – deve costituire una priorità assoluta.","301",0
"La questione in Italia è abnorme, come testimoniano anche i recenti moniti dell’Unione europea.","301",0
"Occorre destinare maggiori risorse finanziarie per l’ampliamento e l’ammodernamento degli stabilimenti e investire nella formazione degli addetti (dirigenti e polizia penitenziaria).","303",0
"L’esecuzione della pena va ricondotta ai principi costituzionali di rieducazione, umanità e dignità, attraverso interventi mirati volti a favorire pene diverse dalla detenzione per la gran parte dei reati diversi da quelli contro la persona, anche ampliando l’utilizzo di strumenti quali il braccialetto elettronico per la detenzione domiciliare, facendo al contempo maggiore ricorso al mondo del no profit per la gestione delle pene alterative al carcere.","301",0
"In chiave di rieducazione e umanità della pena l’esperienza del carcere di Bollate dovrebbe costituire un modello per tutte le prigioni.","301",0
"IL GIORNO MIGLIORE",NA,0
"8. Quando il Sud è al centro della politica nazionale",NA,0
"In questi ultimi anni l’affermarsi della “questione settentrionale”, sponsorizzata in modo univoco dalla Lega, ha offuscato gli impegni per superare quel dualismo economico e sociale che da troppi decenni accompagna le vicende del nostro Paese.","402",0
"E soprattutto ha diffuso l’idea, carica di esiti negativi per la nostra stessa identità nazionale, di un Nord moderno, efficiente e produttivo, costretto a sostenere i costi di un Sud arretrato e fonte di sprechi.","402",0
"Noi crediamo che tutto ciò faccia male al paese tanto quanto le pulsioni populiste e antieuropeiste e che la sfida del rilancio dell’economia nazionale passi proprio dalla valorizzazione dello straordinario potenziale di crescita del Mezzogiorno d’Italia.","402",0
"La storia, e in particolare il processo di riunificazione della Germania, ci ha dimostrato come l’integrazione di aree caratterizzate da forti divari sia un’operazione non solo praticabile ma densa di opportunità, così come lo è lo stesso processo di unificazione dell’Europa.","402",0
"Per queste ragioni vogliamo invertire la tendenza, latente, a rimuovere il problema del Mezzogiorno e mettere il Sud al centro della politica economica nazionale, chiamando a raccolta tutti gli attori istituzionali, i corpi intermedi e la stessa società civile, all’insegna di un progetto complessivo capace di sciogliere i nodi strutturali dell’economia meridionale.","402",0
"I problemi del Mezzogiorno sono in larga gli stessi delle restanti parti del Paese, ciò che varia è soprattutto l’intensità: la carente cultura della legalità; la lentezza della giustizia civile e penale; il gap infrastrutturale; l’inefficienza degli apparati amministrativi; il cattivo uso e la scarsità delle risorse destinate alla ricerca, alla formazione e all’innovazione tecnologica; il peso dell’evasione fiscale e dell’economia sommersa e criminale; le prassi clientelari e d’intermediazione affaristica; la scarsa qualità di servizi pubblici fondamentali, quali la sanità, l’istruzione e trasporti.","402",0
"In questo contesto, fino ad oggi è mancata la determinazione delle istituzioni politiche, tanto nazionali che locali, nel perseguire gli obiettivi di crescita del Mezzogiorno.","402",0
"Ciò nonostante siano state intraprese alcune iniziative positive, come lo sblocco dei fondi nazionali per le infrastrutture, la riprogrammazione su alcuni obiettivi prioritari dei fondi strutturali europei e l’adozione del Piano per la povertà.","402",0
"Noi vogliamo rafforzare gli sforzi per fare del Sud d’Italia un volano della crescita dell’intero sistema Paese, adottando a tal fine un nuovo Programma straordinario per la crescita e l’occupazione nel Mezzogiorno, che agisca sinergicamente sul piano istituzionale e nei diversi ambiti della fiscalità, delle infrastrutture, dei servizi, definendo gli obiettivi strategici a tutti i livelli di governo: comunitario, statale e territoriale.","402",0
"Quanto all’Unione europea, occorre impegnarsi affinchè la riforma della politica di coesione non peggiori il saldo negativo tra contribuzione al bilancio europeo e finanziamenti ottenuti dall’Ue, evitando che al nostro Paese, già contribuente ""netto"" dell'Unione, siano sottratte rilevanti risorse.","402",0
"L’introduzione, in relazione ai fondi strutturali, della nuova categoria delle “regioni in transizione”, va resa coerente con gli obiettivi propri della politica di coesione di sostenere le regioni meno sviluppate, evitando il rischio di una contrazione significativa degli stanziamenti destinati all’Italia e, in particolare, di quelli rivolti alle regioni dell’attuale “obiettivo convergenza” per Calabria, Campania, Puglia, e Sicilia.","402",0
"Al contempo, bisogna perfezionare il processo già avviato di concentrazione delle risorse dei fondi strutturali su obiettivi prioritari e va garantito il totale utilizzo dei fondi europei, incrementando la qualità e l’efficacia della spesa anche attraverso l’utilizzo d’indicatori di risultato e la responsabilizzazione dei titolari della spesa, senza escludere l’esercizio dei poteri sostitutivi da parte dello Stato in caso inefficienze gestionali a livello territoriale.","402",0
"Inoltre, va negoziata in sede europea l’adozione, compatibilmente con la disciplina sugli aiuti di Stato, di nuove e incisive forme di fiscalità di vantaggio per le regioni meridionali, atte anche ad attrarre nuovi flussi d’investimenti esteri.","402",0
"A livello statale, va in primo luogo approvata la Carta delle Autonomie, per ridefinire un nuovo e più razionale assetto delle competenze dei diversi livelli territoriali e va reimpostato su nuove basi di autonomia e responsabilità degli enti decentrati il processo di attuazione del federalismo fiscale, di recente modificato sulla base di logiche emergenziali di risanamento del bilancio, prevedendo, tra l’altro, un più ampio coinvolgimento degli amministratori locali nel processo di definizione dei costi e dei fabbisogni standard previsto dai decreti attuativi della legge delega.","301",0
"In questo ambito, va altresì riformata la disciplina del Patto di stabilità interno, anche per renderla più flessibile con particolare riferimento all’utilizzo di avanzi di amministrazione per la realizzazione di politiche d’investimento che producano un effetto moltiplicatore di ricchezza sui territori interessati.","301",0
"Occorre, inoltre, procedere al più volte annunciato, e mai attuato, riordino degli incentivi e dei sussidi alle imprese, che dovrà essere ricalibrato incorporando nell’architettura del sistema le esigenze di riequilibrio territoriale, ferma restando l’esigenza di eliminare gli incentivi che non hanno dato gli effetti attesi in termini di sviluppo e occupazione e l’utilizzo delle relative risorse per la riduzione dell’IRAP.","402",0
"Agli strumenti di tipo orizzontale - che operando su tutto il territorio nazionale consolidano i punti di forza e di debolezza esistenti - vanno affiancati interventi mirati, anche sulla base delle predette forme di fiscalità di vantaggio, orientati in modo selettivo verso gli ambiti con maggiori potenzialità per l’economia meridionale, quali, il settore energetico e delle risorse naturali, il settore agro ambientale e quello del patrimonio storico-paesaggistico.","402",0
"Quanto alla dotazione infrastrutturale, occorre focalizzare gli investimenti per il Mezzogiorno nella logistica e nelle grandi reti portuali, ferroviarie e autostradali.","411",0
"E' infine necessario agire per ricondurre la finanza al servizio dell'economia reale e assicurare adeguati flussi di credito alle imprese e alle famiglie meridionali, anche potenziando la rete degli sportelli della Banca del Mezzogiorno e ampliandone gli ambiti di operatività e le leve finanziarie e patrimoniali.","402",0
"IL GIORNO MIGLIORE",NA,0
"9. Quando libertà, concorrenza e nuove politiche di sviluppo sostengono l’Italia che lavora",NA,0
"La riduzione della pressione fiscale e la riqualificazione della spesa pubblica non sono sufficienti a far ripartire la crescita e aumentare l’occupazione, se non si rimuovono in modo deciso le barriere di varia natura che limitano l’iniziativa economica privata e l’ingresso di nuovi operatori nel mercato dei prodotti e dei servizi.","401",0
"La libertà d’impresa e la concorrenza sono una garanzia di efficienza e produttività del sistema economico e un presidio fondamentale per difendere il potere di acquisto dei consumatori.","401",0
"Pagare meno tasse potrebbe non servire a nulla se al contempo aumentano i prezzi e le tariffe dei servizi cui nessuno può rinunciare (elettricità, gas, trasporti, banche, assicurazioni, servizi professionali, ecc.)","401",0
"Per queste ragioni noi ci impegniamo a rilanciare una vasta e radicale azione di liberalizzazione delle attività economiche che ponga al centro gli interessi del cittadino consumatore, contrasti i conflitti d’interesse e favorisca la nascita di nuove imprese.","401",0
"A tal fine occorre, tra l’altro, rafforzare l’operatività e i poteri sanzionatori delle Autorità di vigilanza e regolazione di settore, a cominciare dall’Antitrust;","403",0
"riformare il sistema dei servizi pubblici locali, in particolare nel settore dei trasporti, del ciclo delle acque e dei rifiuti, favorendo la contendibilità nelle gare per l’individuazione dei gestori, che devono essere vincolati a rigidi standard di qualità nell’erogazione dei servizi e sottoposti a procedure di continua valutazione da parte dell’utenza;","403",0
"completare i processi di separazione proprietaria tra le infrastrutture di rete e i fornitori dei servizi (come nel caso di rete ferroviaria/FS, rete gas/Snam ed Eni) ed eliminare i sussidi alle imprese distorsivi della concorrenza.","403",0
"Allo stesso modo, noi crediamo che il rilancio della crescita e dell’occupazione non possa essere affidato solo al pieno dispiegarsi delle forze del libero mercato e che le azioni a favore di una maggiore concorrenza nel sistema economico debbano essere affiancate da più audaci politiche per lo sviluppo.","410",0
"Gli sforzi finora compiuti e i pur apprezzabili interventi per la crescita, recentemente introdotti, sono, infatti, insufficienti a invertire con rapidità il circolo vizioso di contrazione dei consumi, degli investimenti e dell’occupazione che ha fatto precipitare l’Italia nella seconda e ancor più acuta, per i risvolti occupazionali, fase recessiva degli ultimi cinque anni.","410",0
"I nodi strutturali dell’economia italiana, grazie anche alle analisi condotte dalla Commissione europea, sono stati ampiamente messi a fuoco: il livello di competitività, in caduta libera a partire dalla fine degli anni ’90, come testimoniano la perdita di quote di mercato e il saldo delle partite correnti, passato da un surplus del 2% del PIL a un deficit del 3,2% nel 2011;","410",0
"la bassa produttività totale dei fattori e, in particolare, la perdita di competitività connessa al costo unitario del lavoro, che è peggiorata rispetto a tutti gli altri partner dell’eurozona;","410",0
"il basso livello specializzazione produttiva, che espone le esportazioni di prodotti ad alta intensità di lavoro e a bassa intensità tecnologica alle pressioni della competizione globale e limita la penetrazione commerciale nei mercati dei Paesi emergenti, e in particolare del Sud-est asiatico.","410",0
"E ancora: la scarsa partecipazione femminile al mercato del lavoro;","410",0
"le restrizioni all’accesso al credito e al capitale di rischio, in particolare per le PMI;","410",0
"la segmentazione e rigidità del mercato del lavoro e la mancanza di osmosi dello stesso con il sistema della formazione dell’istruzione;","410",0
"il gap  organizzativo e tecnologico della pubblica amministrazione;","410",0
"l’inadeguatezza infrastrutturale e delle interconnessioni;","410",0
"il costo dell’energia; l’inefficienza della giustizia civile; la complessità del sistema normativo.","410",0
"Tutti questi fattori, ampiamente noti, hanno fatto sì che l’Italia, negli ultimi 20 anni, abbia registrato tassi di crescita del PIL costantemente inferiori a quelli dei Paesi dell’Unione economica e monetaria.","410",0
"Ma capire le cause della malattia dell’economia italiana non è sufficiente per curarne i sintomi.","410",0
"Così come non basta condividere le raccomandazioni per la crescita, anch’esse apprezzabili, formulate dalla Commissione UE nell’ambito della procedura del Semestre europeo, se la loro traduzione sul piano interno non si realizza nell’ambito di un progetto complessivo di riforme radicali, capaci di generare uno shock macroeconomico nel breve termine - per far ripartire la domanda aggregata – e un riposizionamento del sistema economico nel medio e lungo periodo.","410",0
"La situazione dell’economia italiana richiede oggi una strategia di politica economica coordinata nei diversi ambiti e articolata in due fasi tra loro complementari: una fase emergenziale anticiclica, volta a evitare nell’immediato che il protrarsi della caduta del prodotto si trasformi in una riduzione strutturale della capacità produttiva e del potenziale di crescita, con la definitiva chiusura di aziende e perdita di posti di lavoro;","410",0
"e una fase di più largo respiro, volta a realizzare una profonda trasformazione e riconversione del tessuto economico e produttivo verso i settori a più elevato valore aggiunto.","410",0
"La riforma fiscale, sopra illustrata, da negoziare con le istituzioni europee nel rispetto dei vincoli di bilancio, è il mezzo principale attraverso il quale intendiamo combinare tra loro queste due fasi, in piena coerenza con gli obiettivi della Strategia Europa 2020.","410",0
"L’utilizzo selettivo della leva fiscale e la ricomposizione delle fonti di gettito può, nell’immediato: sostenere i consumi, attraverso la riduzione del prelievo per le fasce di reddito medio-basse;","410",0
"far ripartire gli investimenti privati, attraverso agevolazioni mirate anche a promuovere la ricerca, lo sviluppo e l’innovazione tecnologica, nonché ad attrarre gli investimenti esteri;","410",0
"ridurre il tasso di disoccupazione, attraverso incentivi per lo start up delle nuove imprese e per le assunzioni, in particolare di giovani e donne.","410",0
"Nel medio periodo la revisione del sistema tributario e l’emersione di basi imponibili connesso alla lotta all’evasione e all’economia sommersa, consentirà di rafforzare il processo di riduzione del prelievo e, in particolare, di riduzione del cuneo fiscale sul lavoro, promuovendo, nei termini sopra esposti, la competitività e la sostenibilità del sistema economico.","410",0
"Parallelamente, e contestualmente, occorre avviare una nuova e incisiva fase di spending review – incentrata anche sulla predetta revisione sistematica delle leggi sottese ai programmi di spesa – attraverso la quale reperire, nel breve termine, almeno 1 punto di PIL (16 miliardi di euro circa), da destinare al rilancio degli investimenti della pubblica amministrazione.","410",0
"La caduta verticale delle spese in conto capitale, passate dai 66 miliardi del 2009 ai 48 miliardi del 2011 e stimate in ulteriore contrazione sino al 2015, è una delle cause principali della caduta del PIL nazionale.","410",0
"Per uscire con più celerità dalla crisi non si può dunque prescindere dall’apporto anche della domanda pubblica, che attraverso la riqualificazione della spesa deve essere reindirizzata verso i settori con maggiori potenzialità di crescita e occupazionali: l’edilizia (residenziale, sanitaria e scolastica); la mobilità e la logistica; il riassetto idrogeologico; lo sviluppo urbano; il restauro dei beni culturali; la ricerca; la digitalizzazione della PA.","410",0
"Tale processo va reso sinergico con l’attuazione del Piano d’azione per la coesione, migliorando il tasso di assorbimento dei fondi strutturali europei, in particolare nel Mezzogiorno.","410",0
"Allo steso tempo, la riforma del Welfare, anch’essa sopra illustrata, deve essere modulata in modo tale da rendere gli istituti di protezione sociale funzionali alla crescita economica.","504",0
"In questo senso, una maggiore flessibilità del mercato del lavoro deve, inderogabilmente, essere subito accompagnata da una riforma del sistema degli ammortizzatori sociali che preveda un sistema integrato d’indennità per la disoccupazione involontaria e per i periodi di transizione verso nuovi posti di lavoro, la cui corresponsione va subordinata al diritto-dovere a partecipare a programmi di politiche attive del lavoro e di formazione permanente.","504",0
