"content","cmp_code","eu_code"
"Occorre, infine, intervenire per ridurre i costi della politica e l’area d’intermediazione affaristica che ruota intorno a una “certa” politica.","304",0
"A tal fine, dovrà essere approvato un disegno di legge di riforma costituzionale che preveda, tra l’altro, la riduzione del 30 per cento il numero dei parlamentari, l’accorpamento delle regioni, il superamento di talune non più giustificate peculiarità degli statuti speciali e l’abolizione delle province.","303",0
"Con legge ordinaria, andrà invece rafforzato l’obbligo di unione ed esercizio congiunto delle funzioni nei comuni con meno di 5000 abitanti,","303",0
"promossa la cessione delle partecipazioni pubbliche nelle società non quotate e non strategiche","303",0
"e introdotte nuove norme per la riduzione, la trasparenza e la certificazione delle spese di partiti, movimenti e gruppi politici.","304",0
"Bisogna, inoltre, introdurre una regolamentazione organica dell’attività di lobbying e di rappresentanza degli interessi, per rendere trasparente e ispirata a un codice etico la partecipazione dei gruppi di pressione al processo decisionale pubblico, nonché rafforzare gli strumenti e l’apparato sanzionatorio per la lotta alla corruzione nella pubblica amministrazione.","303",0
"Con un’azione ad ampio raggio impostata su queste basi spendere meno e spendere meglio, tagliare gli sprechi senza intaccare i diritti e i servizi pubblici, è possibile, a patto che ciascuno faccia la sua parte.","303",0
"IL GIORNO MIGLIORE",NA,0
"5. Quando il fisco equo garantisce crescita e sostenibilità",NA,0
"La grande assente della politica italiana degli ultimi venti anni è la Riforma fiscale.","503",0
"Il sistema tributario è stato oggetto di una miriade di micro interventi settoriali stratificati nel tempo, che hanno determinato un sistema frammentato e complesso, che ha moltiplicato gli adempimenti ed elevato oltre ogni logica economica la pressione fiscale in tutti i livelli di governo, minando al contempo, attraverso il ricorso ai condoni, la propensione ad assolvere i doveri fiscali.","503",0
"Per queste ragioni il Centro Democratico pone la riforma fiscale e la riduzione del prelievo su famiglie e imprese al centro del suo programma di Governo.","503",0
"Per ripartire, l’Italia ha bisogno di un fisco che sappia ripristinare il senso della fedeltà fiscale, con una rigorosa lotta all’evasione e all’elusione, per pagare meno pagando tutti;","503",0
"ha bisogno di un fisco amico delle famiglie, rivolto a incentivare la natalità, tutelare la maternità, garantire l’educazione dei nostri figli e l’assistenza ai nostri genitori;","503",0
"ha bisogno di un fisco intelligente, che premi il lavoro rispetto alle rendite e sostenga tutte le imprese che voglio crescere e internazionalizzarsi.","402",0
"La Riforma tributaria che sosteniamo, per latitudine e intensità, va ben oltre la pur condivisibile opera di manutenzione indicata nel disegno di legge delega presentato dal Governo Monti, ed è diretta, in particolare, a realizzare un FISCO:EQUO, fondato sulla lotta all’evasione e all’elusione fiscale e capace di assicurare una forte riduzione del prelievo, a partire dai redditi medio-bassi, e garantire maggiore equità verticale e orizzontale, ponendo la famiglia al centro di un sistema integrato di sostegno e protezione sociale;","503",0
"COMPETITIVO, diretto a detassare e incentivare, con meccanismi stabili, automatici e selettivi, le imprese che intendono crescere, patrimonializzandosi e allargando la base occupazionale, ed innovare, nonché indirizzato ad attrarre gli investimenti diretti esteri;","402",0
"SOSTENIBILE, diretto a promuovere consumi ecosostenibili e agevolare le imprese certificate che rispettino standard di produzione ambientalmente e socialmente responsabili.","501",0
"Per realizzare un FISCO EQUO è necessario:Rafforzare la lotta all’evasione e all’elusione fiscale e contributiva, i cui proventi devono essere destinati in via automatica a un Fondo per la riduzione del prelievo a favore delle persone fisiche e delle imprese.","605",0
"L’evasione in Italia ha una consistenza abnorme rispetto ai maggiori partner europei e rappresenta una “pandemia” che comporta una gravissima alterazione dell'intero sistema economico, provocando danni ingenti alle imprese, che si trovano, di fatto, a competere in un mercato distorto, e alle famiglie, che devono subire un prelievo eccessivo a fronte di servizi scadenti.","605",0
"La lotta all'evasione non deve rappresentare, pertanto, un mero strumento per incrementare le entrate, ma per rendere più equo ed efficiente il sistema economico, alleviando la pressione tributaria sui contribuenti e le imprese oneste in conformità a un nuovo patto con il fisco, reso cogente da un meccanismo automatico di destinazione del maggior gettito alla riduzione delle aliquote fiscali.","605",0
"Per rafforzare la lotta all’evasione, intendiamo in particolare agire attraverso:il potenziamento del fisco telematico - con la previsione di un sistema diffuso anche tra privati e interconnesso con l’Agenzia delle entrate di fatturazione elettronica con firma digitale e della possibilità di effettuare la dichiarazione dei redditi","605",0
"on line con assistenza dedicata -e degli strumenti del redditometro /spesometro, affinché si possa procedere a controlli mirati in base alla “coerenza” tra indicatori di consumi, investimenti e risparmi rispetto ai redditi dichiarati;","605",0
"la definizione di un sistema integrato ispettivo e di accertamento tributario da parte di Agenzia delle entrate, Guardia di finanza ed enti territoriali, in particolare i comuni, e il rafforzamento del sistema della riscossione, per ridurre l’ampia forbice tra accertato e riscosso, superando al contempo forme di vessazione fiscale nei confronti dei contribuenti in buona fede che a causa della crisi non riescono a onorare i propri debiti fiscali;","605",0
"l’introduzione di un meccanismo innovativo di contrasto fiscale d’interessi, che preveda la detraibilità dal reddito di tre tipologie di spesa da estrarre a sorte ogni anno ad opera dell’Agenzia delle entrate nell’ambito di un elenco di 12 categorie di spese ad alto rischio di evasione (quali, ad esempio, le spese per piccole manutenzioni domestiche -giardiniere/fabbro/idraulico/elettricista/ecc -, per i circoli ricreativi; per i servizi professionali - avvocati/commercialisti/ecc.-, nonchè le spese effettuate in taluni esercizi commerciali - ristoranti, bar, alberghi).","605",0
"L’elevata percentuale della detrazione spettante – che va fissata in misura almeno doppia rispetto all’aliquota IVA applicabile al relativo bene o servizio incluso nell’elenco - e il meccanismo di estrazione a sorte della spesa detraibile da effettuare al termine del periodo di imposta, hanno l’effetto di minimizzare l’impatto della misura sulla finanza pubblica e di massimizzarne gli effetti in termini di emersione di basi imponibili, atteso che i contribuenti, nell’alea, sarebbero indotti a richiedere e conservare fatture e scontrini di tutte le tipologie di spesa incluse nel paniere delle spese detraibili;","303",0
"la previsione della detraibilità delle spese bancarie per l’utilizzo delle carte di pagamento e di credito, per favorire la diffusione della moneta elettronica;","303",0
"l’abbassamento a 500 euro della soglia per i pagamenti in contanti;","303",0
"il coinvolgimento dell’ordine dei dottori commercialisti nella lotta all’evasione per contrastare il diffondersi di pratiche elusive, in particolare nella fiscalità d’impresa;","605",0
"l’introduzione di una migliore disciplina antielusiva generale in forza della quale, in virtù del principio generale dell'abuso del diritto tributario, il contribuente non possa trarre indebiti vantaggi fiscali dall'utilizzo distorto di strumenti giuridici idonei ad ottenere un risparmio fiscale, in difetto di ragioni economicamente apprezzabili che giustifichino l'operazione, diverse dalla mera aspettativa di risparmio fiscale;","605",0
"il rafforzamento dei profili di responsabilità e sanzionatori per le dichiarazioni mendaci infedeli, prevedendo il raddoppio delle sanzioni, anche di carattere penale, per gli evasori totali o parziali che sottraggono al fisco imposte per importi superiori a 100.000 euro;","605",0
"la riforma della giustizia tributaria e la costituzionalizzazione dei principi dello Statuto dei diritti del contribuente, oggetto in passato di ripetute violazioni.","605",0
"Riformare il sistema d’imposizione, al fine di spostare il carico fiscale dal lavoro alle rendite finanziarie, al patrimonio e ai consumi di lusso e recanti esternalità negative, attraverso un insieme di modulare d’interventi via via espandibili in ragione dell’emersione di base imponibile derivante dalla lotta all’evasione.","503",0
"In particolare, gli interventi prevedono:la rimodulazione delle aliquote e degli scaglioni IRE finalizzata a ridurre l’incidenza del prelievo, a partire dai redditi inferiori a 50.000 euro annui, con elevazione della no tax area e la previsione di un sistema di imposta negativa per gli incapienti;","503",0
"il riordino del sistema delle detrazioni e deduzioni, al fine di concentrare le agevolazioni sulle seguenti priorità: sostegno alla famiglia e alla natalità, compreso il diritto alla casa; incentivi al lavoro femminile e al no profit; spese ambientalmente sostenibili; contrasto all’evasione e all’economia sommersa;","503",0
"la revisione del sistema impositivo sulle rendite finanziarie, con l’elevazione al 25% dell’aliquota ordinaria dell’imposta sostitutiva sui redditi da capitale e la previsione di un regime differenziato per interessi, dividendi, plusvalenze, con parziale attrazione di tali redditi nell’imposizione personale progressiva (sul modello tedesco e olandese) al fine di scoraggiare la speculazione a breve termine,","503",0
"fermo restando il regime di esenzione totale per le nuove emissioni di BTP a rendimenti contenuti di cui sopra e la previsione di regimi speciali per altri titoli pubblici, per i fondi della previdenza complementare e per i rendimenti di alcune tipologie di fondi d’investimento;","402",0
"l’unificazione in un’unica fattispecie impositiva di diverse forme di prelievo patrimoniale esistenti (immobili in Italia e all’estero e attività finanziarie, barche, velivoli, automobili, ecc.), con aliquote progressive per i patrimoni superiori a 2,5 milioni di euro;","303",0
"la revisione dell’IMU e delle rendite catastali degli immobili, finalizzata a rendere l’imposta meno sperequata e a ridurre l’incidenza del prelievo sulla prima casa attraverso: l’introduzione di una franchigia di 200.000 euro sulla base imponibile per le prime case non di lusso, al fine di esentare dall’imposta chi attualmente paga, ad aliquota base, circa 600 euro;","503",0
"la previsione della detraibilità dall’imposta, fino a un massimo di 1000 euro, delle spese per interessi corrisposti per mutui ipotecari stipulati per l’acquisto dell’abitazione principale, per la quota d’interessi che non trova capienza nell’attuale detrazione del 19% dall’imposta sul reddito;","503",0
"la messa a regime della detrazione IMU per ciascun figlio residente nell’abitazione;","503",0
"la ridefinizione delle aliquote in senso più progressivo, in particolare per i grandi patrimoni immobiliari, in base a scaglioni d’imposizione formati dalla somma dei valori catastali facenti capo a ciascun soggetto passivo, tenendo conto della composizione del nucleo familiare;","503",0
"la razionalizzazione delle imposte indirette, con un aggiornamento delle modalità di tassazione Iva sui diversi beni e servizi e l’alleggerimento delle imposte sui trasferimenti immobiliari, anche per favorire la ripresa del settore delle costruzioni.","402",0
"Per realizzare un FISCO COMPETITIVO è necessario ridurre la pressione fiscale e contributiva e razionalizzare il sistema impositivo in modo selettivo, sostenendo la crescita delle imprese e l’innovazione dei processi produttivi.","402",0
"A tal fine, intendiamo:ridurre il cuneo fiscale sul costo del lavoro, in primo luogo incrementando ulteriormente le deduzioni dalla base imponibile IRAP del costo del lavoro per ciascun dipendente assunto a tempo indeterminato, con particolare riferimento ai giovani under 35 e alle donne;","402",0
"riordinare il sistema delle tax expenditures per le imprese, al fine di ricondurre le riduzioni del prelievo obbligatorio a 5 principali agevolazioni fiscali (al netto di quelle dedicate alla sostenibilità, di cui si dirà oltre), di carattere automatico, dirette a incentivare:","402",0
"l’allargamento della base occupazionale, con particolare riferimento all’assunzione di giovani e di donne (credito d’imposta nuove assunzioni);","402",0
"i nuovi investimenti produttivi (credito d’imposta investimenti);","402",0
"le attività di ricerca e sviluppo, anche con le università (credito imposta R&S);","402",0
"la costituzione di reti di impresa e distretti produttivi,","402",0
"la riallocazione nel territorio nazionale di impianti produttivi detenuti all’estero;","402",0
"introdurre uno specifico regime fiscale di vantaggio per attrarre gli investimenti esteri con rilevante impatto occupazionale, da indirizzare prioritariamente al Mezzogiorno, che preveda il coinvolgimento nella definizione di programmi di incentivazione degli enti territoriali, prendendo a riferimento l’esperienza statunitense;","402",0
"semplificare drasticamente il sistema fiscale, eliminando inutili adempimenti, utilizzando in modo intensivo i mezzi tecnologici/digitali per il dialogo con l’Amministrazione finanziaria e definendo un unico codice delle leggi tributarie.","402",0
"Inoltre, in una fase congiunturale di severa contrazione del prodotto e di aumento marcato della disoccupazione, come quella attuale, occorre altresì introdurre una misura straordinaria, volta a favorire un’inversione di tendenza, quale la completa sterilizzazione della componente contributiva del cuneo fiscale a carico delle imprese e dei lavoratori per i nuovi occupati e per un periodo di tre anni dalla data di assunzione.","402",0
"Infine, per realizzare un FISCO SOSTENIBILE occorre introdurre criteri di sostenibilità trasversali a tutto il sistema fiscale, volti a riconvertire il mercato verso un modello di sviluppo ambientalmente e socialmente responsabile, seguendo un’impostazione di politica economica diretta a passare un approccio difensivo, fondato sul mero sostegno alla domanda e sul ripristino della competitività dei costi, a una strategia di attacco, articolata sul versante dell’offerta e imperniata sulla ricerca, l’innovazione e la qualità sostenibile in tutti gli anelli della catena del valore.","416",0
"A tal fine, è necessario:incentivare gli investimenti ambientali, favorendo i processi di riconversione ecologica dell’apparato produttivo attraverso la detassazione del reddito d’impresa reinvestito in beni capitali diretti a introdurre eco-innovazioni di processo o di prodotto atte a prevenire, ridurre o riparare i danni ambientali;","416",0
"promuovere una massiccia adesione delle PMI ai sistemi comunitari di eco-gestione, audit ambientale e certificazione della qualità ecologica di processo e di prodotto (quali i marchi comunitari Emas ed Ecolabel), nonché ai sistemi internazionali di certificazione della responsabilità sociale d’impresa (quali il SA 8000), mediante l’introduzione di uno specifico credito di imposta per gli oneri sostenuti dalle imprese ai fini dell’ottenimento delle certificazioni;","416",0
"rimodulare il quadro impositivo (accise) sui prodotti energetici per promuovere l’utilizzo di prodotti a minor impatto ambientale, prevedendo, conformemente alla disciplina comunitaria, un regime fiscale differenziato in base al livello di concentrazione di inquinanti generati attraverso la combustione, introducendo al contempo una tassazione specifica sul consumo di combustibili fossili ad alto potenziale inquinante che tenga conto della specificità delle imprese soggette al sistema europeo di emission trading;","416",0
"promuovere la mobilità sostenibile e il rinnovamento del parco veicoli (pubblici e privati) ad alto potenziale inquinante e non conforme alla più recente normativa comunitaria in materia di emissione dei veicoli a motore, anche attraverso la revisione delle tasse automobilistiche e la ridefinizione delle modalità di riparto del Fondo per il trasporto pubblico locale;","416",0
"stabilizzare il credito d’imposta per le ristrutturazioni edilizie che comportino interventi di incremento dell’efficienza energetica degli edifici;","416",0
"rivedere i criteri di applicazione dell‘IMU anche al fine di consentire ai comuni di agevolare gli immobili che risultino dotati di particolari dispositivi per il risparmio energetico e che siano costruiti conformemente ai criteri della bioarchitettura e della bioedilizia;","416",0
"favorire l’accesso al capitale di rischio delle PMI innovative attraverso l’introduzione di un’aliquota ridotta del 12,5 % sui frutti e i proventi derivanti dal risparmio affidato in gestione a fondi comuni di investimento ecologici e a fondi etici, debitamente certificati da Consob e Banca d’Italia;","416",0
"introdurre una tassazione agevolata, in forma di riduzione dell’aliquota dell’imposta sul reddito delle società (IRES) ovvero di determinazione forfettaria dell’imponibile, diretta a favorire, per il primo anno di attività e per i due esercizi successivi, le start-up che iniziano un’attività produttiva in settori di rilevanza strategica per le politiche di sostenibilità (raccolta differenziata, riciclaggio e smaltimento con recupero di energia dei rifiuti; produzione e vendita di energia elettrica e idrogeno prodotti da impianti di piccola e media taglia alimentati con fonti rinnovabili; implementazione del patrimonio boschivo finalizzata a incrementare il potenziale nazionale di assorbimento di carbonio; raccolta e trasformazione dei residui agricoli per lo sfruttamento energetico delle biomasse).","416",0
"Per attuare una riforma fiscale di questa portata occorrono spazi di manovra in termini di saldi di finanza pubblica, necessari non certo per eludere i vincoli di bilancio, ma per consentire la messa a regime di un nuovo sistema fiscale che determinerà una massiccia ricomposizione del gettito e sfasamenti temporali nell’andamento delle entrate, i quali potrebbero non essere compatibili con il rigido rispetto dell’obiettivo di medio termine dell’Italia, che per gli anni 2014 e 2015, a seguito delle manovre adottate, non presenta alcun margine di manovra.","416",0
"Per queste ragioni, in conformità alla nuova governance economica europea e al Fiscal compact, all’inizio della prossima legislatura intendiamo sottoporre il progetto di riforma fiscale alle istituzioni europee, per negoziarne l’attuazione nel rispetto delle compatibilità finanziarie previste dal quadro legislativo vigente.","414",0
"IL GIORNO MIGLIORE",NA,0
"6. Quando il Welfare rassicura le famiglie",NA,0
"La riforma dello Stato Sociale è la seconda grande riforma che è mancata negli ultimi anni e su cui vogliamo scommettere per inverare la nostra idea di Sviluppo Responsabile.","504",0
"Noi crediamo, infatti, che l’Italia abbia quanto mai bisogno di un nuovo Welfare, familiare e generazionale, che sappia realmente promuovere la dignità della persona e le sue potenzialità nel corso delle diverse fasi della vita.","504",0
"Un welfare che non si esaurisca nell’assistenzialismo di vecchio stampo, ma che sappia davvero rassicurare i cittadini, dare certezza all’avvenire dei giovani, maggiori opportunità alle donne, più tutele agli anziani, per ripristinare quella coesione sociale e territoriale indispensabile a rimettere in moto le energie dormienti del paese.","504",0
"Noi crediamo che l’Italia, per rispettare i vincoli di bilancio, non abbia bisogno di relegare migliaia di lavoratori nella categoria degli “esodati”, ma di una ristrutturazione del sistema delle prestazioni sociali e dei sussidi assistenziali che sia l’occasione per riequilibrare la composizione anomala della spesa, troppo orientata, rispetto ai più avanzati paesi europei, sui trattamenti pensionistici, a scapito dei trattamenti di disoccupazione, integrazione salariale e sostegno alla famiglia.","504",0
"Noi crediamo che l’Italia abbai bisogno di nuove politiche attive per l’occupazione, che affianchino al maggior grado di apertura del mercato del lavoro un’incisiva riforma della rete degli ammortizzatori sociali, atta a incoraggiare la mobilità e la formazione professionale, senza determinare odiosi fenomeni di precarizzazione del lavoro, e che preveda l’introduzione di un sistema universale di assicurazione contro la disoccupazione.","504",0
"In questa prospettiva, la Riforma del Welfare che vogliamo deve partire da una puntuale definizione dei diritti sociali spettanti ai cittadini, che devono essere modulati in base alla loro effettiva situazione economica, al fine di creare un sistema integrato di prestazioni, da erogare ai diversi livelli di governo, capace di accompagnare le persone lungo tutto l’arco della vita: dai servizi all’infanzia, alle misure di contrasto alla povertà e alla disoccupazione di sostegno alla famiglia, dalle prestazioni sociosanitarie e di tutela della non autosufficienza ai trattamenti assistenziali e previdenziali.","504",0
"In un quadro di risorse scarse, va attuata una revisione selettiva della spesa in materia sociale, volta a:definire a livello statuale i livelli essenziali di tutte le prestazioni sociali che devono essere garantiti in modo uniforme sull’intero territorio nazionale;","504",0
"razionalizzare le funzioni e le competenze in materia sanitaria, sociale e assistenziale tra i diversi livelli di governo territoriale, differenziando i compiti assegnati ai diversi enti anche in base alla loro dimensione, al fine incrementarne l’efficienza, accorpando ove necessario le strutture territoriali di produzione dei servizi sanitari e di protezione sociale;","504",0
"riordinare il sistema dei sussidi assistenziali e previdenziali, delle prestazioni garantite dal servizio sanitario nazionale e delle misure di sostegno al reddito, parametrando i servizi erogati, in base ad un nuovo Indicatore di Situazione Economica Equivalente (ISEE) del nucleo familiare da applicare in modo omogeneo a livello nazionale e locale.","504",0
"L’obiettivo di tali indirizzi è di modulare l’intensità e l’estensione dei diversi interventi in base all’effettiva situazione economica e capacità contributiva dei cittadini, assicurando prioritariamente la protezione sociale ai soggetti più deboli e bisognosi.","504",0
"Non si tratta di rinunciare a una concezione di welfare universalistico - che dovrà continuare a fornire servizi sociali per tutti i cittadini - quanto piuttosto di introdurre una scala di priorità, richiedendo, laddove necessario alla compatibilità economica del sistema, un contributo ai ceti più abbienti per l’accesso a talune prestazioni, da definire in base ad un nuovo ISEE che consenta:una “mappatura” della reale “ricchezza” di tutti i cittadini, ossia di tutte le componenti reddituali (inclusi i trasferimenti monetari esenti da imposizione e i redditi da capitale non rientranti nella dichiarazione IRPEF) e patrimoniali dei nuclei familiari (immobili, partecipazioni societarie, ecc), nonché delle passività (affitti prima casa, mutui, prestiti, ecc);","503",0
"l’esatta individuazione dei pesi dei diversi carichi familiari, in particolare figli e persone disabili a carico, sulla base di una scala di equivalenza idonea a rendere confrontabile l’effettiva situazione economica delle famiglie.","503",0
"All’interno di questa logica complessiva - e ferma restando l’esigenza di razionalizzare le modalità di erogazione dei servizi, articolando in modo nuovo i compiti tra i diversi livelli di governo, per aumentarne efficienza ed economicità -","303",0
"occorre, in particolare, aggiornare lo schema sotteso alla legge quadro 328 del 2000 e ridefinire la normativa in materia di federalismo fiscale (l.42/2009), approvando, con legge dello Stato: uno Statuto dei diritti della vita, dell’infanzia e dell’adolescenza, recante l’indicazione dei livelli essenziali delle prestazioni e dei diritti fondamentali di cittadinanza per i nati sul territorio della Repubblica e la relativa disciplina organica del sistema integrato di servizi socio-educativi per la prima infanzia e del complesso degli istituti di protezione dei minori:  dalle misure volte a difendere la vita e promuovere la natalità, sino a quelle tese a tutelare i minori in situazioni di disagio","504",0
"e ad assicurare l’accesso agli asili nido e il diritto allo studio, a contrastare la dispersione scolastica, a combattere la povertà minorile, ecc., in coerenza con i principi della Convenzione ONU sui diritti del fanciullo del 1989;","506",0
"uno Statuto dei diritti della famiglia, recante l’indicazione dei livelli essenziali degli interventi di sostegno ai nuclei familiari e il riordino, in correlazione con la riforma del sistema fiscale, dei diversi istituti di protezione sociale della famiglia (assegni familiari, assegni per le famiglie con minori di tre anni, social card, maternità, congedi parentali e misure per il sostegno delle responsabilità familiari e la conciliazione tra vita professionale e vita familiare; assistenza domiciliare integrata e servizi domus oriented per la cura delle famiglie con anziani non autosufficienti), prendendo a riferimento le indicazioni del Piano nazionale di politiche familiari approvato nel giugno del 2012;","504",0
