"content","cmp_code","eu_code"
"Le finanze pubbliche sane sono la premessa essenziale e inderogabile per assicurare la crescita del prodotto, ma entrambi non bastano per realizzare una società giusta e costruire un’economia moderna e sostenibile, rispettosa delle persone e dell’ambiente e con lo sguardo sempre rivolto alle generazioni future.","503",0
"Per questa ragione il nostro Programma di governo vuole imprimere una svolta radicale, per cambiare in profondità il modello di sviluppo e una politica che ha cumulato solo debiti, senza riuscire a fornire servizi pubblici efficienti e di qualità, senza ridurre le sempre più intense disuguaglianze sociali, e senza a garantire a tutti, e in particolare ai giovani e alle donne, opportunità di lavoro e crescita professionale.","503",0
"Per compiere questa svolta occorre agire in sintonia con l’Europa e valorizzarne tutte le potenzialità.","503",0
"L’Europa che vogliamo e in cui ci riconosciamo non è fatta solo di rigore, di vincoli e di parametri di finanza pubblica, ma sottende una nuova idea di progresso e di futuro, che vuole coniugare assieme, in modo nuovo, capitalismo e solidarietà, economia ed ecologia, finanza ed etica.","503",0
"Un’idea che mira a realizzare una società aperta e coesa, attraverso l’affermazione di un modello di sviluppo responsabile in cui la crescita economica sia intelligente, grazie a investimenti più efficaci nell'istruzione, la ricerca, l'innovazione e la cultura;","503",0
"sostenibile, grazie alla scelta decisiva a favore di un'economia a basse emissioni di Co2, per combattere i cambiamenti climatici e favorire la competitività dell'industria;","503",0
"e, soprattutto, solidale, ossia concentrata in via prioritaria a creare posti di lavoro e a ridurre le tuttora vaste sacche di povertà.","503",0
"Come ha scritto il Presidente della Repubblica nel suo ultimo messaggio alla nazione, “una rinnovata visione dello sviluppo economico non può eludere il problema del crescere delle diseguaglianze sociali”, perché “si riconosce ormai, ben oltre vecchi confini ideologici, che esso è divenuto fattore di crisi e ostacolo alla crescita proprio nelle economie avanzate”.","503",0
"Ed è proprio in questa nuova dimensione di Sviluppo Responsabile che il CENTRO DEMOCRATICO intende agire, per realizzare politiche pubbliche innovative, che sappiano tradurre concretamente nell’ordinamento italiano i principi di civiltà e di progresso che fin dalle origini sono alla base della costruzione europea.","108",0
"Di fronte alla grave crisi che attanaglia ancora il paese, intendiamo definire, all’inizio della prossima Legislatura, un pacchetto di riforme strutturali incisivo, che tenendo assieme esigenze di sviluppo, coesione sociale e vincoli di finanza pubblica, possa dare una scossa al Paese, invertire le aspettative negative e avviare una stagione di rinascita.","408",0
"Il Programma di governo s’incentrerà su sei assi strategici, nel quadro di un processo di complessivo ammodernamento delle Istituzioni e delle Amministrazioni pubbliche:","408",0
"1. Politica di Bilancio: rispetto dei vincoli UE, razionalizzazione della spesa pubblica e abbattimento dello stock di debito.","414",0
"Per ricomprare il nostro futuro","414",0
"2. Riforma Fiscale: lotta all’evasione, riduzione della pressione fiscale e spostamento del prelievo dal lavoro alle rendite, i patrimoni e i beni di lusso o recanti esternalità negative sul piano ambientale.","605",0
"Un nuovo Fisco per l’equità, la crescita e l’occupazione","503",0
"3. Riforma dello Stato Sociale: definizione dei livelli essenziali delle prestazioni e riordino della rete dei servizi sociali e del sistema dei sussidi assistenziali e previdenziali, del servizio sanitario nazionale e delle misure di sostegno al reddito, finalizzato a estendere le tutele modulando le prestazioni erogate sulla base della ricchezza effettiva dei cittadini, misurata in base a un nuovo Indicatore di Situazione Economica Equivalente.","501",0
"Il nostro Welfare al servizio delle famiglie","504",0
"4. Riforma della Giustizia e tutela della Legalità: razionalizzazione normativa e gestionale e investimenti tecnologici per la riduzione dei tempi medi dei processi civili e penali, certezza e umanità delle pene, lotta alla criminalità e alla corruzione.","605",0
"Per una Giustizia giusta","605",0
"5. Politiche per lo Sviluppo: riduzione del cuneo fiscale, liberalizzazioni, accesso al credito, ricerca e sviluppo, infrastrutture e rilancio degli investimenti pubblici, valorizzazione dei beni culturali, piano straordinario e fiscalità di vantaggio per il Mezzogiorno, pieno utilizzo dei Fondi strutturali europei e sostegno all’export.","402",0
"Per far ripartire l’Italia che compete","402",0
"6. Riforma dello Stato e della Pubblica Amministrazione: ridefinizione di funzioni e competenze dei diversi livelli di governo, revisione della spesa, PA digitale, semplificazioni, merito e valutazione dei risultati.","303",0
"Per uno Stato amico dei cittadini","303",0
"In via generale, la nostra politica economica intende operare una massiccia riallocazione delle risorse finanziarie pubbliche diretta a favorire la crescita e l’occupazione, incentrata, dal lato delle spese, su:l’eliminazione di sprechi e inefficienze e l’indirizzamento della spesa verso impieghi più produttivi – con un raffreddamento della spesa corrente a fronte di un innalzamento della quota degli investimenti pubblici -, da realizzare attraverso la prosecuzione, con un nuovo approccio, della spending review, allargata a tutte le amministrazioni pubbliche, sulla base del metodo dei costi e dei fabbisogni standard e dell’ottimizzazione dei modelli organizzativi e dei bacini di utenza nell’erogazione dei servizi pubblici,","303",0
"nonché la razionalizzazione, da operare a livello parlamentare, delle migliaia di autorizzazioni legislative di spesa che compongono i 174 programmi del Bilancio dello Stato;","303",0
"la rimodulazione del quantum e della platea dei beneficiari delle diverse tipologie di servizi sociali, prestazioni sanitarie, agevolazioni tariffarie e sussidi assistenziali, sulla base di un nuovo Indicatore di Situazione Economica Equivalente (ISEE);","503",0
"e, dal lato delle entrate, su:la lotta all’evasione fiscale e contributiva e il contrasto all’economia sommersa;","605",0
"la riforma fiscale, da realizzare con una riduzione del prelievo, a partire dai ceti medio-bassi, una diversa tassazione sui redditi da capitale,","503",0
"una revisione selettiva dell’imposizione sulle imprese per favorirne la competitività,","402",0
"la soppressione di alcuni regimi speciali e di esenzione fiscale, la revisione delle imposte indirette e il riordino dei diversi tributi di natura patrimoniale in un’unica fattispecie impositiva sulle grandi ricchezze;","503",0
"la dismissione delle partecipazioni azionarie pubbliche non strategiche e degli asset immobiliari","401",0
"e la valorizzazione delle concessioni demaniali sui beni pubblici.","413",0
"La riqualificazione della spesa pubblica, assieme a un allargamento delle basi imponibili conseguente alla lotta all’evasione, sono i pilastri attraverso i quali il Centro Democratico intende reperire le risorse necessarie a ridurre il prelievo fiscale sul lavoro e le imprese, per far ripartire consumi, investimenti e occupazione, e sostenere con maggiore equità i cittadini più deboli e svantaggiati.","605",0
"Oltre il 16 per cento di economia sommersa, 120 miliardi di euro di entrate sottratte ogni anno al fisco e circa 60 miliardi di costi diretti, sempre su base annua, derivanti dai fenomeni di corruzione, costituiscono le fragilità sistemiche dell’Italia, che il Centro Democratico intende aggredire con la massima determinazione per ricondurre il Paese su un sentiero di crescita.","605",0
"In particolare, i principali obiettivi di bilancio, quantificati su base annua a regime al termine della prossima legislatura, consistono:nella riduzione di circa un terzo delle imposte evase, per un maggior gettito strutturale pari a 44 miliardi di euro;","605",0
"nella riduzione di oltre 20 miliardi di euro – rispetto all’andamento tendenziale a legislazione vigente - della spesa corrente al netto degli interessi, da realizzare a valere sulle spese per consumi intermedi e mediante la razionalizzazione dei programmi di spesa del bilancio dello Stato, la riduzione dei costi della politica e il riordino istituzionale e la modulazione su base ISEE delle prestazioni sociali e dei sussidi assistenziali;","503",0
"nell’alleggerimento del carico fiscale che grava sulle persone fisiche e di quello fiscale e contributivo che grava sulle imprese, per un importo pari, complessivamente, a circa 50 miliardi di euro;","402",0
"nella destinazione alla spesa per investimenti di risorse pari a 16 miliardi di euro;","402",0
"nella ridefinizione del sistema degli ammortizzatori sociali e nel potenziamento delle politiche sociali, per un importo pari a 13 miliardi di euro;","504",0
"nell’adozione di interventi di sostegno all’istruzione, scolastica e universitaria, e alla ricerca, per un importo annuo di 3 miliardi di euro.","506",0
"Al contempo, ci proponiamo di avviare un piano di dismissione delle partecipazioni azionarie e del patrimonio immobiliare pubblico e di valorizzazione delle concessioni pubbliche (dai beni demaniali alle frequenze tv), dal quale generare entrate, da destinare alla riduzione dello stock di debito, pari, alla fine della prossima legislatura, a circa 120 miliardi di euro.","401",0
"La tabella allegata in calce illustra il quadro riassuntivo delle risorse e degli impieghi conseguenti all’attuazione delle misure contenute nel presente Programma di governo.","0",0
"IL GIORNO MIGLIORE",NA,0
"3. Quando abbattendo il debito ci riappropriamo del nostro futuro",NA,0
"Il primo obiettivo, senza il quale ogni impegno del Programma rimarrebbe una promessa irrealizzabile, è il rispetto dei vincoli di bilancio derivanti dal Patto di Stabilità e Crescita e dal Fiscal Compact.","414",0
"A tal fine, la politica di bilancio dovrà sfruttare in modo intelligente tutti gli spazi di manovra consentiti dall’attuale quadro legislativo europeo, agendo in modo coordinato e sinergico sia sul nominatore, sia sul denominatore, del rapporto debito/PIL.","414",0
"L’Italia dovrà pertanto realizzare riforme strutturali in grado di imprimere una forte accelerazione all’uscita dalla crisi, mantenendo in equilibrio i flussi di finanza pubblica - per assicurare il pareggio, corretto per gli effetti del ciclo, tra entrate e spese, richiesto dal nuovo articolo 81 della Costituzione –, nonché aggredire lo stock  di debito, per ridurre il peso della spesa per interessi, prevista nel bilancio programmatico presentato dal Governo Monti in crescita dai circa 74 miliardi annui registrati nel 2011 a oltre 100 miliardi stimati nel 2015.","414",0
"Per ridurre stabilmente il debito, occorre mantenere un quadro di finanza pubblica che garantisca un avanzo primario nell’ordine del 5 per cento del PIL.","414",0
"Al contempo, occorre implementare il processo di valorizzazione del patrimonio pubblico e aggiornare il quadro normativo per l’attuazione di un piano pluriennale di dismissioni di quote delle partecipazioni azionarie non strategiche detenute dallo Stato, anche attraverso la Cassa depositi e prestiti, in società quotate (Eni, Enel, Finmeccanica, Terna, STMicroelectronics) e non quotate (Ferrovie, Poste, RAI, ecc..), di vendita del patrimonio immobiliare statale e di valorizzazione delle concessioni pubbliche (dai beni demaniali alle frequenze televisive).","401",0
"Inoltre, nell’ambito di una complessiva revisione del federalismo fiscale e alla luce della recente riforma costituzionale che ha introdotto il principio del concorso alla sostenibilità del debito per tutte le amministrazioni pubbliche, bisogna affiancare ai parametri di virtuosità previsti nel ambito del Patto di stabilità interno meccanismi atti a indurre l’effettiva dismissione degli immobili delle autonomie territoriali e la cessione delle partecipazioni azionarie nella società esercenti servizi pubblici detenute dalle Amministrazioni locali, destinando i relativi introiti alle riduzione del debito (sia di quello ad esse facenti capo, pari a circa 116 miliardi di euro, sia, in secondo luogo, di quello statale).","401",0
"Nel complesso, stimiamo di generare dai processi di dismissione, privatizzazione e valorizzazione del patrimonio pubblico entrate pari a circa 120 miliardi in termini cumulati nel periodo 2013-2018, da destinare alla riduzione dello stock di debito, nonché, nel breve periodo e in quota parte, alla liquidazione dei debiti della PA nei confronti delle aziende fornitrici di beni e servizi.","401",0
"Se tali misure contribuiranno a contenere il costo del servizio del debito, riteniamo tuttavia che per abbassare lo “spread”, ancora troppo elevato nonostante i progressi compiuti, e affrancarsi da una possibile recrudescenza delle tensioni speculative sul proprio debito sovrano, l’Italia non possa permettersi di attendere i possibili sviluppi europei in tema di “eurobond” o di evoluzione del ruolo della BCE;","414",0
"né tantomeno attendere l’avvento di un governo politico ed economico dell’Europa su base federale.","414",0
"Per ridurre la volatilità dello spread  nelle operazioni di rifinanziamento  e alleggerire la zavorra dei 2000 miliardi di debito pubblico occorre agire  anche  con misure volte a:ridurne il costo, sterilizzando il differenziale di rendimento rispetto ad analoghi titoli tedeschi;","414",0
"allungarne le scadenze, elevando la durata media dei titoli di Stato da 6,5 a 8/10 anni;","414",0
"aumentarne (dal 60 all’80%) la quota detenuta da investitori domestici, istituzionali e non, sul modello del Giappone.","414",0
"A questi fini, le opzioni strategiche che proponiamo - da abbinare alla ricetta tradizionale, ma niente affatto semplice da realizzare, della valorizzazione e dismissione del patrimonio pubblico – consistono nel lancio di nuova tipologia di titoli del debito pubblico a un tasso d’interesse analogo a quello dei titoli tedeschi, la cui sottoscrizione verrebbe incentivata dalla previsione di una completa esenzione fiscale sui relativi rendimenti, nonché dalla revisione dei regimi d’imposizione patrimoniale e dall’applicazione di un’imposta sui patrimoni superiori a 2,5 milioni di euro.","402",0
"In particolare, prevediamo:l’introduzione dell’esenzione totale dall’imposta sostitutiva sui redditi da capitale e da ogni forma di imposizione patrimoniale sui cespiti finanziari per i sottoscrittori residenti di nuove emissioni speciali di Buoni del Tesoro Poliennali, della durata minima di 10 anni, che il Ministro dell’economia e delle finanze sarebbe autorizzato ad emettere alla pari con un tasso annuo di rendimento sensibilmente inferiore a quello di mercato (è ipotizzabile un rendimento eguale al tasso riconosciuto per analoghi titoli tedeschi, oppure indicizzato al tasso di crescita del PIL, con minimo garantito e tetto massimo);","402",0
"e il contestuale riordino delle attuali diverse fattispecie impositive di natura patrimoniale (su immobili e attività finanziarie detenuti all’estero, prelievi sui capitali “scudati”, barche, velivoli, auto di lusso, ecc.) in un’unica imposta progressiva sulle grandi ricchezze, attribuendo al contribuente, come opzione alternativa al versamento del prelievo di natura patrimoniale, la facoltà di sottoscrivere, per un importo pari a un multiplo del valore del prelievo, i speciali BTP di cui sopra.","402",0
"Tale operazione, che potrebbe essere introdotta in via sperimentale, non configura, come da taluni pur suggerito, un prestito “forzoso”, quanto piuttosto una sorta di prestito “indotto”, assistito da un regime fiscale premiale, che potrebbe dare un segnale importante ai mercati della volontà dell’Italia di coinvolgere cittadini e istituzioni in una grande operazione di nazionalizzazione del debito e avere riflessi indiretti anche sui tassi d’interesse delle emissioni ordinarie, generando risparmi rilevanti da utilizzare per abbatterne lo stock e rilanciare la crescita.","402",0
"In ogni caso, tale iniziativa va inquadrata nell’ambito di un vasto disegno riformatore, focalizzato a elevare il potenziale di crescita dell’economia italiana; crescita senza la quale gli impegni adottati per la riduzione della quota del debito pubblico eccedente il 60 per cento del Pil per un ventesimo all’anno in media degli ultimi tre anni non sarebbero pienamente sostenibili, né dal punto di vista economico e finanziario, né, tantomeno, sul piano del mantenimento della coesione sociale e territoriale.","402",0
"IL GIORNO MIGLIORE",NA,0
"4. Quando spendendo meglio garantiamo i diritti di tutti",NA,0
"Negli ultimi anni le manovre correttive di finanza pubblica che si sono succedute hanno invertito la tendenza a una costante e forte crescita della spesa primaria.","303",0
"I tagli alla spesa pubblica - indispensabili per procedere a una riduzione della pressione fiscale che giungerà, nel 2013, al 45,3 per cento del PIL -, sono stati però realizzati, in larghissima parte, con riduzioni lineari alle dotazioni di bilancio, ispirati alla logica, ultra liberista, “dell’affamare la bestia”, ove la “bestia” è stata rappresentata anzitutto dalle regioni e dai comuni italiani, cui sono state sottratte risorse indispensabili per continuare a garantire quantità e qualità dei servizi offerti ai cittadini, e in particolare ai più bisognosi, nei segmenti vitali della società moderna, quali la scuola, la sanità, l’assistenza agli anziani, la casa.","303",0
"Nel processo di riduzione della spesa è mancata una scala di priorità, e i tagli hanno colpito pesantemente le spese in conto capitale e i settori chiave per lo sviluppo, dove è invece necessario riqualificare la spesa e investire, come nel caso dell’istruzione, e settori vitali, che sono ormai da tanti anni in sofferenza, come quelli della giustizia, della sicurezza pubblica e della cultura.","303",0
"Il blocco del turn-over e la mancanza di risorse finanziarie hanno posto molte amministrazioni nella concreta impossibilità di esercitare le funzioni e fornire i servizi di propria competenza.","303",0
"Nei tribunali oggi mancano gli addetti per dattilografare gli atti; nella scuola i professori, troppo spesso umiliati e sottopagati, devono supplire a gravi carenze di dotazioni materiali; nei commissariati talvolta mancano persino le risorse per cambiare i pezzi di ricambi delle volanti; i siti archeologici sono abbandonati all’incuria e crollano.","303",0
"E così anche nella sanità, gli ospedali, in particolare quelli delle regioni commissariate, hanno subito tagli drastici, e in taluni casi retroattivi, del budget, che hanno comportato severe riduzioni delle prestazioni sanitarie.","303",0
"A chi, con incauta leggerezza, invoca tagli draconiani alla spesa pubblica, rispondiamo che non sa quello di cui sta parlando.","303",0
"Perché un conto è eliminare sprechi, inefficienze, enti e attività inutili che lo Stato non deve svolgere e che vanno affidati, secondo una logica di sussidiarietà, ai privati, altro è ridurre le tutele e i diritti e peggiorare la qualità dei servizi.","303",0
"E il rischio che abbiamo di fronte è proprio questo.","303",0
"E’ svilire il dibattito su una questione fondamentale semplificandolo in una chiave ideologica tra i fautori del meno Stato e meno tasse, e quelli del più Stato e più tasse.","303",0
"Non è con quest’approccio che si risolvono i problemi dell’Italia, ma con un nuovo metodo, che superi la logica dei tagli lineari, adottata dal centro-destra, e che renda migliore e assai più incisiva la spending review avviata dal Governo Monti.","303",0
"Noi crediamo che le difficoltà sinora incontrate per attuare una revisione selettiva della spesa pubblica non nascano solo dalle pressioni di lobby e corporazioni, ma anche dal fatto che tale processo è stato sempre ricondotto esclusivamente al Governo e a quelle stesse strutture ministeriali non di rado resistenti al cambiamento.","303",0
"Per tale ragione riteniamo necessario un cambio di strategia, che renda partecipi di tale processo il Parlamento, le autonomie territoriali e i dirigenti delle amministrazioni pubbliche responsabili della gestione delle risorse.","303",0
"La scelta di dove e come tagliare ovvero rimodulare e riqualificare la spesa è una scelta squisitamente politica, che deve essere esercitata in primis nel luogo della democrazia, ovvero nelle Camere.","303",0
"Oltre ai grandi comparti di spesa pubblica della previdenza, della sanità e dei consumi intermedi per acquisto di beni e servizi, il nostro ordinamento prevede, iscritte nel bilancio dello Stato, migliaia di singole autorizzazioni legislative di spesa, sparse nei più svariati ambiti e raggruppate in oltre 170 programmi.","303",0
"Per questa ragione proponiamo l’Istituzione nella prossima legislatura, senza oneri aggiuntivi, di un’apposita Commissione parlamentare bicamerale, cui assegnare il compito di procedere -d’intesa con il Governo, con le singole commissioni di merito e con il supporto delle istituzioni esperte in materia di finanza pubblica - al vaglio di tutte le norme di spesa, ai fini della definizione di un progetto complessivo di semplificazione e riordino dei programmi di spesa, e delle leggi sottostanti, del bilancio dello Stato, attraverso il quale potranno essere diversamente sagomati il perimetro e le articolazioni della pubblica amministrazione, e individuate le finalità e le attività da eliminare, perché non più attuali o essenziali, e quelle che invece vanno potenziate o rifinanziate, quali, in primis, l’istruzione, scolastica e universitaria, e la ricerca.","303",0
"Simmetricamente, noi crediamo che l’individuazione dei costi standard e la scelta dei modelli gestionali più economici ed efficienti sia, invece, una scelta prettamente tecnica, che va rimessa all’autonomia e responsabilità dei dirigenti pubblici, la cui retribuzione deve essere sempre più legata ai risultati ottenuti in termini di ottimizzazione dei costi a servizi invariati.","303",0
"Per ridurre e riqualificare la spesa pubblica bisogna quindi implementare il processo di definizione dei costi e dei fabbisogni standard delle amministrazioni, centrali e locali.","303",0
"Tale processo, assieme alla centralizzazione delle procedure di acquisto, dovrà eliminare le enormi differenze di costo dei beni e servizi sul territorio nazionale, particolarmente evidenti nel settore della sanità, dove si stima peraltro che oltre il 25 per cento della spesa sia frutto di odiosi fenomeni d’intermediazione politica, che devono essere contrastati con il massimo rigore possibile, affinché il funzionamento del sistema sanitario nazionale sia presidiato da criteri di efficienza, merito e qualità professionale, e non da quello dell'appartenenza politica.","303",0
"E’ necessario, a tal fine, sganciare le nomine dei manager sanitari dalla politica e legare una quota significativa della loro retribuzione al raggiungimento di obiettivi di servizio nei tempi e nella qualità delle prestazioni – anche al fine di ridurre i tempi di attesa per le prestazioni sanitarie - sulla base di un sistema di misurazione dei risultati e di custumer  satisfaction.","303",0
"Il grado di soddisfazione degli utenti del servizio sanitario nazionale dovrà costituire il parametro di riferimento per modulare le retribuzioni e i percorsi di carriera di direttori sanitari e per la nomina dei dirigenti.","303",0
"Nella medesima prospettiva, occorre rivisitare la normativa in materia di federalismo fiscale, allineando tra l’altro al livello degli enti più virtuosi le spese di back-office e di funzionamento, ivi comprese quelle per il personale.","303",0
"Dovranno, inoltre, essere riorganizzati e razionalizzati gli enti intermedi, nonché, più in generale, ripensate alcune scelte in materia di riparto di funzioni e competenze tra livelli di governo, al fine di individuare i bacini di utenza ottimali in termini di economie di scala per la fornitura dei servizi pubblici (giustizia, sanità e istruzione in primis) a livello territoriale.","303",0
"Ampi margini di ottimizzazione dei costi andranno poi rinvenuti nel superamento del grave ritardo tecnologico e organizzativo della pubblica amministrazione, in cui vanno stimolate innovazioni di processo e di prodotto e applicate celermente le novità introdotte in materia di Agenda digitale; la banda larga e l’accesso a internet ad alta velocità dovranno essere configurati come un servizio universale che consenta, attraverso le tecnologie digitali, anche di interagire con la PA dal computer o dalla tv di casa.","303",0
"Quanto al pubblico impiego, bisogna proseguire, ma in modo selettivo, nel processo di riduzione degli organici, promuovendo la flessibilità organizzativa e la mobilità dei dipendenti pubblici, che dovranno essere di meno ma più qualificati e produttivi, agendo al contempo per ridurre ancora le consulenze esterne e il ricorso a prestazioni al di fuori della disciplina del pubblico concorso.","303",0
"Occorre quindi rendere effettivi la cultura della valutazione dei risultati e i criteri di merito e competenza per gli avanzamenti di carriera, prevedendo altresì che le retribuzioni pubbliche siano allineate alla media dei maggiori paesi europei, incrementandole ove opportuno – come ad esempio nel caso degli insegnanti - e riducendole laddove si manifestano eccessi ingiustificati rispetto alla qualità, alla quantità e alle responsabilità del lavoro svolto a servizio dello Stato.","303",0
