"text","cmp_code","eu_code"
"7) Sanità e Scuola: la società del bene comune",NA,NA
"Lo Stato italiano produce ormai un livellamento verso il basso di prestazioni e servizi, e non riesce più a promuovere verso l’alto chi sta indietro nella scala sociale.","606",NA
"L’Unione di Centro lavora, viceversa, per ridefinire lo Stato sociale, per un nuovo grande modello da costruire in Italia e in Europa: la Welfare Society.","606",NA
"Quest’ultima si potrebbe anche definire come “la società del bene comune”.","606",NA
"Una società dove la responsabilità della gestione sociale è affidata anche ai corpi intermedi della comunità.","606",NA
"Nella quale il livello privato e il livello statale cooperino e competano nell’offerta di servizi formando, insieme, un unico sistema pubblico all’interno del quale sia più plurale e libera possibile la scelta dei cittadini e delle famiglie.","606",NA
"L’equazione che chi governa le moderne società europee deve risolvere è la seguente: come mantenere in piedi il carattere universale della tutela sociale riuscendo, nel contempo, a innalzare la qualità e l’efficienza dei servizi.","504",NA
"Ebbene, le comunità umane non hanno fino a oggi trovato altro strumento per accrescere la qualità di qualsiasi sistema che far ricorso alla gara, alla concorrenza, all’emulazione.","504",NA
"La soluzione del problema sta dunque nella costruzione di un Sistema Misto generalizzato nel quale, soprattutto nella Sanità e nella Scuola, il cittadino possa avere piena “libertà di scelta” tra una pluralità competitiva di offerte, private e statali.","504",NA
"Il che vuol dire l’esatto contrario della cosidetta “privatizzazione dei servizi sociali”: significa, al contrario, far entrare, a pieno titolo, nelle regole del sistema pubblico anche l’offerta privata, chiamando a intervenire imprese, cooperative, mondo del no-profit.","504",NA
"Si determinerebbe così, tra l’altro, un pieno coinvolgimento della società nella gestione dei servizi, accrescendo la responsabilità di tutti verso il “bene comune”.","504",NA
"Finora è accaduto esattamente l’opposto.","504",NA
"8) Una nazione ad “energia libera”",NA,NA
"Un Paese moderno deve avere la capacità di conciliare lo sviluppo con la qualità della vita.","501",NA
"Tutela del territorio e crescita economica devono camminare insieme.","501",NA
"Siamo per la politica del “sì”: per fare della difesa dell’ambiente non solo uno slogan, ma una politica.","501",NA
"Sì allo sviluppo delle fonti energetiche rinnovabili,","501",NA
"insieme a un rientro serio, consapevole e rapido nel nucleare.","411",NA
"Riteniamo inoltre indispensabile riportare in capo allo Stato gli indirizzi di fondo di tutta la politica energetica, strategica per un Paese che ha bisogno di ridurre i costi e di non diventare nel tempo una nazione a “sovranità limitata” di energia.","411",NA
"Nell’era della globalizzazione l’autonomia energetica è una funzione decisiva della stessa autonomia della democrazia.","411",NA
"• Sì alla realizzazione delle grandi infrastrutture che, velocizzando la movimentazione, riducono l’inquinamento.","411",NA
"• Sì alla ricerca e al sostegno delle nuove tecnologie ambientali per evitare il continuo finanziamento d’impianti ormai superati.","501",NA
"Condizione per riuscire a superare il devastante effetto Nimby (“fate tutto basta che non sia vicino a me”) è infine la buona gestione degli impianti industriali e l’accesso trasparente alle informazioni, per ridare fiducia nelle istituzioni e rendere partecipi i cittadini del loro futuro.","411",NA
"9) Tornare a vedere nel Mezzogiorno una risorsa",NA,NA
"“ Un Paese moderno deve essere capace di conciliare lo sviluppo con la qualità della vita",NA,NA
"Nella Grande Mutazione imposta dalla globalizzazione il Mezzogiorno del nostro Paese può assumere un ruolo geopolitico di grande importanza strategica nel rapporto con il Medio Oriente e con l’Africa.","402",NA
"Si tratta di una nuova frontiera della quale soprattutto l’Italia può avvantaggiarsi nella leadership mediterranea.","402",NA
"Nazioni più dinamiche della nostra, come la Spagna, l’hanno già compreso.","402",NA
"Viceversa la “questione meridionale” è avvertita dalla nostra opinione nazionale come un problema irrisolvibile, o quasi; di certo, non come una risorsa.","402",NA
"La debolezza del tessuto economico associata alla inadeguatezza delle politiche hanno consolidato l’idea che si tratti solo di una società fragile, permeabile alla violenza della criminalità organizzata che si limita a selezionare i propri gruppi dirigenti in ragione dei localismi.","402",NA
"Eppure, ci sono tante risorse ed intelligenze: vocazioni territoriali inespresse, la più alta percentuale di giovani laureati, una varietà di piccole associazioni e di movimenti di ispirazione cattolica o a difesa della legalità.","402",NA
"Si tratta, però, di tante monadi, con le quali la politica deve avere il coraggio di misurarsi in maniera innovativa, aiutandole ad organizzarsi insieme e per riaccendere la speranza nel cambiamento possibile.","402",NA
"Questo è e sarà l’impegno dell’Unione di Centro perché il Mezzogiorno è la parte dell’Italia che può crescere di più e costituisce, quindi, una straordinaria opportunità per tutto il Paese.","402",NA
"Altre nazioni in Europa, che hanno investito con coraggio sui territori in deficit di sviluppo hanno realizzato poi incrementi significativi del loro PIL.","402",NA
"Ciò perché in un’economia globale non ci si può permettere di correre con una gamba più corta dell’altra.","402",NA
"10) Il merito al primo posto",NA,NA
"L’insieme di questi grandi obiettivi non potrà mai essere raggiunto se non si diffonderà nel Paese una nuova cultura diffusa: la promozione del merito in tutti i campi della vita pubblica.","503",NA
"I quarant’anni che ci separano dal ’68 hanno fatto diventare senso comune idee del tutto opposte, soprattutto la devastante equazione tra selezione di merito e selezione di classe.","503",NA
"È vero esattamente il contrario: l’utopia dell’egualitarismo, che livella verso il basso, è infatti la tomba dell’emancipazione sociale.","503",NA
"I ricchi, infatti, possono cavarsela in tanti modi, ma se ai figli dei poveri togli la chance del merito e del talento, li condanni all’inferno.","503",NA
"L’uguaglianza delle opportunità è la nostra bussola, perché il destino sociale di emarginazione può essere combattuto dai giovani meno fortunati solo in una società che promuove il merito.","503",NA
"L’assistenzialismo è conservatore.","503",NA
"La promozione del merito è rivoluzionaria.","503",NA
"L’assenza di questa consapevolezza è forse il tributo più alto che l’Italia di oggi paga all’egemonia culturale delle sinistre.","305",NA
"In virtù di questa ideologia siamo diventati un Paese bloccato, pansindacalizzato, nel quale, per eccellere, ormai si può solo fuggire all’estero.","305",NA
"La situazione dell’Italia non è affatto semplice.","305",NA
"Troppi sono i ritardi accumulati, troppe le contraddizioni di una politica superficiale e a volte irresponsabile.","305",NA
"Ma in virtù della nostra fiducia nel popolo italiano ci sentiamo di affermare che non abbiamo paura della crisi.","305",NA
"Perché il passaggio storico che stiamo attraversando, oltre ad evidenti gravi difficoltà, offre anche inedite opportunità, il possibile sorgere di un nuovo atteggiamento collettivo, responsabile e fattivo.","305",NA
"“L’assistenzialismo è conservatore. La promozione del merito è rivoluzionaria. È arrivato il tempo del coraggio ”",NA,NA
"Ebbene, proprio intorno all’affermarsi di questa chance l’Unione di Centro chiama gli italiani a raccolta.","305",NA
"Lo ripetiamo: è il tempo del coraggio.","305",NA
"CONCLUSIONI",NA,NA
"Ancora una volta la storia ci chiede di essere liberi e forti.","305",NA
"Liberi da ogni conformismo, da ogni meschinità, da ogni pegno da pagare alle oligarchie costituite.","305",NA
"Forti della nostra identità cristiana e liberale, dei valori dei nostri padri che vogliamo trasmettere ai nostri figli, forti del nostro giuramento di servire, sempre e comunque, il bene comune degli italiani.","305",NA
"Liberi perché liberali e popolari.","305",NA
"Forti perché cristiani.","305",NA
"Liberi di dire la verità sull’Italia.","305",NA
"Forti perché oggi il vento del declino che minaccia il nostro paese pretende saldezza di principii e spirito di sacrificio.","305",NA
"Per rimettere l’Italia in piedi ci vuole coraggio.","305",NA
"Il coraggio di contestare luoghi comuni, verità di comodo, rendite di posizione.","305",NA
"Il coraggio di saper rischiare.","305",NA
"Ebbene, noi questo coraggio l’abbiamo e lo stiamo dimostrando, sfidando da soli l’attuale finto bipartitismo e le sue oligarchie.","305",NA
"Per rimettere l’Italia bisogna ripristinare il senso dell’autorità.","603",NA
"Per decenni ci è stato raccontato che, dietro ogni autorità si nascondeva autoritarismo, che dietro ogni ordine sociale si nascondeva repressione, che dietro il rigore degli studi si nascondeva una limitazione delle libertà personali; che il professore a scuola era come il padrone in fabbrica.","603",NA
"Il risultato è sotto i nostri occhi: hanno perso autorità lo Stato, la scuola, gli insegnanti, la famiglia.","603",NA
"Il principio di autorità è invece elemento essenziale di ogni comunità umana.","603",NA
"L’autorità dei genitori è essenziale per la crescita dei figli.","603",NA
"La madre e il padre non dovrebbero trasformarsi in amici, fratelli o sorelle del proprio figlio.","603",NA
"L’autorità degli insegnanti è altrettanto essenziale per la crescita dei ragazzi: a condizione che essa derivi dalla competenza e dalla capacità pedagogica, troppo spesso oggi minacciate dalla dequalificazione di una categoria che tende a ripiegare verso il ruolo del dipendente pubblico piuttosto che a esaltare la dignità dell’educatore.","603",NA
"L’autorità dello Stato è necessaria per rendere effettive la sicurezza e la giustizia.","605",NA
"Negli ultimi decenni si è messo l’accento sulle garanzie degli imputati.","605",NA
"È stato giusto.","605",NA
"Ma si è finito per dimenticare di difendere i diritti delle vittime.","201",NA
"Del terrorismo, della violenza, degli rapine, degli stupri.","201",NA
"Questa grave carenza, sommata ai lunghi tempi dei processi e all’incertezza o alla debolezza delle pene, ha finito per logorare ogni autorità delle istituzioni.","201",NA
"Per rimettere l’Italia in piedi, ci vuole serietà.","305",NA
"Bisogna saper dire anche cose impopolari, chiudere i libretti dei sogni oggi dispensati a piene mani, trattare gli italiani per come sono: cittadini adulti, gente operosa, professionisti responsabili.","305",NA
"Per rimettere l’Italia in piedi, ci vuole amore per il bene comune.","606",NA
"Ci vuole una grande apertura mentale, quasi una rivoluzione culturale, per indurre noi stessi ad anteporre sempre l’interesse generale alle logiche di partito, di clan, di clientela.","606",NA
"Il bene comune dovrebbe essere l’obiettivo primario della politica.","606",NA
"Eppure in Italia esso giace dimenticato nell’archivio della storia, offeso da una lotta tra caste che inquina l’intera vita nazionale.","606",NA
"“L’Italia del coraggio, della serietà, del bene comune. Ecco a chi rivolgiamo l’appello di condividere la nostra sfida",NA,NA
"L’Italia del coraggio, l’Italia della serietà, l’Italia del bene comune.","305",NA
"Ecco l’Italia alla quale rivolgiamo l’appello di condividere la nostra sfida.","305",NA
"È un’Italia che esiste e resiste, smarrita di fronte agli arbitrii e al disordine, ma sempre consapevole dei doveri.","305",NA
"È l’Italia dei nostri soldati che, rischiando la vita, fanno il loro dovere in tutto il mondo, portando pace e libertà in terre lontane.","104",NA
"È l’Italia delle forze dell’ordine che, con mezzi non sempre adeguati, difendono ogni giorno la nostra sicurezza.","104",NA
"Se tutti in Italia vivessimo il senso del dovere come loro lo vivono, il nostro Paese sarebbe primo nel mondo.","104",NA
"È l’Italia delle piccole e medie imprese, l’Italia delle famiglie operose che, al contrario delle grandi aziende da sempre protette dallo Stato, devono solo alle loro capacità e alle loro fatiche, il progresso della loro vita.","401",NA
"E ancora oggi, tra mille difficoltà burocratiche, vessati da tassazioni inique, formano un originale “modello economico” che è il vero traino del Paese.","401",NA
"Se tutti in Italia avessimo il loro spirito di sacrificio, il nostro Paese sarebbe primo nel mondo.","401",NA
"È l’Italia delle ragazze e dei ragazzi che pensano positivo e che, invece di abbandonarsi alla droga e alla protesta, o di pensare che l’unico futuro sia quello di fare la velina o il calciatore, studiano sodo, aprono nuove imprese, inventano, nel settore del volontariato e del no-profit, nuovi lavori e inedite iniziative economiche, sfidano la società mettendo su famiglia e facendo figli, cercano di sopperire, con la creatività, all’assenza di una politica che non pensa a loro.","706",NA
"Se tutti in Italia mettessimo in campo l’ottimismo e la speranza che, malgrado tutto, questi ragazzi trasmettono, il nostro Paese sarebbe primo nel mondo.","706",NA
"Senso del dovere, spirito di sacrificio, ottimismo e speranza.","606",NA
"Proprio di questo ha oggi bisogno l’Italia.","606",NA
"Sarà dura farcela.","606",NA
"Perché per troppi anni abbiamo vissuto sopra le nostre possibilità.","606",NA
"Perché siamo tutti bravissimi a lamentarci delle cose che non vanno, ma solo in pochi siamo disposti a rimboccarci le maniche per farle andare meglio.","606",NA
"Perché stiamo smarrendo il principio di unità della nazione e dello Stato, e sta venendo meno la solidarietà tra Nord e Sud, tra le Regioni, tra le diverse categorie sociali.","606",NA
"Perché sull’Italia delle persone oneste rischia di prevalere l’Italia dei furbi, dei mediocri, dei parassiti.","606",NA
"Ma l’Italia può ancora evitare il proprio declino.","606",NA
"Alla condizione di capire che nessuno ha la bacchetta magica.","606",NA
"Che nessun demiurgo, ammesso che ce ne siano, può salvarci.","606",NA
"Solo gli italiani possono salvare l’Italia.","606",NA
"Perciò è indispensabile resistere alle tentazioni del rifiuto, del disimpegno, dell’antipolitica, del leaderismo senza sostanza.","606",NA
"Al contrario abbiamo tutti bisogno di attraversare insieme una nuova frontiera di responsabilità.","606",NA
"Di nuovi diritti e di nuovi doveri.","606",NA
"“Senso del dovere, spirito di sacrificio, ottimismo, speranza: di questo ha bisogno l’Italia di oggi",NA,NA
"L’Unione di Centro nasce per raggiungere questo obiettivo.","305",NA
"Per proporre una nuova politica: insieme umile e coraggiosa, responsabile e costruttiva.","305",NA
"Siamo figli di chi, nel dopoguerra, ha permesso che questo Paese crescesse nella libertà.","305",NA
"Adesso la storia ci chiama a un nuova decisiva prova.","305",NA
"Essere i padri di nuove generazioni di liberi e di forti.","305",NA
