"text","cmp_code","eu_code"
"Intorno a questa idea-forza vanno unificati i diversi sistemi elettorali e le diverse forme di governo, dai Comuni alle Regioni: laddove è sempre più evidente la crisi delle assemblee elettive e la trasformazione del ruolo di governatore in una sorta di vicerè, sciolto da ogni controllo, sotto il quale proliferano, assai spesso, burocrazie sprecone e inefficienti.","202",NA
"Anche il possibile federalismo va letto dentro questo orizzonte: può essere un traguardo positivo solo se non si trasforma in una scissionistica moltiplicazione dei centri di spesa.","202",NA
"Il potere legislativo che è il caposaldo della democrazia parlamentare è stato negli ultimi decenni aggredito da due versanti: dal potere esecutivo che ha tentato di attribuirsene le prerogative istituzionali e dall’ordine giudiziario che ha operato come una sorta di “contropotere”.","202",NA
"L’equilibrio dei poteri voluto dai Padri Costituenti è saltato.","202",NA
"Si tratta di ricostruirlo uscendo dalle contrapposizioni forzate.","202",NA
"Per riuscirci la via è una sola: recuperare il primato del potere Legislativo, sia rispetto all’Esecutivo che al Giudiziario.","202",NA
"L’unione di Centro nasce per sottoporre al Paese l’urgenza di prendere atto del fallimento della Seconda Repubblica e di aprire un nuovo tempo della nostra storia nazionale: una Terza Repubblica che si lasci alle spalle il pressappochismo, la faziosità, lo strapotere delle attuali oligarchie e riscriva, con serietà e dedizione, in modo con diviso, le regole della nostra vita pubblica.","305",NA
"Il nuovo equilibrio della Repubblica deve favorire la soluzione della quattro grandi questioni aperte dall’inizio della transizione, quella istituzionale, quella giudiziaria, quella dell’unità nazionale e delle autonomie territoriali, quella della modernizzazione economica.","305",NA
"“ L’equilibriovoluto dai Padri costituenti è saltato. Si deve ricostruirlo uscendo dalle contrapposizioni forzate",NA,NA
"Occorre un Nuovo Inizio.","305",NA
"L’Italia ha bisogno di un nuovo “patto democratico”.","305",NA
"Tutto il tempo che si perderà prima di aderire a questa necessità sarà tempo rubato al futuro del Paese.","305",NA
"PARTITO EUROPEISTA E OCCIDENTALE",NA,NA
"L’Italia, grazie alla lungimiranza di Alcide De Gasperi, ha scelto di entrare nel novero dei Padri Fondatori dell’Unione Europea.","108",NA
"È una scelta da cui non si può tornare indietro.","108",NA
"Al contrario, sentiamo come nostro dovere lavorare per imprimere un’ulteriore accelerazione al processo di unificazione, riprendendo il cammino di approvazione della Carta Costituzionale europea.","108",NA
"Lavoriamo affinché l’Unione europea diventi un soggetto politico unitario, protagonista della scena mondiale.","108",NA
"Raggiunto l’obiettivo della moneta unica e della riunificazione politica tra Ovest e Est si può far più vicino il sogno dei Padri Fondatori: un continente unito che sia visto come un’affidabile sponda di dialogo verso quei Paesi del mondo islamico che vogliono incamminarsi lungo la via della democrazia e come un partner affidabile dell’unica democrazia liberale presente nell’area del Medio Oriente: quella d’Israele.","108",NA
"E più in generale come protagonista di una nuova cooperazione di tutta l’area del Mediterraneo.","108",NA
"L’auspicabile autonomia dell’Europa non può certo essere interpretata in modo antagonista nei confronti degli Stati Uniti ma, al contrario, come la leva per assumere nel mondo precise responsabilità politiche e militari rispetto ai temi della sicurezza globale cui finora l’Europa non è stata in grado di attendere, sempre facendo conto sulla forza di Washington.","107",NA
"Del resto, De Gasperi, Adenauer e Schumann ci hanno insegnato che Europa e Stati Uniti rappresentano le due facce di un’unica storia di civilizzazione e di libertà.","107",NA
"Questa comune consapevolezza salvò prima il mondo dal totalitarismo nazista e poi contribuì al crollo di quello comunista.","107",NA
"Un ritorno indietro da questa chiave di volta dell’assetto geopolitico del pianeta segnerebbe un passo indietro della storia del mondo.","107",NA
"Perciò un eventuale isolazionismo americano rispetto all’Europa sarebbe un gravissimo errore strategico.","107",NA
"Così come un ipotetico isolazionismo europeo rispetto a Washington, magari per avvicinarsi alla Russia di Putin, segnerebbe l’inizio di un’autentica decadenza politica, economica e culturale del vecchio continente.","107",NA
"Una stretta alleanza di intenti tra Europa e Usa, fatta di reciproco rispetto e capacità d’ascolto, è decisiva anche per riuscire a coinvolgere il maggior numero di Stati possibile in un nuovo patto di collaborazione planetaria.","107",NA
"L’Onu è la sede più importante del dialogo tra gli Stati, ma non sempre è stata in grado, nel recente passato, di svolgere un ruolo positivo nella soluzione delle controversie.","107",NA
"In ogni caso le nuove sfide della globalizzazione, il ruolo della finanza, il governo dell’ecosistema, la lotta al terrorismo e le politiche di sicurezza, la tutela dei diritti umani, i limiti e gli sviluppi delle biotecnologie, l’allarme povertà, richiedono la definizione di una nuova Carta dei diritti e dei doveri del XXI secolo da far sottoscrivere alle principali potenze, per condividere alcuni valori di fondo nella governance del pianeta.","107",NA
"“ Ci vuole una nuova Carta dei Diritti e dei doveri del XXI secolo da far sottoscrivere alle principali potenze",NA,NA
"Europa e Usa, nell’ambito di tutte le organizzazioni internazionali, possono essere i principali promotori di questa ineludibile necessità.","107",NA
"Il multilateralismo è il giusto metodo da seguire.","107",NA
"Ma, appunto, è solo un metodo: la cosa più importante è condividere gli stessi contenuti.","107",NA
"Altrimenti il multilateralismo diventerebbe solo una formula rituale per sancire l’esistenza di veti contrapposti e, di conseguenza, l’impotenza della politica mondiale.","107",NA
"Per l’Unione di Centro la parola pace rappresenta un valore supremo e universale.","106",NA
"Ma seguendo l’insegnamento della Pacem in Terris, sappiamo che in assenza della Libertà, della Verità, dell’Amore e della Giustizia non si dà vera pace.","106",NA
"Pace e Libertà, dunque sono due concetti gemelli: simul stabunt, simul cadent.","106",NA
"La pace senza libertà diventa solo una parola-totem, un feticcio senz’anima, uno scudo talmente generico da risultar valido anche per chi esercita violenza, oppressione e ingiustizia.","106",NA
"C’è pace, infatti, anche sotto la cappa di piombo delle dittature.","106",NA
"La medesima etica della responsabilità ci guida anche nell’affrontare le questioni dell’integrazione multirazziale e il dialogo con le altre civiltà.","607",NA
"Noi siamo convinti che l’“interculturalismo” sia un destino inevitabile delle nostre terre e anche un’occasione di crescita per le nostre società.","607",NA
"Ma non siamo affatto convinti che esso debba dar luogo da parte nostra ad una sorta di abdicazione identitaria.","601",NA
"La nostra è una cultura dell’accoglienza, della solidarietà, della tutela universale della dignità umana.","607",NA
"Perciò ci opponiamo con fermezza ad ogni diffidenza xenofoba.","607",NA
"Nello stesso tempo vogliamo che l’Italia e l’Europa tornino a coltivare l’amore per la propria identità, per la propria storia e la propria etica pubblica, l’affetto per la nostra religione, tutte cose che negli ultimi decenni sembrano essere state smarrite.","601",NA
"Perché senza amore e rispetto per se stessi non è possibile alcun vero dialogo.","601",NA
"L’amore per l’altro, lo spirito di amicizia e di comprensione, la ricerca dell’integrazione devono coniugarsi con una permanente e convinta richiesta di reciprocità.","601",NA
"Anche di fronte ai massicci fenomeni di immigrazione, la generosità verso chi cerca la nostra terra come speranza di futuro è doverosa.","601",NA
"Ma altrettanto doveroso è pretendere rispetto per la nostra cultura, la nostra religione, le nostre tradizioni, le nostre leggi.","601",NA
"Questa è l’unica via maestra per provare a costruire dialogo e solidale convivenza.","601",NA
"I profondi cambiamenti in atto nella società richiedono dunque un “doppio movimento”: la più ferma determinazione a difendere la sicurezza nelle nostre città e nelle periferie","605",NA
"e uno sforzo altrettanto deciso per garantire nuove forme di integrazione dei lavoratori stranieri e delle loro famiglie.","705",NA
"Finora l’oscillazione della sinistra e della destra tra accoglienza facile senza regole e durezza ideologica ai confini della xenofobia, non solo non ha risolto il problema, ma lo ha persino aggravato caricandolo di irrazionali emotività.","305",NA
"Anche su questo argomento il “partito dell’equilibrio” è l’unico vincente.","305",NA
"PARTITO DELLA MODERNIZZAZIONE DIECI PROPOSTE CONTRO IL DECLINO",NA,NA
"L’Italia è ormai da due decenni il Paese del “riformismo bloccato”.","305",NA
"Nella Seconda Repubblica i roboanti impegni di innovazione assunti sia dalla destra che dalla sinistra sono il più delle volte naufragati nell’impotenza.","305",NA
"Così, anno dopo anno, lo spettro di un grave declino storico del nostro Paese si è fatto sempre più incombente.","305",NA
"“ L’economia sociale di mercato resta la più efficace dottrina di governo delle società occidentali","305",NA
"All’impotenza politica si è accompagnata la confusione culturale.","305",NA
"Si è passati dalla declamazione della “rivoluzione liberale” alla teorizzazione di un “nuovo statalismo” con spensierata spregiudicatezza.","305",NA
"Gli stessi protagonisti che un tempo si facevano paladini del “più mercato-meno Stato” oggi sono i principali fan della tesi opposta “meno mercato-più Stato”.","305",NA
"Non si può governare un grande Paese con tale superficiale volubilità di visione del mondo.","305",NA
"L’economia sociale di mercato resta per noi, non solo a parole, la più efficace dottrina di governo delle società occidentali.","305",NA
"Essa propone da sempre un orizzonte assai chiaro: “più mercato” (per accrescere la ricchezza) e “più Stato” (quando è necessario per riequilibrarla).","305",NA
"Questo orizzonte di flessibilità vale sempre: nei  periodi di crescita che ieri hanno consentito all’Italia di diventare una grande nazione industriale, come in quelli di crisi che oggi segnano uno dei momenti più gravi di tutta la nostra storia.","305",NA
"Il pendolo tra liberalismo e statalismo è dunque “normale”: ma deve essere gestito con saggezza.","305",NA
"Il governo di un grande Paese industriale non può essere sottoposto a radicali e repentini squilibri di indirizzo.","305",NA
"La destra ha finora messo l’accento sulla modernizzazione.","305",NA
"La sinistra ha insistito sull’equità.","305",NA
"Si è trattato e si tratta di una contrapposizione insensata.","305",NA
"Anche perché, negli ultimi quindici anni, nessuno di questi due obiettivi è stato raggiunto, consegnando dell’Italia al mondo una strana e deprimente immagine: quella di un Paese nel quale inaudite arretratezze da Terzo mondo convivono con scintillanti ricchezze da California!","305",NA
"Il fatto è che modernizzazione ed equità sono due facce della stessa medaglia.","503",NA
"Non è moderno un Paese ingiusto che lascia soli i più deboli e non si accorge delle nuove povertà.","503",NA
"Non può essere solidale un Paese che rinuncia a produrre ricchezza, a produrre energia anche con il nucleare, che ha una tassazione eccessiva, che non si dota di infrastrutture, che non sia apre a un rivoluzione liberalizzatrice del rapporto tra Stato ed economia.","503",NA
"C’è una parola che lega la modernizzazione all’equità: qualità.","305",NA
"È questa l’unica vera grande missione verso la quale un governo deve saper indirizzare il proprio popolo.","305",NA
"La qualità deve tornare ad essere la vera chiave di volta di tutto il lavoro della nazione.","305",NA
"Qualità nell’industria, certo.","305",NA
"Ma anche e necessariamente qualità dei servizi, qualità dell’amministrazione, qualità della ricerca, qualità della scuola, qualità della vita.","305",NA
"L’Unione di Centro nasce per contribuire a superare il deficit italiano di riformismo ponendosi l’obiettivo di una seconda modernizzazione dopo quella che, nel dopoguerra, guidata da De Gasperi e Einaudi, realizzò la “ricostruzione italiana”.","305",NA
"Lungo dieci grandi aree di intervento.","305",NA
"Le uniche capaci di farci uscire anche dal tunnel dell’attuale crisi.","305",NA
"1) La difesa della vita",NA,NA
"Che si tratti dell’efferata criminalità che ormai invade i nostri paesi e le nostre città.","605",NA
"Che si tratti della biotecnologia che manipola i nostri corpi e il ciclo naturale dell’esistenza.","603",NA
"Che si tratti della pedofilia che insidia i nostri bambini.","605",NA
"Che si tratti dell’indifferenza nei confronti dei diritti del nascituro.","603",NA
"Che si tratti dell’inquinamento o, peggio, della distruzione del nostro habitat.","501",NA
"Che si tratti degli ormai quotidiani incidenti sul lavoro o delle settimanali stragi della strada.","701",NA
"In ogni caso, oggi, l’estrema, risoluta, intransigente difesa della vita è la nuova frontiera della nostra civiltà.","201",NA
"“ Una risoluta e intransigente difesa della vita è la nuova frontiera della nostra civiltà ”",NA,NA
"Dietro gli inauditi crimini quotidiani che offendono le nostre comunità, dietro le mille polemiche laiciste che negano il diritto naturale, dietro le maschere di una società che umilia e volgarizza i nostri corpi, soprattutto quelli delle donne, si cela un unico grande nemico: il nichilismo.","201",NA
"Stiamo perdendo il senso della vita, stiamo offendendo la sacralità di un mistero, di un dono che non è nelle nostre disponibilità distruggere.","201",NA
"Noi vogliamo unire nell’unico  concetto di difesa della vita i temi più importanti del nostro tempo.","201",NA
"La sicurezza della nostra esistenza e delle nostre città.","605",NA
"• La difesa della famiglia.","603",NA
"• Un equilibrato rapporto con il corpo e con il sesso.","603",NA
"• La libertà e la dignità della persona umana.","201",NA
"• La qualità del nostro ambiente.","501",NA
"• L’umanità del nostro rapporto con la scienza e con il progresso.","603",NA
"2) Un nuovo patto fiscale",NA,NA
"L’economia sommersa oggi raggiunge e supera il 25%.","503",NA
"Si tratta di una cifra enorme, decisamente superiore a quella degli altri Paesi dell’Ocse.","503",NA
"Sono dati che inquinano i bilanci dello Stato, alterano la concorrenza e soffocano i cittadini e le imprese oneste, costretti a pagare aliquote elevate per bilanciare la riduzione della base imponibile.","503",NA
"La sinistra ha inseguito l’improponibile modello di un Grande Fratello fiscale.","503",NA
"La destra ha ripetutamente tradito il proprio impegno di ridurre le tasse.","503",NA
"Ecco perché è ormai indifferibile un nuovo “patto fiscale” tra Stato e cittadini che, senza demonizzare o criminalizzare alcuna categoria, sia in grado di ottenere una maggiore giustizia sociale e far recuperare competitività alle imprese italiane nel mondo.","503",NA
"La nostra proposta è semplice quanto risolutiva: passare ad un modello di tassazione fondato sul “contrasto di interessi” per consentire ad ogni cittadino di poter portare in tutto, o in parte, in detrazione i costi dei servizi che acquista, garantendo ulteriore tutela alle famiglie attraverso l’adozione del modello del “quoziente familiare” che misura il peso del fisco sulla base della composizione dei nuclei familiari.","503",NA
"Solo attraverso l’allargamento della base imponibile si potrà realizzare il vero federalismo fiscale di cui il Paese ha bisogno, evitando di affiggerne soltanto i manifesti come sembra voler fare la Lega.","503",NA
"Contemporaneamente occorre liberare il sistema produttivo dai vincoli che rendono impari la competizione con le imprese degli altri Paesi: una forte e concreta riduzione dell’imposizione fiscale nei confronti delle imprese non può più essere rinviata, soprattutto se si intendono garantire condizioni di sviluppo economico durature e strutturali all’Italia, consentendole di uscire più rapidamente dalla grave crisi finanziaria internazionale.","402",NA
"3) Il rilancio della famiglia contro il declino demografico",NA,NA
"Il declino economico è accompagnato, in Italia e in Europa, da un preoccupante declino demografico che porterà, a breve, drammatici squilibri dal punto di vista sociale, previdenziale, sanitario e solidaristico.","603",NA
"Si tratta di un declino annunciato ma sempre sottovalutato che aggraverà la già difficile situazione italiana perché l’invecchiamento della popolazione vuol dire meno consumi, meno lavoro, meno investimenti: vuol dire una società debole e perciò più fragile e in sofferenza.","603",NA
"Dunque le politiche per la famiglia non sono una delle diverse opzioni possibili; sono al contrario decisive per il nostro futuro.","603",NA
"L’Unione di Centro ritiene che i soldi spesi per i figli non debbano essere tassati, in omaggio agli articoli 29, 30, 31 e 53 della nostra Carta Costituzionale.","603",NA
"Ciò che avviene in tutta Europa deve essere possibile anche in Italia.","603",NA
"La famiglia è un’impresa che produce capitale umano e come tale va considerata con politiche di promozione e di tutela, così come si fa con tutte le aziende del Paese.","603",NA
"Occorre inoltre mettere in campo politiche del lavoro che consentano la conciliazione dei tempi della famiglia con i tempi del lavoro fuori casa;","603",NA
"politiche educative che garantiscano la libertà di scelta educativa delle famiglie come condizione ineludibile anche per il rilancio della scuola statale,","506",NA
"politiche di welfare che sostengano la famiglia nel suo quotidiano lavoro di cura verso i soggetti più deboli.","504",NA
"La definizione di un nuovo contratto sociale passa attraverso la concezione della famiglia quale soggetto sociale di rilievo prioritario.","603",NA
"Primo soggetto dell’intervento statale dovrà dunque essere la famiglia e non l’individuo.","603",NA
"È questa la più grande sfida dei prossimi anni.","603",NA
"“ Ci vogliono politiche del lavoro che consentano di conciliare i tempi della famiglia con il lavoro fuori casa",NA,NA
"4) Una svolta nelle liberalizzazioni: per il consumatore, per la piccola e media impresa",NA,NA
"L’Unione di Centro si propone come partito di tutela del cittadino-consumatore.","403",NA
"Partiamo dalla consapevolezza che, dal 1996 al 2001, i governi di centrosinistra hanno realizzato una serie di privatizzazioni che, in luogo dei cittadini, hanno favorito nuovi monopolisti di settori strategici come banche, assicurazioni, telecomunicazioni, gas ed energia con il risultato di appesantire i costi dei servizi per i cittadini consumatori, le famiglie-consumatrici e le imprese consumatrici.","403",NA
"Ma la destra non ha cambiato strada: la nuova fase di governo, dietro il paravento della crisi internazionale, sembra mirare anch’essa solo a costruire nuovi equilibri di potere nell’ambito del sistema bancario e industriale.","403",NA
"Occorre invertire la rotta: solo attraverso un’imponente spinta liberalizzatrice sarà infatti possibile completare il processo di ammodernamento dell’economia italiana creando finalmente condizioni di concorrenza tra le imprese, riducendo i costi e migliorando la qualità per i consumatori.","401",NA
"Lo Stato, abbandonato definitivamente il ruolo di Stato-imprenditore, ha il dovere di assumere quello di Stato-regolatore ponendo al centro della propria azione la figura del consumatore.","403",NA
"La spinta liberalizzatrice, oltre che a livello nazionale, va diffusa anche al livello dei servizi pubblici locali e delle professioni, abbandonando l’eterna malattia italiana di coltivare corporativismi e interessi particolari.","401",NA
"Ciò vale ovviamente anche per la macchina burocratica dello Stato e dei suoi enti periferici che appare organizzata più in funzione di chi vi lavora, spesso peraltro in condizioni di frustrazione, che del cittadino che ne usufruisce.","303",NA
"L’Unione di Centro si propone anche come partito di riferimento della piccola e media impresa che rimane il principale traino economico dell’Italia.","401",NA
"Le sfide del mercato globale impongono una continua rimodulazione delle politiche di sostegno e un’analisi attenta ma severa dell’evoluzione del sistema imprenditoriale italiano.","401",NA
"Il “nanismo” delle nostre imprese costituisce da una parte un elemento di freno dello sviluppo, dall’altra un punto di forza, garantendo flessibilità e dinamismo.","401",NA
"Occorre individuare i settori nei quali favorire selettivamente le aggregazioni d’impresa e quelli nei quali le politiche di distretto agevolano la competitività, salvaguardando anche i caratteri distintivi delle aziende, per imprimere ulteriore spinta all’affermazione del made in Italy.","401",NA
"In questo percorso la ricerca e l’innovazione di prodotto diventano l’unico vero traino di una riscossa, non effimera, dei nostri indici di competitività.","401",NA
"“ Solo con un‘imponente spinta liberalizzatrice sarà possibile modernizzare l’economia italiana",NA,NA
"5) Elevare il tasso di solidarietà",NA,NA
"Un partito moderato e riformatore ha il dovere di assumere scelte anche apparentemente impopolari se improntate alla tutela dell’interesse generale.","606",NA
"Ebbene, il nostro Paese ha bisogno che torni in politica il tempo del coraggio per affrontare seriamente il tema della povertà, della disuguaglianza, delle redistribuzione del reddito;","503",NA
"per definire un nuovo welfare, sostenibile e giusto, non più centralizzato ma fondato sulla sussidiarietà orizzontale;","504",NA
"per promuovere un moderno sistema di protezione sociale capace di garantire un avvenire meno incerto ai nostri giovani che hanno bisogno di una scuola e di un’università radicalmente rinnovate,","506",NA
"per offrire sostegno agli anziani, per assicurare solidarietà ai “nuovi poveri” e realizzare condizioni di pari opportunità a tutte le donne.","503",NA
"L’attuale sistema pensionistico non tiene conto dei mutamenti demografici in atto e finirà con il far pagare alle giovani generazioni il prezzo dell’irresponsabilità dei governi attuali.","503",NA
"È indispensabile approvare una riforma della previdenza che tenga conto della combinazione tra allungamento dell’attesa di vita e caduta delle nascite.","503",NA
"Dalla previdenza occorre inoltre sganciare l’assistenza, recuperando risorse che potranno essere destinate a chi ne ha veramente bisogno.","503",NA
"Elevare il tasso di solidarietà del Paese è la missione più alta che una buona politica possa darsi nel medio-lungo periodo.","503",NA
"Occorre allora incentivare e non abbandonare a se stessi i tanti italiani che oggi si dedicano alla solidarietà, aiutandoli a proseguire nel loro impegno con un rinnovato spirito imprenditoriale.","606",NA
"Intorno alla figura dell’imprenditore sociale il Paese può ritrovare gli stimoli e le energie per sostenere i cittadini che attualmente vivono in condizioni di povertà.","606",NA
"6) Una nuova cultura del lavoro",NA,NA
"Negli ultimi decenni sono intervenuti profondi cambiamenti nell’organizzazione del lavoro e nelle sue regole.","701",NA
"Il lavoro in nero si è spesso intrecciato con l’immigrazione clandestina; il rapporto tra flessibilità, precarietà e stabilità si è fatto più complesso; la presenza degli immigrati ha reso i luoghi di lavoro sempre più multiculturali, multireligiosi e multietnici; l’ingresso delle donne ha modificato sia quantitativamente che qualitativamente il paesaggio professionale.","701",NA
"L’insieme di questi elementi ha prodotto una profonda modificazione.","701",NA
"La tradizionale relazione tra scelta del lavoro e realizzazione della persona è ormai messa in seria discussione.","701",NA
"Avanza al contrario una concezione strumentale del lavoro non visto più come missione, ma più semplicemente come mezzo.","701",NA
"Il fine della vita oltrepassa il lavoro e viene individuato essenzialmente nella realizzazione economica, nel prestigio della carriera e nell’uso del tempo libero.","701",NA
"È cambiata di conseguenza anche la relazione tra lavoro e socialità.","701",NA
"Un tempo il mondo del lavoro era un luogo di forti relazioni cooperative e solidali, mentre oggi prevale la spinta di un forte individualismo assieme a sempre più marcate forme di corporativismo.","701",NA
"La stessa natura della relazione tra uomo e lavoro è fortemente condizionata da un progressivo predominio della tecnologia che domina lo sviluppo della persona.","701",NA
"Noi riteniamo che tali fenomeni non siano irreversibili, che la modernità non debba necessariamente essere caratterizzata da questi fenomeni di “nuova alienazione”.","701",NA
"Riteniamo che sia possibile, e per questo intendiamo batterci, ricostruire una cultura del lavoro fondata sulla centralità della persona, recuperando la visione antropologica di un’attività capace di rendere sempre più umana la vita, la cultura e la società.","701",NA
"Occorre, in altri termini, segnare il passaggio da una visione conflittuale delle relazioni sociali ad una solidale e cooperativa.","606",NA
"Immaginare una nuova “socialità del lavoro” che torni ad esibire una tensione dinamica, dei singoli e dei gruppi, verso il bene comune.","606",NA
"“ L’attuale sistema pensionistico farà pagare alle giovani generazioni l’irresponsabilità dei governi",NA,NA
