"text","cmp_code","eu_code"
"L’Italia ha bisogno di una profonda rigenerazione politica e morale.","305",NA
"È giunto di nuovo il tempo di fare appello alle migliori energie dell’Italia, allo slancio delle donne e degli uomini liberi, alla responsabilità delle donne e degli uomini forti, per determinare una grande svolta nel futuro della nazione.","305",NA
"Novanta anni dopo l’atto di coraggio di Luigi Sturzo, un nuovo coraggioso impegno è richiesto a chi crede nel valori della giustizia e della libertà.","305",NA
"Perciò nasce l’Unione di Centro.","305",NA
"Per proporre una nuova casa politica a tutti i popolari, i liberali, i moderati e i riformisti italiani che avvertono con preoccupazione il vuoto etico e politico sul quale si basa l’attuale sistema dei partiti.","305",NA
"La cosiddetta Seconda Repubblica è fallita.","305",NA
"Non ha saputo ricostruire il corpo e l’anima della nostra democrazia.","305",NA
"Non ha creato le basi di un nuovo patto istituzionale tra gli italiani.","305",NA
"“ Una nuova casa per chi avverte con preoccupazione il vuoto politico su cui si basa l’attuale sistema",NA,NA
"Quando, negli anni Novanta, crollò il vecchio sistema, quattro erano le grandi questioni che giustificavano la transizione verso un nuovo tempo della Repubblica: 1) La questione istituzionale, già posta alla fine degli anni Settanta, affrontata lungo il corso degli Ottanta e infine riproposta dall’illusione referendaria.","305",NA
"2) La questione giudiziaria, parte essenziale della questione istituzionale, esplosa drammaticamente in un inedito, radicale e pericoloso conflitto con la politica di settori della magistratura, dei media e dell’opinione pubblica.","305",NA
"3) La questione dell’unità nazionale e del sistema delle autonomie, nell’incombente rischio di una nuova frattura storico-sociale tra Nord e Sud.","305",NA
"4) La questione della modernizzazione economica, sentita come ineludibile, in tutti i campi della vita pubblica, per ricollocare l’Italia in sintonia con le esperienze più avanzate dell’Occidente.","305",NA
"Ebbene, tutte queste questioni sono ancora davanti a noi, irrisolte; anzi, incancrenite dal tempo perduto.","305",NA
"Abbiamo ormai alle spalle quasi un ventennio sprecato.","305",NA
"Le pochissime realtà riformate (Regioni, Comuni, legge elettorale) lo sono state seguendo suggestioni del momento o logiche di convenienza, fuori da un omogeneo progetto nazionale.","305",NA
"E così si continua ancora oggi, tentando di piegare leggi elettorali e nodi istituzionali agli interessi di parte.","305",NA
"Bisognerebbe trovare le sedi e gli strumenti per soluzioni largamente condivise.","305",NA
"Il panorama è stato invece dominato da una sorta di guerra civile ideologica.","305",NA
"Il risultato è che la cosiddetta Seconda Repubblica ha finito per mettere in archivio i concetti di “interesse generale” e di “bene comune” che sono invece il fondamento di ogni democrazia.","305",NA
"Ha offuscato la partecipazione popolare alla vita pubblica trasformando il consenso in audience, le strategie politiche in surrogato quotidiano dei sondaggi, i partiti in clan elettorali dei leader e, infine, ciò che è più grave, il Parlamento in una sorta di “ente inutile”, pura cassa di risonanza dell’Esecutivo.","305",NA
"Non è questa la modernità politica che gli italiani pretendevano.","305",NA
"Fingendo di costruire una “democrazia degli elettori” si è, in realtà, dato vita ad una soffocante “democrazia delle oligarchie”.","305",NA
"Questo è il vero volto dell’Italia nel primo decennio del XXI secolo.","305",NA
"Per questo nasce l’Unione di Centro.","305",NA
"Per aprire un nuovo tempo della Repubblica.","305",NA
"Per ricostruire i valori fondativi della democrazia italiana: l’interesse nazionale e il bene comune come esclusiva finalità dell’agire politico.","601",NA
"La competenza, lo spirito di servizio, il senso dello Stato come modello di selezione della classe dirigente.","606",NA
"Il ruolo dei “corpi intermedi” nella gestione della cosa pubblica.","606",NA
"La partecipazione popolare come motore della vita associata.","606",NA
"Il dovere di “guidare” eticamente e politicamente il Paese, al di là delle effimere rilevazioni statistiche del consenso.","304",NA
"La democrazia nei partiti e nei sistemi elettorali come unica garanzia di libertà per tutti gli eletti e per tutti i cittadini.","304",NA
"La centralità del parlamento come sede legittima della formazione dell’interesse pubblico.","202",NA
"Fuori da questa “cornice di valori” nessuna democrazia può avere futuro.","202",NA
"L’Unione di Centro, partita dall’incontro tra l’esperienza storica dell’Udc con nuove realtà di movimento come la Rosa per l’Italia, i circoli liberal e i Popolari democratici, forte dei due milioni di consensi che, nelle elezioni del 2008, le hanno permesso di resistere all’illusione del “voto utile”, nasce per proporre ai cittadini italiani di tutti gli schieramentiche vivono il disagio del finto bipartitismo, al mondo del volontariato e dell’associazionismo laico e cattolico, un grande progetto politico: l’orizzonte di un nuovo partito popolare e liberale di governo.","305",NA
"“ Un grande progettopolitico: l’orizzonte di un nuovo partito popolare e liberale di governo",NA,NA
"L’unità politica dei cattolici è formula che appartiene ad altra e superata stagione storica.","305",NA
"Ciò però non vuol dire che tutti coloro che si riconoscono nell’ispirazione cristiana debbano necessariamente accettare la “diaspora” come condanna inappellabile della storia dei cattolici italiani, come se dovesse essere obbligatorio vivere in “partibus infidelium”, e non possano invece ritrovarsi in una stessa casa politica, se la cornice identitaria e programmatica corrisponde ai loro valori.","305",NA
"Ma non è certo questo il tempo di “rifare la Dc”.","305",NA
"Il passato è il nostro tesoro di esperienza e di saggezza.","305",NA
"Ma il presente e il futuro ci chiedono di aprire un diverso tempo politico.","305",NA
"Il tempo di un nuovo soggetto nel quale i popolari, i liberali, i riformisti, i moderati di tutte le aree politiche riscoprano insieme la via maestra del Centro come luogo sempre essenziale per il governo.","305",NA
"C’è un popolo cristiano che guarda alla politica con diffidenza, ma che sa che solo attraverso la politica può ottenere risposta alle sue esigenze.","305",NA
"C’è un popolo laico che non si riconosce più nelle posizioni laiciste e che sente giunta l’ora di intraprendere nuovi sentieri.","305",NA
"È giunto dunque il momento di aprire una nuova storia politica.","305",NA
"Non un “terzo polo” di risulta tra due immutabili giganti bipolari, ma un’offerta politica, di governo, di partecipazione democratica del tutto nuova, che nasca dalla “rottura” del finto bipartitismo, pericolante esito del fallimento della cosiddetta Seconda Repubblica.","305",NA
"Un centrosinistra che metta insieme tutto, dall’estrema sinistra al centro, così come un centrodestra costruito con analoga disomogeneità non sono stati e non saranno mai in grado di governare, nella stabilità, l’innovazione.","305",NA
"L’Italia di oggi è malata di immobilismo, mentre tutt’intorno il mondo cambia e prepara, a cominciare dagli Stati Uniti, l’avvento di una nuova era.","305",NA
"Noi siamo fermi.","305",NA
"La grave crisi economica internazionale mette in discussione la tenuta del nostro patto sociale e denuncia come ormai intollerabili le arretratezze del nostro sistema istituzionale ed economico.","305",NA
"Il deficit di valori che colpisce soprattutto le giovani generazioni sta facendo nascere un vero e proprio allarme sulla tenuta etica della nostra società.","305",NA
"Non c’è più tempo da perdere.","305",NA
"Non c’è più tempo per pigrizie, per paure, per coltivare piccole rendite di posizione.","305",NA
"È tempo di rimettersi in cammino.","305",NA
"Con il coraggio dei liberi e dei forti.","305",NA
"PARTITO DI VALORI FORTI",NA,NA
"L’Europa del XX secolo ha incredibilmente cercato di uccidere se stessa, dando corpo ai mostri del nazismo e del comunismo, e permettendo l’affermarsi del più grande tentativo di annullamento delle culture basate sulla centralità della persona: il cristianesimo, il liberalismo, l’ebraismo.","202",NA
"Se il XXI secolo vuole davvero chiudere con gli orrori del Novecento non basta dunque che si dichiari nemico di ogni dittatura.","202",NA
"Occorre che torni a innalzare, come valori forti e positivi della sua identità, proprio quelle filosofie che i totalitarismi intendevano annichilire, in primo luogo il cristianesimo e il liberalismo.","202",NA
"Questi sono i valori forti dell’Occidente, questi sono i valori forti dell’Europa, questi sono i nostri valori forti.","202",NA
"“ Una tradizione ha elaborato la sintesi più convincente di cristianesimo e liberalismo: il popolarismo",NA,NA
"Nella storia politica europea e italiana una tradizione sulle altre ha saputo elaborare la sintesi più convincente di cristianesimo e liberalismo: il popolarismo.","305",NA
"Perciò noi intendiamo muoverci nel solco di questa grande strada, partecipi come già siamo della grande famiglia del Ppe, coscienti come vogliamo sempre essere che questo cammino è illuminato da due stelle polari: la Libertà e la Solidarietà.","305",NA
"Stelle che possono guidare una nuova grande alleanza tra popolarismo e modernità, orientando i rapporti tra i singoli individui, tra impresa e Stato, tra le diverse categorie e le classi sociali, tra le nazioni nell’arena della globalizzazione mondiale.","305",NA
"Centralità della persona, tutela della dignità e dell’integrità della sua vita.","201",NA
"Centralità del diritto naturale contro ogni abuso della Politica, dell’Ideologia, della Scienza.","201",NA
"Centralità della famiglia come cellula fondamentale della conservazione della specie e dello sviluppo materiale e morale della società.","603",NA
"Centralità della sussidiarietà come principio regolatore di un corretto rapporto tra Stato e Società.","301",NA
"Centralità dell’equilibrio tra economia e natura come dovere umano per governare con saggezza l’ambiente ricevuto in dono.","416",NA
"Centralità della libertà come unica garanzia per poter raggiungere sempre più alti livelli di pace nel mondo.","201",NA
"Proprio perché siamo un partito di ispirazione cristiana e liberale, ci battiamo con convinzione per difendere, in ogni circostanza, la laicità dello Stato e la reciproca autonomia tra Chiesa e potere politico.","201",NA
"La netta separazione tra gli affari di Dio e quelli di Cesare appartiene all’essenza stessa della nostra civiltà e deriva, del resto, dal-l’ispirazione cristiana.","201",NA
"Essa è la chiave di volta della convivenza umana per ogni democrazia liberale.","201",NA
"Il fatto che su questi temi continuino a prodursi infinite polemiche pubbliche deriva da una infelice confusione culturale.","201",NA
"Una cosa infatti è il rapporto di separazione tra Chiesa e Stato, che non sembra davvero nel mondo occidentale contestato da nessuno.","201",NA
"Altra cosa è il rapporto tra la democrazia e i suoi valori fondativi che il laicismo nega, proponendo una visione relativista della vita pubblica, nella quale ogni valore viene messo sullo stesso piano.","201",NA
"Non è così.","201",NA
"Il valore del primato della Persona rispetto allo Stato, alla Razza, alla Classe, alla Scienza, il valore dell’inviolabilità della sua vita, della sua dignità e della sua libertà, il valore del diritto naturale, sono valori universali, codici fondativi delle democrazie liberali.","201",NA
"Se le nostre società smarrissero il carattere universale, e dunque non relativo, dei valori che le hanno fondate, se diventassero “società indifferenti”, perderebbero ben presto la loro anima e, nel tempo, decadrebbero come foglie morte.","201",NA
"Il politico laico - e dunque non laicista - non può che orientarsi intorno a questo schema binario: rigorosamente autonomo deve essere il rapporto tra la Chiesa e lo Stato, tra la Politica e la Religione.","201",NA
"Assolutamente condiviso deve essere, invece, quello tra la Democrazia e i suoi Valori di fondazione.","201",NA
"PARTITO APERTO E DEMOCRATICO",NA,NA
"Quale che sia il giudizio sui vecchi partiti, neanche i più disinvolti protagonisti dell’antipolitica hanno il coraggio di teorizzare (neppure quando la praticano) che sia possibile una democrazia senza partiti.","304",NA
"Eppure è proprio questo il rischio di fronte al quale si trova oggi l’Italia.","304",NA
"“ Il rischio che corre l’Italia di oggi è quellodi vivere una democrazia senza partiti",NA,NA
"In seguito alla lunga consunzione degli storici insediamenti politici (già prevista da Aldo Moro) e, poi, alla loro traumatica scomparsa, la politica italiana avrebbe dovuto procedere ad un serio lavoro di ricostruzione: dei fondamenti identitari, spiazzati dai mutamenti dell’assetto geopolitico mondiale;","304",NA
"della forma partito per renderla adeguata ai nuovi sistemi di comunicazione e alle mutate caratteristiche della partecipazione;","304",NA
"dei meccanismi di selezione della classe dirigente, accertato l’esaurimento delle tradizionali sedi di formazione.","304",NA
"In una parola, c’era bisogno di un’evoluzione del pensiero politico per individuare la strada di nuovi partiti di massa del XXI secolo.","304",NA
"Più leggeri ma non meno radicati, più veloci ma non meno democratici.","304",NA
"Viceversa abbiamo assistito ad un generale decadimento del pensiero politico.","304",NA
"Così, tra i vecchi partiti tramontati e i nuovi partiti necessari, sta vincendo la pragmatica e sbrigativa soluzione del non-partito.","304",NA
"Le conseguenze sono sotto i nostri occhi: la decadenza della qualità della rappresentanza parlamentare; la selezione delle classi dirigenti affidata a meccanismi casuali, oligarchici e padronali; l’assenza di sedi reali del dibattito politico e culturale, l’aggravarsi della crisi tra rappresentanza e territorio.","304",NA
"La necessità di dotarsi di leader capaci di significative suggestioni simboliche, circostanza certamente normale per ogni democrazia moderna, ha finito, in questo quadro, per determinare l’avvento di un leaderismo senza partiti, fenomeno invece assai anomalo in tutto il mondo occidentale.","304",NA
"Il fallimento della cosiddetta Seconda Repubblica, evidenziato dalla crisi del bipolarismo poggiato su due coalizioni eterogenee e perciò stesso ingovernabili, è stata finalmente riconosciuta in occasione della campagna elettorale del 2008.","305",NA
"Ma la soluzione trovata, quella del finto bipartitismo, ha peggiorato la situazione.","305",NA
"Sono nati in realtà due nuovi cartelli elettorali: il Pdl generato da una fusione pubblicitaria tra Forza Italia e An, ed il Pd fondato su una fusione “a freddo” tra Margherita e Ds.","305",NA
"Entrambi hanno impostato la loro strategia sul presupposto che una semplificazione brutale del quadro politico rappresentasse la panacea per rimediare agli errori dei quattordici anni precedenti.","305",NA
"Ridurre il numero dei partiti era certamente una necessità, ma forzare il sistema verso un “artificiale bipartitismo” è stato ed è un disegno sciagurato.","305",NA
"Perché è del tutto evidente che ciò impone sia al Pdl che al Pd un doppio salto mortale: da una parte un’autoritativa restrizione del pluralismo politico e culturale del Paese e, nel contempo, una significativa contrazione degli spazi della propria democrazia interna.","305",NA
"Il bi-leaderismo senza partiti ha una sola inevitabile conseguenza: la trasformazione della democrazia in oligarchia.","305",NA
"L’Unione di Centro nasce per scongiurare questo rischio superando il finto bipartitismo.","305",NA
"E lancia una sfida politica e organizzativa.","305",NA
"Vogliamo essere un partito moderno, leggero,rapido nelle decisioni, all’altezza delle nuove esigenze della comunicazione, ma allo stesso tempo non vogliamo rinunciare a quella che consideriamo l’essenza stessa della politica: il contributo ideale dei militanti e dei simpatizzanti, la forma zione culturale delle classi dirigenti, la possibilità di ricambio dei leader attraverso la democrazia interna.","305",NA
"“ Il leaderismo senza partiti ha una sola inevitabile conseguenza: trasforma la democrazia in oligarchia ”","305",NA
"Non vogliamo essere un partito di apparati e di tessere, ma un partito della società.","305",NA
"Pensiamo sia giunta l’ora di immaginare un modello organizzativo che, accanto al ruolo sempre decisivo degli iscritti, sappia dare voce e diritto di rappresentanza anche ai movimenti d’opinione, alle associazioni sociali e civili, agli istituti culturali che si muovono nell’area popolare e moderata.","305",NA
"Si tratta di costruire una forma-partito che consenta anche a questi centri di partecipare alla vita quotidiana del partito, e alle sue campagne congressuali ed elettorali, garantendo una presenza permanente che caratterizzi l’Unione di Centro come un partito aperto e in costante riferimento dialettico con la società.","305",NA
"Con particolare interesse guardiamo, ovviamente, a tutte quelle realtà di associazionismo e volontariato cattolico e laico, che operano con spirito di servizio nella società italiana e alle quali rivolgiamo un appello perché partecipino alla nostra sfida, con l’autonomia della loro elaborazione ma anche con la consapevolezza di una condivisione progettuale.","305",NA
"Sono proprio i giovani presenti in questi movimenti che possono dar vita a quella che è stata evocata come una “nuova generazione di politici cattolici”.","305",NA
"Sono le loro idee e il loro entusiasmo, che hanno animato le grandi giornate della gioventù, a poter fermare l’inaridimento di valori del tempo che viviamo.","305",NA
"È la loro freschezza che può sconfiggere il nichilismo morale e politico che l’Unione di Centro vede come il primo nemico di una società “a misura della persona”.","305",NA
"Vogliamo essere dunque un partito nuovo.","305",NA
"Un partito nazionale e, insieme, un partito delle autonomie, fondate sulla sussidiarietà che esprime, proprio attraverso una selezione vera sul territorio, un gruppo dirigente in grado di catturare una forte attenzione nell’opinione pubblica.","301",NA
"Un partito con un nucleo centrale snello e più impegnato nell’elaborazione politica che non nel controllo verticistico delle sue emanazioni locali.","301",NA
"Un partito forte al centro e radicato in periferia.","301",NA
"Un partito sempre attento alla dimensione sociale.","504",NA
"Un partito flessibile, capace di appassionare i giovani per la sua generosità ideale e non di respingerli per la sue chiusure burocratiche.","305",NA
"Un partito con un forte e riconosciuto leader, non un partito del leader.","305",NA
"Un partito di servizio, non un partito padronale.","305",NA
"PARTITO DELL’EQUILIBRIO ISTITUZIONALE E DELLA RESPONSABILITÀ NAZIONALE",NA,NA
"Il passaggio dalla Prima alla Seconda Repubblica è avvenuto per forza d’inerzia, in un processo confuso e superficiale.","202",NA
"Le spinte referendarie non sono state accompagnate da alcun progetto condiviso di riforma.","202",NA
"Il ripetuto fallimento delle diverse Commissioni Bicamerali ha certificato l’impotenza delle nostre classi dirigenti.","202",NA
"L’ipotesi di eleggere un’Assemblea Costituente è stata sempre frettolosamente scartata.","202",NA
"Il risultato è che i ripetuti “strappi” prodotti sulla legge elettorale e sulla seconda parte della Costituzione ci hanno consegnato un sistema contraddittorio, nel quale il rapporto tra i diversi poteri non poggia più su alcun razionale equilibrio.","202",NA
"Viviamo in una sorta di “presidenzialismo di fatto” senza aver ridisegnato il sistema di bilanciamento dei poteri.","202",NA
"Un’assurda anomalia politica e istituzionale: assai pericolosa per la tenuta della democrazia.","202",NA
"“ La prima repubblica ha privilegiato la rappresentanza, la seconda la decisione. Occore un nuovo equilibrio","202",NA
"L’Unione di Centro nasce per fare dei temi dell’equilibrio istituzionale e della responsabilità nazionale le proprie bandiere.","202",NA
"Fuori da ogni logica di parte occorre ripensare l’intera architettura dello Stato, per ricomporre un quadro coerente, funzionale e moderno della nostra convivenza pubblica.","202",NA
"La Prima Repubblica ha privilegiato la questione della rappresentanza.","202",NA
"La Seconda il momento della decisione.","202",NA
"È giunto il tempo di trovare un nuovo equilibrio capace di realizzare un efficace bilanciamento tra le due esigenze, entrambi irrinunciabili.","202",NA
"Nella Prima Repubblica avevamo un sistema rigido nelle regole del torneo (l’alternanza era consentita solo in riferimento agli schieramenti internazionali) e flessibile nello schema di gioco (la dialettica tra le correnti dc e gli alleati, e perfino il consociativismo, funzionavano come correzione permanente del potere).","202",NA
"Quel sistema finì per produrre un’instabilità cronica, quasi un governo ogni anno, e si rivelò non più adatto a gestire la modernità.","202",NA
"Oggi soffriamo l’errore opposto: un sistema flessibile nelle regole del torneo (c’è l’alternanza) ma espressione di un’estrema rigidità, quasi militare, nello schema di gioco.","202",NA
"Una volta che uno schieramento ha vinto le elezioni non c’è più alcuna possibilità di correzione parlamentare del potere, di condivisione di progetti di interesse nazionale, di adeguamento del governo ai mutamenti della società.","202",NA
"Si tratta di una sorta di bipolarismo leninista.","202",NA
"Anacronistico e antimoderno.","202",NA
"È l’era della flessibilità.","202",NA
"La chiediamo a tutti gli attori sociali: eppure la politica resta vittima di un’artrosi sistemica ancora più evidente di quella del passato.","202",NA
"Tanto per fare un esempio macroscopico: a noi non è consentita, se anche i tempi lo suggerissero, la flessibilità di un governo di Grande Coalizione come in Germania.","202",NA
"Il principale ostacolo alla flessibilità del sistema è la forzosa introduzione del premio di maggioranza su un sistema proporzionale.","202",NA
"Si obietta che eliminarlo significherebbe aumentare la frammentazione politica e tornare a negare ai cittadini la scelta “diretta” dei governi.","202",NA
"Non è vero.","202",NA
"Una pur modesta soglia di sbarramento è in grado di ridurre a cinque-sei i soggetti parlamentari.","202",NA
"Ed è solo un pregiudizio l’idea che ciò che si chiama “modello tedesco”, debba inevitabilmente riportarci al passato, quando i governi si componevano dopo il voto.","202",NA
"L’Unione di Centro ritiene che gli elettori debbano poter scegliere le alleanze di governo prima del voto.","202",NA
"Ma tali alleanze non possono essere il frutto di una pietrificazione del sistema politico.","202",NA
"Le diverse aree politiche del Paese debbono essere libere di proporre ai cittadini, di volta in volta, le alleanze che ritengono più adatte alla fase politica, facendo davvero prevalere i programmi sugli schieramenti.","202",NA
"Guadagnandosi la maggioranza dei seggi solo se gli elettori gliela concedono.","202",NA
"Senza alcun premio.","202",NA
"E confrontandosi poi, liberamente, in Parlamento con tutte le altre forze politiche.","202",NA
"La differenza con l’oggi di un modello proporzionale senza premio di maggioranza non starebbe dunque nella rinuncia a proporre leader e governi prima del voto.","202",NA
"Starebbe invece nella liberazione dalla rigidità di un bipolarismo fondato sull’eterno scontro destra-sinistra, categorie otto-novecentesche che non corrispondono più, se non genericamente, alle domande delle società moderne.","202",NA
"“ Il vero valore della nostra modernità politica non è il bipolarismo.È la democrazia dell’alternanza",NA,NA
"Il vero valore della nostra modernità politica non è il bipolarismo.","202",NA
"È la democrazia dell’alternanza.","202",NA
"L’Italia moderna deve proteggere questa seconda, non il primo.","202",NA
"Dobbiamo garantire il ricambio del potere, e la scelta preventiva, da parte degli elettori, dei partiti e degli uomini che debbono governare.","202",NA
"Ma questo può avvenire anche con un sistema tripolare o quadripolare.","202",NA
"Il bipolarismo è solo una delle forme possibili di governance.","202",NA
"La democrazia dell’alternanza è la sostanza.","202",NA
"Partendo da questo chiaro orizzonte politico è possibile ridisegnare, secondo un progetto razionale, l’architettura dello Stato facendosi guidare da una sola grande priorità: la centralità del Parlamento e di tutte le assemblee elettive.","202",NA
"Perfino nei più consolidati sistemi presidenziali il ruolo delle assemblee nazionali è decisivo.","202",NA
"Nell’Italia della Seconda Repubblica si assiste invece ad una inquietante espropriazione di sovranità delle Camere.","202",NA
"È necessario accrescere i poteri del premier ma solo se, nel contempo, si definiscono con precisione le prerogative delle assemblee elettive che debbono essere dotate di un potere di veto rispetto all’esecutivo.","202",NA
"Si può prevedere, ad esempio, che su alcune materie di rilevante interesse nazionale, siano necessarie maggioranze qualificate.","202",NA
"Ciò impedirebbe la “dittatura dei decreti” in auge da alcuni anni e costringerebbe governi e opposizioni a collaborare, ricercando le soluzioni migliori per il Paese, con spirito di responsabilità nazionale.","202",NA
