"text","cmp_code","eu_code"
"Während  Erreichbarkeit  für  den Einzelnen und für unsere  Wirtschaft unbestritten wichtig ist, müssen wir den negativen Be-gleiterscheinungen der gestiegenen  Mobilität entgegenwirken, indem  Alternativen für den Güter transport  geschaffen werden und der Schwer-verkehr auf der Straße gemeinsam mit den Nachbarregionen besser  geregelt wird.","416",NA
"Im öffentlichen Nah-verkehr gilt es, das breit gefächer te  Verkehrsnetz weiter auszubauen  und den spezifischen Bedürfnissen der Nutzerinnen und Nutzer anzu-passen.","411",NA
"Ein besonderes Augenmerk  muss der intelligenten Vernetzung der bestehenden Verkehrsangebote sowie dem Ausbau umweltfreundlicher Antriebsformen gelten.","416",NA
"Musik",NA,NA
"Südtirol ist ein Land der Noten:  Hunder te Musikkapellen und Chö-re, unzählige Musikgruppen und  Ensembles bieten hochwer tige  Darbietungen, welche sich auch international sehen und hören lassen  können.","502",NA
"Sie  leben  und  beleben  Kultur,  geben  alte  Lieder  und  Me-lodien weiter und tragen so zum  Erhalt des Brauchtums bei, füh-ren Südtirol musikalisch aber auch in die Moderne.","502",NA
"Den vielen Musik-schulen und Weiterbildungseinrichtungen ist es ein Auftrag, für die  fachliche Aus- und Weiterbildung  zu sorgen, für die Politik eine  Pflicht, diese Aktivitäten zu fördern.","502",NA
"Nachhaltigkeit",NA,NA
"Nachhaltigkeit in der Politik heißt für uns, auf die Anforderungen von Gesellschaft, Wirtschaft und Welt  einzugehen, ohne die Möglichkeiten der zukünftigen Generatio-nen zu beeinträchtigen.","606",NA
"Das bedingt einen offenen und ehrlichen Dialog, Elemente der Bürgerbeteiligung, Eigenverantwor tung  und Interesse aller im Entscheidungsprozess Beteiligten.","606",NA
"Alle Entscheidungen sind nach ihren Aus-wirkungen auf künftige Generatio-nen zu überprüfen.","606",NA
"Nationalpark Stilfser Joch",NA,NA
"Die Verwaltung des Nationalparks Stilfser Joch soll auf die jeweiligen autonomen Provinzen übergehen, welche die dabei anfallenden Kosten übernehmen.","301",NA
"Hierzu ist die entsprechende Durchführungsbestimmung zu erlassen.","301",NA
"Natur- und   Landschaftsschutz",NA,NA
"Unsere  Natur- und  Kulturland-schaft zeichnet Südtirol aus und ist in  vielfacher  Hinsicht unser Kapital.","501",NA
"Gleichzeitig wissen wir, dass etwa die bebaubare Fläche begrenzt ist und wir daher sparsam mit Grund  und Boden umgehen müssen.","501",NA
"Ein schonungsvoller und nachhalti-ger Umgang mit den RessourcenWasser, Energie, Luft und Boden – und damit mit den Lebensgrund-lagen der nachkommenden  Generation – ist wichtiges Prinzip unserer Politik, eine harmonischeVerbindung zwischen traditionellen  Bauweisen und Moderne ein Auf-trag.","416",NA
"Öffentlicher Dienst",NA,NA
"Die Menschen in Südtirol erwarten sich – zu recht – einen effizienten öffentlichen Bereich.","0",NA
"Wir wollen  motivierte und qualifizierte Mitarbeiter, die sich engagier t um die  Anliegen der Menschen kümmern.","303",NA
"Voraussetzung dafür sind stabile  und sichere Arbeitsverhältnisse und  eine hohe Qualität der Aus- und Weiterbildung.","303",NA
"Öffentlicher Nahverkehr",NA,NA
"Mit der Bahn als rückgrat und vertakteten Busverbindungen in die  Täler hat Südtirol heute eine gute Grundstruktur, auf die weiter auf-gebaut werden kann.","411",NA
"Ziel für die  Zukunft ist es, die Erreichbarkeit auch der peripheren Gebiete durch regelmäßige Anbindungen zu verstärken.","411",NA
"Der Zugang zum öffentlichen Nahverkehr muss allen Bevölkerungsschichten durch bezahlbare  Tarife und spezielle Angebote für  weniger mobile Zielgruppen gewährleistet bleiben.","411",NA
"Damit Südtirol  seinen Platz in  Europa behaupten  kann, ist auch der weitere Ausbau der grenzüberschreitenden Verbindungen wichtig.","411",NA
"Zentral ist  für  Süd-tirol als Land der grünen Technolo-gien  auch  die  Investition  in  nach-haltige und alternative Antriebsfor-men wie Elektromobilität oder die Wasserstofftechnologie, für die  Strom aus lokalen erneuerbaren  Quellen gewonnen werden kann.","411",NA
"Öffentliche Sicherheit",NA,NA
"Es ist eine Kernaufgabe der Politik,  für Sicherheit in seinen unterschiedlichsten Ausprägungen zu sorgen:  Schutz und Unterstützung am Arbeitsplatz, im Wohnumfeld, in der  Familie oder im eigenen Betrieb.","605",NA
"Sicherheit setzt Verlässlichkeit und  Berechenbarkeit voraus, aber auch  eine feste Verwurzelung in Werten  und Grundüberzeugungen.","605",NA
"Auch  die öffentliche Sicherheit muss stets  garantiert sein, Gewalt in jeglicher  Form muss bestraft werden, Gewaltbereitschaft ist durch Präventionsarbeit abzubauen.","605",NA
"Eines der  vorrangigen Ziele ist die Schaffung  einer eigenen Landespolizei im rahmen der Vollautonomie.","605",NA
"Öffentliche Verwaltung",NA,NA
"Die öffentliche Verwaltung steht im  Dienst am Bürger.","303",NA
"Es gilt sie neben  transparenten Verwaltungsabläufen  in ihrer Effizienz zu steigern.","303",NA
"Durch  einfache und klare Gesetze wird die  Verwaltung effizienter und bürgernäher.","303",NA
"In diesem Sinne verfolgen wir  die Verbesserung mit der Zusammenführung ähnlicher Dienste, die  Nutzung von Synergieeffekten und  den Ausbau der Informationstechnik.","303",NA
"Die Anfragen der Bürgerinnen und Bürger müssen schnell,  unbürokratisch, transparent und  effizient bearbeitet werden.","303",NA
"Ökonomie und Ökologie",NA,NA
"Das Gleichgewicht zwischen dem  Schutz der Natur und der Nutzung des Umfelds ist eine große Herausforderung für die Zukunft.","416",NA
"oft  stehen sich unterschiedliche Inter-essen gegenüber, die scheinbar  nicht oder nur schwierig in Einklang  zu bringen sind.","416",NA
"Vieles ließe sich jedoch gemeinsam lösen, wenn die  berechtigten Interessen gemeinsam diskutier t werden und Wir tschaft und Umweltschutz ihre  Standpunkte austauschen.","416",NA
"Das Beharren auf Extrempositionen – egal  welcher Seite – bringt niemand weiter.","416",NA
"Ziel ist es, Südtirol als lebens-wer te Heimat zu erhalten.","416",NA
"Dafür  muss gesundes Wachstum möglich  sein, unverhältnismäßige Eingriffe  in die Natur sind zu vermeiden.","416",NA
"Österreich",NA,NA
"Österreich ist das Vaterland der  deutsch- und ladinischsprachigen  Bevölkerung in Südtirol.","101",NA
"Die Verbindung zum Vaterland und zur  Schutzmacht Österreich ist und  bleibt für Südtirol daher zentral.","101",NA
"Sämtliche autonomiepolitischen  Maßnahmen werden daher weiter regelmäßig in enger Abstimmung mit den österreichischen Staatsstellen erfolgen, so dass die überstaatliche bzw. internationale Absicherung der Minderheitenrechte  und der Eigenverwaltung auch gewahr t bleibt.","101",NA
"Pendler",NA,NA
"Viele Arbeitnehmerinnen und Ar-beitnehmer müssen heute auch  über längere Strecken pendeln, um  ihren Arbeitsplatz zu erreichen.","411",NA
"Unser Bestreben muss es sein, dass sie  dabei die öffentlichen Verkehrs-mittel benutzen, wobei erschwingliche Tarife eine wichtige Zugangs-voraussetzung sind und auch in  Zukunft erhalten werden müssen.","411",NA
"Arbeitnehmerinnen und Arbeitneh-mer,  die  darauf nicht  zurückgreifen können, sollten bei tatsächlicher  Bedürftigkeit weiterhin auf einen  Fahr tkostenbeitrag zählen können.","411",NA
"Pflege/Pflegezeiten",NA,NA
"Die Lebenserwar tung steigt auf-grund des Lebenswandels und der guten medizinischen Versorgung  zusehends.","504",NA
"Viele Senioren sind bis  ins hohe Alter aktiv und rüstig, andere brauchen hingegen intensive Pflege und Betreuung.","504",NA
"Alle Menschen mit Beeinträchtigungen  brauchen liebevolle, kompetente  Betreuung.","504",NA
"Dafür müssen nicht nur  geeignete Strukturen geschaffen  und  ausgebaut  werden  –  wie  die  Tages- und Kurzzeitpflege –, auch die langfristige Finanzierbarkeit von  Betreuungsdiensten muss gewähr-leistet sein.","504",NA
"Die Pflege in der Familie ist ein hoher Wert – diese soll gefördert werden, etwa indem Pflegezeiten für die rente anerkannt  werden.","504",NA
"Die 2008 eingeführte Pflegesicherung hat zu einer deutlichen  Stärkung der Pflege zu Hause geführt und muss auch für die Zukunft gesichert bleiben.","504",NA
"Das Schaffen einer einzigen Anlaufstelle  durch Vernetzen der verschiedenen  Dienste schafft eine höhere Servicequalität.","504",NA
"Politischer Stil",NA,NA
"Jede Zeit hat ihren politischen Stil.","305",NA
"Wir spüren das Bedürfnis der Menschen nach einer Politik, die sich  nicht hinter verschlossenen Türen, sondern „draußen“, im Dialog mit  den Bürgerinnen und Bürgern abspielt.","305",NA
"Dazu kommen die Möglichkeiten, die das Internet und soziale Medien bieten.","305",NA
"In unserer politischen Arbeit, in der Ideen- und Entscheidungsfindung setzen wir stärker als bisher auf Bürgerbeteiligung und Teamarbeit.","305",NA
"Innerhalb  unserer Partei, aber auch innerhalb  der Gesellschaft wollen wir ein kritisches Auseinandersetzen mit den Problemen unserer Zeit fördern.","305",NA
"Prävention",NA,NA
"Neben der Prävention im Gesund-heitsbereich sowie klassischen  Suchtthemen wie Drogen, Alkohol und Nikotin muss aufgrund der ak-tuellen Entwicklungen ein besonderer  Akzent auf Spielsucht und  Essstörungen gesetzt werden.","504",NA
"Dieses Problem betrifft die gesamte  Gesellschaft und muss breit disku-tier t und unter Federführung kom-petenter Stellen weiter bearbeitet werden.","504",NA
"Es sind nicht nur entsprechende Behandlungseinrichtungen,  sondern auch langfristig begleitende Projekte für Suchterkrankte und  Sensibilisierungskampagnen im  Vorfeld einzuführen.","504",NA
"Proporz",NA,NA
"Der ethnische Proporz ist eine Säule  der Autonomie.","301",NA
"Er hat dazu bei-getragen, dass Ungleichgewichte  vermieden, Gerechtigkeit hergestellt wurde und dies auch so wahrgenommen wird.","301",NA
"In diesem Sinne bleibt dieses Instrument auch in  Zukunft  wichtig,  wenngleich in  verschiedenen  Bereichen  flexible  An-wendungsformen berechtigt sind.","301",NA
"Diese sollen im Zeichen des Konsenses, des Dialogs und des Ausgleichs  erfolgen.","301",NA
"raumordnung",NA,NA
"Grund und Boden sind aufgrund d er ge o g r a ph i s ch e n S it u at i on  knapp.","501",NA
"Die Politik auf allen Ebenen ist verantwor tlich dafür, darauf zu achten, dass das Landschaftsbild  geschützt und mit Umsicht weiter-entwickelt wird.","501",NA
"Die raumordnung  auf Landesebene legt fest, wie die Dörfer in Südtirol in 20 Jahren aussehen werden.","501",NA
"Insbesondere ist die  bebaubare Fläche in Südtirol begrenzt.","501",NA
"Daher wird in den kommenden Jahren die Sanierung bestehender Bausubstanz einen besonderen  Schwerpunkt darstellen.","501",NA
"Gerade die  Dorf- und ortszentren werden in  diesem Zuge eine weitere Aufwertung erfahren.","501",NA
"Bei Neuausweisungen muss hingegen auf die Notwendigkeit und Verhältnismäßig-keit  geachtet  werden.","501",NA
"Die  regelungen zur raumordnung müssen  übersichtlich dargestellt und ver-einfacht werden.","501",NA
"rente",NA,NA
"Die  finanzielle  Absicherung  der  heu-tigen Senioren und der nächsten Generation ist eine gesellschaftliche Herausforderung Frauen be-ziehen durchschnittlich die Hälfte der rente von Männern.","504",NA
"Dieses Ver-hältnis wird sich durch das beitragsbezogene rentensystem noch  weiter verschlechtern.","504",NA
"In Anerkennung der wichtigen Leistungen der Frauen für Familie, Erziehungund Pflege gilt es Möglichkeiten zu finden, der Altersarmut entgegenzuwirken","504",NA
"Der Zusatzrenten-fonds ist eine beispielgebende Ein-richtung zur Absicherung der zu-künftigen Generationen.","504",NA
"renteneintrittsalter und  ältere Erwerbstätige",NA,NA
"Die längere Lebenserwartung führ t  auch dazu, dass die Menschen auch  in Südtirol länger arbeiten.","701",NA
"Dieser Anpassungsprozess ist allerdings  noch nicht abgeschlossen, die Generation  der  über  50-Jährigen  ist überdurchschnittlich häufig von  Arbeitslosigkeit betroffen.","701",NA
"Lang-fristig muss die Integration dieser Arbeitnehmerinnen und Arbeitneh-mer in die Arbeitswelt verbesser t  werden.","701",NA
"Dazu braucht es Anreize, aber auch ein Umdenken der Ar-beitgeberinnen und Arbeitgeber.","701",NA
"Kurz- bis mittelfristig braucht es  Übergangslösungen – wie Altersteilzeit, wodurch gleichzeitig auch  Stellen für Jugendliche geschaffen werden können.","701",NA
"Sammelpartei",NA,NA
"Die Südtiroler Volkspar tei ist als  Ver tretung der deutsch- und ladi-nischsprachigen Minderheit in Ita-lien eine Sammelpar tei und als sol-che aktueller denn je.","305",NA
"Der Ausgleich  der Interessen ist ihre ureigenste  Aufgabe, zum Wohle und Nutzen der Bevölkerung des ganzen Landes.","305",NA
"Klare Entscheidungsfindungsprozesse und offene, breite Diskussion prägen die politische Kultur  und tragen zu ausgewogenen Lösungen bei (Transparenz).","305",NA
"Dieses  Selbstverständnis als Spiegelbild  der Bevölkerung ist Anspruch und Auftrag zugleich.","305",NA
"Sanität",NA,NA
"Die Sanität soll weiterhin solidarisch finanzier t und allen gleich zugänglich sein.","504",NA
"Nicht die Brieftasche  dar f über die Gesundheit entscheiden.","504",NA
"Südtirols Sanität hat ei-nen hohen Standard erreicht.","504",NA
"Diese  Qualität muss durch stetige Weiter-entwicklungen gehalten und ver-besser t werden – nach den Patientenbedürfnissen, der freien Patientenmobilität in der EU und auf der Höhe des medizinischtechnischen For tschritts.","504",NA
"Die hausärztliche und pflegerische Betreuung vor or t sol-len weiter ausgebaut werden.","504",NA
"Der Leitsatz für die Sanität ist: „wohn-or tnah, bedarfsgerecht, hochwertig“.","504",NA
"Die Gesundheit ist ein hohes Gut, und dieses Gut hat seinen  Preis.","504",NA
"Erneuern ja, kaputt sparen  nein!","504",NA
"Schule und Kindergarten",NA,NA
"Südtirol hat erstklassige Kindergärten, Grund-, Mittel-, ober- und Berufsschulen, in denen qualifizier te Lehrkräfte Tag für Tag ihre Arbeit  verrichten.","506",NA
"Im Mittelpunkt der  Ausbildung steht das Wohl der  Kinder und Jugendlichen, wobei strukturell die Voraussetzungen für  einen hochwer tigen Schulbetrieb  aufrechtzuerhalten sind.","506",NA
"Wir streben einen Ausbau der Bildungsau-tonomie an und wollen die universitäre Ausbildung weiterentwickeln  um die Professionalität des Lehrpersonals zu steigern.","506",NA
"Darüber hinaus kommt der Berufsberatung bei der Wahl der Ausbildung, aber auch bei  Um- oder Wiedereinstieg eine wichtige rolle zu.","506",NA
"Senioren Generation 65+",NA,NA
"Die älteren Menschen haben Süd-tirol aufgebaut.","606",NA
"Es ist daher eine  gesellschaftliche Verpflichtung, ih-nen unabhängig von ihrer familiä-ren Herkunft einen angenehmen  und würdigen Lebensabend zu er-möglichen und ihnen die entspre-chende Wer tschätzung entgegen-zubringen.","606",NA
"Dazu gehören die notwendigen Pflege und Betreu-ungsdienste sowieeinrichtungen genauso wie die finanzielle Absiche-rung von Mindestrentnern, einfa-cher Zugang zur Mobilität und  Einbindung in das soziale und gesellschaftliche Leben.","504",NA
"Sozialleistungen",NA,NA
"In Südtirol sind in den vergangenen  Jahrzehnten zahlreiche soziale  Dienste und Leistungen eingeführ t  worden, welche in anderen benach-bar ten regionen gar nicht möglich  wären.","504",NA
"Es ist unser Auftrag, die  Treffsicherheit von sozialen Unterstützungsmaßnahmen weiter zu  verbessern, den Missbrauch zu unterbinden und so die Mittel ver-mehrt jenen zukommen lassen zu  können, die sie am nötigsten haben.","504",NA
"Sozialpar tnerschaft",NA,NA
"Eine gelebte Sozialpar tnerschaft  sicher t gerade in Krisenzeiten wirtschaftlichen, sozialen und gesell-schaftlichen Zusammenhalt.","701",NA
"Der  Dialog zwischen Politik, Arbeitge-ber- und Arbeitnehmerverbänden, aber auch Naturschutzorganisatio-nen bei wirtschaftlichen und sozia-len Fragestellungen soll daher in  Zukunft verstärkt werden.","701",NA
"Sport",NA,NA
"Südtirol blickt mit Stolz auf viele  Sportlerinnen und Spor tler, die im europäischen und internationalen Spitzenfeld mithalten können.","502",NA
"Dies  ist nicht nur auf den Fleiß und die Zielstrebigkeit derselben zurückzu-führen, sondern auch auf entsprechende Strukturen und Voraussetzungen.","502",NA
"Diese sollen weiter geförder t und erhalten werden, mit dem  Ziel einer Vernetzung zu einem Landesspor tzentrum.","502",NA
"Neben dem Spitzenspor t soll vor allem der Breitenspor t–  Amateur- und Schul-spor t –  weiterhin eine  besondere  Unterstützung erfahren.","502",NA
"Sprachgruppen",NA,NA
"In Südtirol leben drei Bevölkerungs-gruppen mit unterschiedlicher  Sprache, Geschichte, Kultur und Herkunft friedlich zusammen.","607",NA
"Die eigentliche Leistung der Au-tonomie ist es, zu gegenseitigem  Verständnis, respekt und zu Solidarität beigetragen zu haben.","606",NA
"Darauf bauen wir und werden nur im Ein-vernehmen und im par tnerschaftlichen Dialog – auch mit den Mit-menschen aus anderen Herkunfts-ländern – an der Zukunft des Landes weiterarbeiten.","606",NA
"Steuerhoheit",NA,NA
"Ein vordergründiges Ziel der Süd-tiroler Politik ist es, direkte Steuern und Gebühren selbst festlegen und einheben zu können.","301",NA
"Dies erhöht zwar den Druck auf die  lokale Politik, steigert gleichzeitig aber die Kostenwahrheit und Ei-genverantwortung.","301",NA
"Das Steuersystem muss verein-facht, Steuergerechtigkeit geschaffen und Steuerprivilegien müssen  vermieden werden.","303",NA
"Wir streben da-her eine echte Finanz- und Steuer-hoheit im Rahmen einer Vollau-tonomie an, wobei die eigenständi-ge Festlegung, Verwaltung und  Einhebung der Steuern Grundvoraussetzung ist.","301",NA
"Steuerlast",NA,NA
"Eine hohe Steuerbelastung und damit verbunden hohe Lohnkosten  sind ein Hemmnis für  Wettbewerbsfähigkeit und Arbeitsplätze  in  Südtirol.","401",NA
"Eine  reduktion  der  Steuerlast förder t Konsum und In-vestitionen, vor allem aber die  Schaffung von Arbeitsplätzen und mehr Netto vom Brutto.","401",NA
"Konkret  streben wir eine Neuregelung der Immobiliensteuer IMU und zur Entlastung  für  Familien und  Unternehmen an.","403",NA
"Jene Wirtschaftsspar ten, die Zu-satzver träge abschließen und somit  zur Anhebung der reallöhne beitra-gen, sollen in Zukunft von der regi-onalen Wer tschöpfungssteuer IrAP  befreit werden.","402",NA
"Spielräume dafür schaffen wir  durch die Finanzautonomie und  Steuerhoheit Südtirols.","402",NA
"Strompreise",NA,NA
"Günstiger Strom ist ein wichtiger  Wettbewerbsfaktor.","410",NA
"Es gilt ein Kon-zept zu entwickeln und umzusetzen, damit diese ressource bei den Menschen und Betrieben in Form günstiger Energiepreise ankommt.","410",NA
"Die Nutzung erneuerbarer Energien und der Wasserkraft spielt dabei eine wichtige rolle; ebenso die NeuOrganisation der Produktion  im Dialog mit allen Beteiligten.","501",NA
"Subsidiarität",NA,NA
"Wenn Aufgaben auf niederer Ebene  besser erledigt werden können, so sollen sie dor t auch zugelassen  werden: Das Subsidiaritätsprinzip  nimmt in Südtirol in besonderer  Weise in der Zusammenarbeit  zwischen Land und Gemeinden  eine bedeutende rolle ein.","301",NA
"Die Stel-lung der Gemeinden wird in diesem  Sinne  eine  Aufwer tung  erfahren,  wobei dies ebenfalls im Zeichen von  lokaler Eigenv er antwor tung  steht.","301",NA
"Tierschutz",NA,NA
"Der verantwor tungsvolle Umgang mit den Lebewesen unserer Um-welt ist nicht immer eine Selbstverständlichkeit.","501",NA
"Deshalb sind Vorschriften und Maßnahmen zum  Schutz der Tierwelt, für Heimtiere ebenso wie für Nutztiere, notwendig.","501",NA
"Dadurch soll zugleich auch  dem Streunen von Tieren entgegengewirkt werden.","501",NA
"In der freilebenden Tierwelt ist auf Einhaltung und regelmäßige Über-wachung des Ar tenschutzes zu  achten.","501",NA
"Toponomastik",NA,NA
"Nachdem es über Jahrzehnte nicht gelungen ist, eine Lösung für die  behängende or tsnamenfrage zu  finden, ist im Jahre 2012 endlich ein sogenanntes Verfahrensgesetz auf den Weg gebracht worden.","0",NA
"Die festzuschreibenden zwei- bzw. dreisprachigen or ts- und Flurbezeichnungen sollen sich am effekti-ven Gebrauch orientieren.","0",NA
"Die SVP steht zu dieser Lösung, da sie Gerechtigkeit wiederherstellt und  Ausgleich ermöglicht, und wird sie deshalb in den kommenden Jahren mit Umsicht vorantreiben.","503",NA
"Tourismus",NA,NA
"Der Tourismus zählt zu den Haupt-Wirtschaftszweigen Südtirols.","410",NA
"Gerade die aktuelle Wirtschaftslage  beweist, wie wichtig es ist, sich auf  mehrere Märkte auszurichten.","410",NA
"Da-her werden die Tourismustreibenden in ihrem Bestreben, neue Märk-te zu eröffnen, bestärkt, indem die Bewerbung Südtirols verbesser t  und einheitlich gestaltet wird.","410",NA
"Die Zusammenarbeit mit den anderen Wirtschaftszweigen gilt es  auf Augenhöhe durchzuführen,  Konkurrenzsituationen zu vermeiden und die Tourismusvereins- undverbandsstrukturen zu reformieren.","410",NA
"Transparenz",NA,NA
"Moderne und bürgernahe Politik ist  von Transparenz geprägt.","303",NA
"Nachvoll-ziehbare Entscheidungsprozesse  auf breiter Basis mit weitestgehender Beteiligung ist unser Ziel als  Sammelpar tei.","303",NA
"offene Kommuni-kation, freie Par tizipation und breite Information sind Grundpfeiler  dieser Entscheidungsfindung zu  politischen Themen auf allen Ebenen.","303",NA
"UNESCo  Weltkulturerbe Dolomiten",NA,NA
"Die Entscheidung der Vereinten Na-tionen, die Dolomiten in das Welt- naturerbeVerzeichnis aufzuneh-men, ist für das ganze Land Ver-pflichtung, dieses einmalig schöne Gebiet besonders zu schützen.","501",NA
"Die Rahmenbedingungen müssen vor allem im Bereich des Tourismus und  der Mobilität kontinuierlich verbesser t werden.","501",NA
"Universität",NA,NA
"Die dreisprachige Universität Bozen  ist eine nicht mehr wegzudenkende  Einrichtung für die Südtiroler Hoch-schulbildung.","506",NA
"Daher werden wir  Initiativen fördern, die eine noch  weitergehende Kooperation zwischen den Universitäten der Euro-paregion Tirol ermöglichen, um so die beste Hochschulausbildung für die jungen Menschen anbieten zu können.","506",NA
"Unternehmen",NA,NA
"Südtirol besitzt einen gesunden  Ausgleich zwischen klein- und  mittelständischen Unternehmen  sowie größeren Produktionsfirmen.","410",NA
"Dieser Ausgleich muss erhalten  bleiben, wobei sich Südtirols Unternehmen in Zeiten der Wirtschaftlichen Instabilität in besonderer Weise auf mehrere Märkte ausrichten müssen.","410",NA
"Diese Initiativen für Ex-por t und internationale Vernetzung werden von der Politik begrüßt und geförder t.","410",NA
"Unternehmensgründungen",NA,NA
"Neue Unternehmen schaffen  neue Arbeitsplätze; sie wetteifern  mit den etablier ten Unternehmen um neue, innovative Lösungen für gesellschaftliche Herausforderungen.","402",NA
"Auf Basis einer soliden Wirtschaftsstruktur sollen in Südtirol neue Initiativen und Rahmenbedingungen gesetzt werden, die attraktiv für  Unternehmensgründungen sind.","402",NA
"Dafür braucht es einen Abbau der Bürokratie, eine Entlastung der  Wirtschaft und eine aktive Bil-dungs- und Forschungspolitik.","402",NA
"Südtirol soll ein dynamischer Wir tschaftsstandor t sein, der für traditionelle Unternehmen, aber auch  für junge Star t-Ups interessant ist.","402",NA
"Vereinbarkeit von Familie  und Beruf",NA,NA
"Die Vereinbarkeit von Familie und  Beruf ist eine gesellschaftspolitische Herausforderung: Beruf und  Familie müssen in der heutigen Zeit  für Frauen und Männer gleicher-m aß en ve rei nb a r s ei n .","603",NA
"D az u  braucht es unter anderem familien-freundliche Arbeitszeitmodelle mit flexiblen Voll- und  Teilzeitstellen,  Jobsharing  oder  Telearbeit  –  hier  sind sowohl  Unternehmen als  auch Arbeitnehmerseite geforder t.","403",NA
"Vergabewesen",NA,NA
"Derzeit arbeitet das EU-Parlament an einer neuen richtlinie für öffentliche Ausschreibungen, die aller Voraussicht nach noch innerhalb 2013  verabschiedet wird.","0",NA
"Dann haben die  Mitgliedsstaaten zwei Jahre Zeit,  diese umzusetzen.","0",NA
"Südtirol soll da-bei seine Möglichkeiten nutzen und  die richtlinie unter Berücksichti-gung des gesetzlichen  Rahmens  mit eigenem Landesgesetz direkt  umsetzen, um den lokalen Bedürf-nissen rechnung zu tragen.","301",NA
"Dies  soll in enger Abstimmung mit den Wirtschaftsverbänden erfolgen.","301",NA
"Verkehr",NA,NA
"Das Verkehrsaufkommen hat in den  vergangenen Jahrzehnten stetig  zugenommen, durch den freien  Warenverkehr genauso wie durch das individuelle Bedürfnis eines jeden Menschen, mobil zu sein.","416",NA
"Die Verkehrs- und Mobilitätsentwick-lung dar f jedoch keineswegs zur  Verletzung der elementaren Grund-rechte der Bevölkerung führen: Es ist und bleibt daher oberstes Ziel, Gesundheit und Lebensqualität  zu schützen und zu gewährleisten.","416",NA
"Vernetzung",NA,NA
"Südtirol ist keine Insel in Europa, sondern in vielerlei Hinsicht verbunden: mit dem Vaterland Öster-reich ebenso wie mit Italien, im  Rahmen der region Trentino Süd-tirol ebenso wie innerhalb der  Eu-roparegion Tirol oder in Bündnissen  für internationale Zusammenar-beit im Alpenraum oder Minderheitenschutz, mit der EU und interna-tionalen Institutionen.","108",NA
"Diese Vernetzung und Erreichbarkeit sind für Südtirol überlebenswichtig: als Anbindung dor thin, wo große und auch Südtirol betreffende Entscheidungen getroffen werden, als Ver-bindung mit gleichgesinnten Bünd-nispar tnern, als Tor zu neuen Märk-ten und Möglichkeiten für die Menschen in Südtirol.","108",NA
"Diese Vernetzung  ist weiter auszubauen und zu fördern, um den Austausch von Know How weiter zu forcieren.","108",NA
"Ver trauen",NA,NA
"Die Bürgerinnen und Bürger müssen sich darauf verlassen können, dass die politisch Verantwor tlichen  sich um die besten Lösungen für  Südtirol bemühen.","202",NA
"Dieses Ver trau-en in die Politik hat in den vergangenen Jahren – nicht nur in Italien, sondern in ganz Europa – gelitten.","202",NA
