"text","cmp_code","eu_code"
"… Südtirol bestimmt selbst  … Südtirol tol instës sües dezijiuns",NA,NA
"Der Weg der Autonomie ist Garant für Sicherheit und Stabilität in Süd-tirol.","301",NA
"Die Südtiroler Volkspartei hat diesen Weg vorangetrieben und maßgeblich gestaltet.","305",NA
"Wir sind stolz auf Meilensteine wie das „Paket“ 1969 und das Zweite Autonomiestatut 1972.","305",NA
"Nicht utopische Forderungen, sondern konkrete und machbare Schritte waren dabei stets der Schlüssel zum Erfolg.","305",NA
"Die SVP verfolgt den Weg der maximalen Eigenständigkeit Südtirols","301",NA
"und der Einbindung unseres Landes in die gesamteuropäische Entwicklung:","107",NA
"Konsequent gehen wir den erfolgreichen Weg der Autonomie hin zur Vollautonomie weiter, mit der Perspektive eigenständiger europäischer Regionen.","305",NA
"Wir kämpfen für mehr Freiraum, damit Südtirol seine Zukunft eigenständig gestalten und seine Chancen in Europa – an  der Schnittstelle zwischen deutschem und italienischem Kultur- und Wirtschaftsraum – nutzen kann.","301",NA
"La SVP va inant sön le tru dl’autonomia, por arjunje l’autonomia plëna y  insciö podëi tó instësc les dezijiuns che reverda nosta Provinzia  y nosta jënt.",NA,NA
"Der römische Zentralismus ist eine Gefahr für die soziale, wirtschaftliche und kulturelle Entwicklung Südtirols.","301",NA
"Umso wichtiger ist es jetzt, die bereits  erreichte kulturelle, wirtschaftliche und soziale Eigenständigkeit abzusichern und weiter auszubauen.","301",NA
"Vor allem aber müssen wir die Wirtschaftliche Entwicklung in  Südtirol durch die Übernahme erweiterter Zuständigkeiten von den Hemmnissen der staatlichen Verwaltung befreien.","301",NA
"» I jun inant consecuënć le tru de suzès dl’autonomia por ruvé al’autonomia plëna«",NA,NA
"Kulturelle Eigenständigkeit",NA,NA
"Der Schutz der Volksgruppen ist der Ausgangspunkt unserer Autonomie.","607",NA
"In  der Vergangenheit konnten wir sehr viel für die deutsch- und ladinischsprachige Minderheit erreichen: Wir haben unsere jeweils eigenen Schulen, der  ethnische Proporz garantiert eine gerechte Aufteilung der Ämter und Stellen  in der öffentlichen Verwaltung und eine angemessene Verteilung von öffentlichen Leistungen.","305",NA
"Wir leben selbstbewusst unsere Traditionen, haben eine  starke Heimatverbundenheit und unsere Identität ist nicht mehr in unmittelbarer Gefahr.","603",NA
"So kann die Verbindung von Tradition und Zeitgeist, von  gelebten Werten und offenheit unsere Kultur festigen und weiterentwickeln.","603",NA
"Fortschritt statt Rückschritt",NA,NA
"Diese Erfolge dürfen wir nun nicht aufs Spiel setzen, sondern wir müssen weiterhin geschlossen dafür eintreten.","411",NA
"Das recht auf Existenz und kultu-relle Entfaltung der deutschen und ladinischen Minderheit muss dauerhaft  gesichert bleiben: Sprache und Kultur, Schule und Bildung, Tradition und Brauchtum sind dabei Kernpunkte.","607",NA
"Dazu zählt auch, dass wir Lehrinhalte, Organisation und Gestaltung der Bildungseinrichtungen in Südtirol selbst  festlegen.","607",NA
"Ökonomische Eigenständigkeit",NA,NA
"Südtirol steht Wirtschaftlich besser da als der italienische Staat und als viele andere regionen Europas.","410",NA
"Das ist das Ergebnis des Einsatzes der Menschen in Südtirol und einer umsichtigen Finanz- und Wirtschaftspolitik.","401",NA
"Aber anstatt diese Leistungen anzuerkennen, wurden die Bürgerinnen und  Bürger Südtirols mit immer neuen Abgaben und regelungen belastet.","401",NA
"Damit muss Schluss sein.","401",NA
"Finanzen und Steuern in Südtirols Hände",NA,NA
"Südtirol muss seine Zukunft auf eine verlässliche Finanzplanung bauen können.","301",NA
"Deshalb fordern wir die Steuerhoheit: Südtirol soll die Steuern selbst einheben und zukünftig auch selbst festlegen können und nur das nach rom abliefern, was dem italienischen Staat für seine Leistungen zu-steht.","301",NA
"Durch diese Umkehrung der derzeitigen regelung wird die Autono-mie gestärkt, Berechenbarkeit hergestellt und die Abhängigkeit Südtirols von rom deutlich verringert.","301",NA
"Dadurch kann auch für eine gleichmäßige Verteilung der Steuerlast in Südtirol gesorgt werden.","301",NA
"Mehr Freiraum für Südtirols Wirtschaft",NA,NA
"Wir brauchen eigenständige, zu Südtirol passende Rahmenbedingungen für die Wirtschaft und keine sinnlosen bürokratischen Hürden des Staates.","303",NA
"Wir sind der Überzeugung, dass wir in Südtirol alle Zuständigkeiten besser regeln als der überschuldete, schwerfällige italienische Staat.","301",NA
"Gerade unsere Unternehmen leiden unter den bürokratischen regeln des italienischen Staates und alle unter dem hohen Steuerdruck.","303",NA
"Das behindert  eine positive wirtschaftliche Entwicklung unseres Landes und erschwert die Schaffung neuer Arbeitsplätze.","303",NA
"Probleme wie Jugendarbeitslosigkeit und Einstellungsstopps sind die Folgen dieser regelungen und der Über-bürokratisierung.","303",NA
"Solche Fehlentwicklungen können wir am wirkungsvollsten bei uns im Land selbst bekämpfen.","303",NA
"Der Abbau zentralstaatlicher Hürden  und mehr Eigenständigkeit in der Wirtschaftspolitik bringen eine Steigerung der Wettbewerbsfähigkeit, die Schaffung neuer Arbeitsplätze und ein  höheres Lohnniveau für die Südtirolerinnen und Südtiroler!","301",NA
"»Wenn Europa angenommen werden soll, dann muss es vor allem ein Europa der  Heimaten werden«",NA,NA
"Arbeitnehmer und Arbeitnehmerinnen, Mittelstand fördern",NA,NA
"Die Schere zwischen Arm und reich hat sich auch in Südtirol weiter ausei-nander bewegt.","503",NA
"Viele Familien tun sich zunehmend schwer, mit ihrem Einkommen das Monatsende zu erreichen.","503",NA
"Eine Senkung der Steuern auf Arbeit und die Anpassung der Löhne an die gestiegenen Lebenshaltungs-kosten verhindern, dass Menschen unter die Armutsgrenze rutschen.","503",NA
"Südtirol in Europa",NA,NA
"Wenn Europa angenommen werden soll, dann muss es vor allem ein Euro-pa der Heimaten werden, in dem Kommunen, Länder und regionen, aber auch die verschiedenen Volksgruppen immer mehr Gewicht erhalten.","607",NA
"In dieser Entwicklung liegt für Südtirol eine große Chance, die staatliche  Grenze  zunehmend  zu  überwinden.","607",NA
"Ein  Europa  der  regionen  ist  Grundlage  für die Zukunftsfähigkeit dieses großen Friedensprojektes.","108",NA
"Zusammenarbeit über Grenzen hinweg",NA,NA
"Durch den Wegfall der Grenzen und die Einführung des Euro sind die Tiroler  Landesteile näher zusammengewachsen.","108",NA
"Die Brückenfunktion Südtirols bietet viele Möglichkeiten, die wir noch besser nutzen müssen.","108",NA
"Gleichzeitig  ist Südtirol auch von europäischen und globalen Problemen betroffen, die nicht hausgemacht sind – und die wir nur gemeinsam mit anderen in Eu-ropa lösen können.","108",NA
"Die enge Zusammenarbeit in der Europaregion Tirol-Südtirol-Trentino ist kulturell  und  Wirtschaftlich  eine  Bereicherung  für  Südtirol,  erhöht  den  Handlungsspielraum Südtirols und stärkt seine Lösungskompetenz.","108",NA
"Südtirol – stark für Europa",NA,NA
"Wir wollen Südtirol eine noch stärkere Position in Europa verleihen.","301",NA
"Ziel ist  die Zuständigkeit zum Abschluss völkerrechtlicher Verträge in den eigenen  Kompetenzfeldern.","301",NA
"Das würde die Eigenständigkeit Südtirols stärken und mehr Freiraum in der Zusammenarbeit mit unseren Nachbarländern er-möglichen.","301",NA
"Südtirol hat in den vergangenen bald 100 Jahren hart für seinen Platz in Europa und für ein gleichberechtigtes Miteinander der drei Sprachgruppen  in diesem Land kämpfen müssen.","301",NA
"Stolz auf das, was wir Südtirolerinnen und Südtiroler gemeinsam erreicht haben, lassen wir uns nicht von unserem Weg abbringen.","301",NA
"Wir kämpfen weiter – damit aus dem Modell Süd-tirol-Autonomie  auch  ein  Vorbild für das neue Europa  der  regionen  wird.","301",NA
"MITEINANDErDEBorIADA",NA,NA
"… Südtirol miteinander gestalten  … realisé deboriada Südtirol",NA,NA
"»La politica ne dess nia ester  le compit de püć, mo ara  se reverda dötes y düć!«",NA,NA
"Miteinander ist ein zentraler Wert der SVP.","305",NA
"Unter dem Edelweiß finden verschiedenste Interessen und Strömungen ihre gemeinsame politische Heimat.","305",NA
"Was uns verbindet ist das Ziel der Freiheit Südtirols und der maximalen Eigenständigkeit unseres Landes als Voraussetzung für Sicherheit, Arbeit und ein faires Miteinander.","601",NA
"Das kann nur gelingen, wenn wir weiter-hin für einen Ausgleich der Interessen sorgen und kleinere oder schwächere  Gruppierungen in unserer konkreten Politik genauso berücksichtigen wie die stärkeren.","607",NA
"Wir orientieren uns dabei an unserem christlich-humanistischen Menschenbild.","603",NA
"Gerechtigkeit ist das Maß, an dem Politik gemessen wird.","503",NA
"Es ist unsere Aufgabe, die Rahmenbedingungen zu schaffen, die allen Südtirolerinnen und Südtirolern die gleichen Chancen bieten.","503",NA
"I messun se impegné da tignì alt le valur dl bëgn dla comunité y ćiarè da abiné n balanz danter les categories y les generaziuns.",NA,NA
"Eine neue Art der Politik",NA,NA
"In  ganz  Europa  spüren  wir,  dass  viele  Menschen  das  Vertrauen  in  die  Politik  verloren haben.","202",NA
"Unsere Antwort darauf ist, die Bürgerinnen und Bürger noch stärker mitzunehmen und zu informieren.","202",NA
"Politisches Gestalten darf  nicht auf einige wenige beschränkt sein: Politik geht uns alle an!","202",NA
"Es ist unsere Aufgabe, besonders junge Menschen durch mehr Dialog und den offenen Austausch von Meinungen für politische Zusammenhänge zu  begeistern.","202",NA
"Wir wollen und fördern ein kritisches Auseinandersetzen mit den Problemen unserer Zeit, in unserer Partei wie in der Gesellschaft.","202",NA
"Wir verstehen den Landtag als Plattform der Diskussion und ort der Entscheidungsfindung.","202",NA
"Dabei nehmen wir gute Ideen – egal woher sie kommen – gerne auf.","202",NA
"Wir begrüßen die Instrumente der Bürgerbeteiligung und der  direkten Demokratie als Ergänzung der parlamentarischen Willensbildung.","202",NA
"Deutsche und ladinische Minderheit",NA,NA
"Die erfolgreiche Minderheitenpolitik des 2. Autonomiestatuts und seiner Durchführungsbestimmungen hat sowohl die Identität als auch das  Selbstbewusstsein der deutschen und ladinischen Volksgruppe gestärkt.","301",NA
"Die gemeinsame politische Vertretung in der SVP hat Autonomie und Entwicklung zum gemeinsamen Vorteil ermöglicht.","301",NA
"Zusammenarbeit der Sprachgruppen",NA,NA
"Das gleichberechtigte Miteinander der drei Sprachgruppen ist keine Selbst-verständlichkeit, sondern ein Erfolg, an dem wir hart gearbeitet haben und  an dem wir weiter arbeiten werden.","503",NA
"Südtirols Autonomie hat der deutschen  und ladinischen Minderheit sprachlich und kulturell Sicherheit gebracht.","301",NA
"Die gleiche und faire Behandlung aller Sprachgruppen – etwa bei Ämtern und Stellen der öffentlichen Verwaltung oder bei der Vergabe von Sozialleistungen – bleibt weiterhin Prinzip unserer Politik.","503",NA
"Wir sind überzeugt, dass die Zukunft unseres Landes nur im Einvernehmen zwischen den drei  Sprachgruppen gestaltet werden kann.","503",NA
"Denn Streit und Zwietracht dürfen  unsere Gesellschaft nicht spalten: Nur wenn wir geschlossen sind, haben wir eine starke Position im Staat und in Europa.","503",NA
"»Unsere Entscheidungen auf Landesebene orientieren sich am Ausgleich der Interessen zwischen ArbeitnehmerInnen und ArbeitgeberInnen«",NA,NA
"Sozialpartnerschaft und sektorenübergreifende  Zusammenarbeit",NA,NA
"Knapper  werdende  Finanz- und  Haushaltsmittel  bedeuten  eine  besondere  Herausforderung für Politik, Gesellschaft und Wirtschaft.","701",NA
"Eine Herausforderung, die wir nur miteinander angehen können: Die Sozialpartnerschaft  auf Augenhöhe und die Sicherung und der Ausbau qualifizierter Arbeitsplätze sind zentrale Bestandteile einer erfolgreichen Entwicklung unserer  klein- und mittelständischen Unternehmen.","701",NA
"Unsere Entscheidungen auf  Landesebene orientieren sich am Ausgleich der Interessen zwischen Arbeitnehmerinnen und Arbeitnehmern sowie Arbeitgeberinnen und Arbeitgebern.","701",NA
"Wir schaffen auch die Rahmenbedingungen, in denen die unterschied-lichen Sektoren – Gewerbe, Handel, Tourismus und Landwirtschaft – nicht  gegeneinander, sondern miteinander für ein wettbewerbsfähiges Südtirol  arbeiten.","701",NA
"Alt und Jung",NA,NA
"Die demografische Entwicklung stellt unsere Gesellschaft vor große Heraus-forderungen.","606",NA
"Dass mehr Ältere immer weniger Jüngeren gegenüberstehen,  darf nicht zu einem Konflikt zwischen den Generationen führen.","606",NA
"Die ältere  Generation hat für all das, was sie für unser Land geleistet hat, Wertschätzung  verdient.","606",NA
"Die materielle Absicherung und gesundheitliche Versorgung dieser  Generation steht für uns außer Frage.","606",NA
"Gleichzeitig müssen wir verantwortungsvoll mit der Zukunft der jüngeren Generation umgehen: in unserem  Einsatz für Bildung und Arbeitsplätze, im Umgang mit unseren Finanzen und  mit unseren natürlichen Ressourcen.","606",NA
"Deshalb orientiert sich unsere Politik  nicht an kurzfristigem Applaus, sondern an den langfristig besten Rahmen-bedingungen für alle Südtirolerinnen und Südtiroler.","606",NA
"Frauen und Männer",NA,NA
"Unsere Gesellschaft hat sich in den vergangenen Jahrzehnten deutlich verändert.","0",NA
"Dazu haben Bildung und die verstärkte Globalisierung beigetragen.","0",NA
"Diesen Veränderungen muss auch die Politikrechnung tragen: Die Lebensplanung jeder und jedes Einzelnen soll sich an den individuellen Interessen  und Fähigkeiten orientieren können.","201",NA
"Voraussetzungen dafür sind etwa  Maßnahmen zur besseren Vereinbarkeit von Familie und Beruf für Frauen  und für Männer sowie verstärkte Möglichkeiten zur Wahrnehmung von Eltern- und Pflegezeit.","503",NA
"Beruflich und gesellschaftlich sind alle Hürden zu entfernen, die einem gleichberechtigten Zugang und Aufstieg im Wege stehen.","503",NA
"Familie",NA,NA
"Verändert hat sich auch „Familie“: Die Formen des Zusammenlebens sind  vielfältiger geworden.","604",NA
"Nichtsdestotrotz ist und bleibt die Familie – in all  ihren Formen – der ort, an dem Miteinander und Solidarität gelebt  werden.","603",NA
"Sie ist überall dort, wo mehrere Generationen füreinander  Verantwortung übernehmen.","606",NA
"Seit jeher bilden Familien einen zentralen  Grundwert in der Politik der SVP.","606",NA
"Wir bleiben diesem Prinzip treu und  entwickeln unsere Maßnahmen und Instrumente weiter: Für eine moderne Familienpolitik in Südtirol, die Erziehungs- und Pflegeleistungen  der Familien entsprechend anerkennt, die Betreuungsstrukturen für  Erziehung und  Pflege garantiert  und  die  Voraussetzungen  schafft,  dass  beide Elternteile durch flexible Arbeitsmodelle Zeit für die Erziehung der  Kinder und die Pflege von Älteren haben.","604",NA
"Menschen mit unterschiedlichen Fähigkeiten",NA,NA
"Eine Gesellschaft wird vor allem auch daran gemessen, wie sie mit ihren schwächeren Mitgliedern umgeht.","503",NA
"Menschen, deren Chancen beeinträchtigt sind, brauchen nicht nur unsere Unterstützung, sondern auch unsere Wertschätzung und Achtung.","503",NA
"Der Zugang zum Arbeitsmarkt und die Möglichkeit, am gesellschaftlichen Leben teilzuhaben, sind dabei wichtige Voraussetzungen, für die wir die Rahmenbedingungen verbessern müssen.","503",NA
"Barrieren, ob architektonischer, struktureller oder sozialer Natur, sind  weiter abzubauen, Institutionen des Ehrenamts, die Familie und soziale Netze zu stärken.","503",NA
"All diese Maßnahmen müssen dazu beitragen, die individuellen Fähigkeiten anzuerkennen und ein weitgehend selbstbestimmtes  Leben zu ermöglichen.","201",NA
"»Unsere Haltung ist geprägt von den christlichen und humanistischen Grundwerten, von Eigenverantwortung und Toleranz«",NA,NA
"Einheimische und Zuwanderer",NA,NA
"Es gibt etwa 42.000 ansässige Ausländer in Südtirol.","0",NA
"Die Auffassungen darüber, wie wir diesen neuen Mitgliedern unserer Gesellschaft gegenüber  treten, sind äußerst unterschiedlich.","0",NA
"Unsere Haltung ist geprägt von den christlichen und humanistischen Grundwerten, von Eigenverantwortung und Toleranz: In der Überzeugung, dass jeder Mensch ein recht hat auf Würde und Solidarität treten wir entschieden gegen Fremdenhass ein.","607",NA
"Wir  wehren uns aber auch gegen eine unkontrollierte Zuwanderung in Südtirol:  Wo Arbeitsplätze vorhanden sind und Arbeitskräfte benötigt werden, sind Kräfte aus dem Ausland willkommen.","410",NA
"Es darf jedoch nicht sein, dass Menschen nur wegen unserer sozialen Leistungen nach Südtirol kommen.","605",NA
"Deshalb halten wir an der Bestimmung fest, dass fünf Jahre Ansässigkeit Voraussetzung  für  finanzielle  Zusatzleistungen  des  Landes  sind.","605",NA
"Wir  setzen  auf das Prinzip „fördern und fordern“: Wir investieren in Integrationsmaß-nahmen, insbesondere im Sprachbereich, und erwarten gleichzeitig die Bereitschaft zur Integration sowie den respekt vor Verfassung, rechtsstaat  und lokalen Sitten.","608",NA
"»Jahr für Jahr leisten zahlreiche Südtirolerinnen und Südtirolertausende Stunden an freiwilliger Arbeit für unsere Gesellschaft.«",NA,NA
"Solidarität und Ehrenamt",NA,NA
"Jahr für Jahr leisten zahlreiche Südtirolerinnen und Südtiroler tausende Stunden an freiwilliger Arbeit für unsere Gesellschaft.","606",NA
"Sie erbringen damit Leistungen, die für die öffentliche Verwaltung schlicht unbezahlbar wären,  aber ihr Engagement geht weit über den ökonomischen Nutzen hinaus.","606",NA
"Indem sie Verantwortung für sich selbst, aber auch für andere übernehmen,  schaffen sie ein gutes Miteinander und damit Lebensqualität – für jede und  jeden Einzelnen von uns.","606",NA
"Eine Gesellschaft, in der jede und jeder entsprechend ihrer und seiner Möglichkeiten zur gemeinsamen Lebensqualität beitragen kann, bleibt auch weiterhin unser Anliegen.","606",NA
"Deshalb muss das Ehrenamt weiter gefördert und gestärkt und von Einschränkungen und Auflagen weitestgehend befreit werden.","606",NA
"HEIMAT NoSC  DAćIASA",NA,NA
"…Südtirol als lebens- und  liebenswerte Heimat erhalten … Mantignì Südtirol sciöche  n daćiasa por vire inant bun",NA,NA
"Der Einsatz und die Tatkraft von vielen Frauen und Männern hat Südtirol  zu dem gemacht, was es heute ist: eine lebens- und liebenswerte Heimat.","601",NA
"Heimat – das ist Nähe, das ist dort,  wo wir wohnen, arbeiten, wo Familie und Freunde sind.","601",NA
"Deshalb ist Heimat nicht nur ein Ort, sondern auch ein Gefühl, schafft Identität und Vertrauen.","601",NA
"Es ist der Ort, an dem  wir angenommen und in unserem Tun anerkannt sind.","601",NA
"In Südtirol hat der Begriff eine zusätzliche, ganz besondere Bedeutung: Es ist uns gelungen,  unsere kulturelle Eigenständigkeit und Identität auch gegen Widerstände zu verteidigen und sie und die Heimat zu erhalten.","601",NA
"Heimat Südtirol ist aber auch mit einer großen Verantwortung für die Zukunft verbunden.","601",NA
"Es ist Aufgabe der Politik, Südtirol als lebenswerte  Heimat für alle Südtirolerinnen und Südtiroler zu gestalten.","601",NA
"Ein funktionierendes Miteinander,  eine lebendige Kultur,  eine gut aufgestellte Wirtschaft, ein gerechtes Sozialsystem und eine intakte Umwelt sollen  jene Heimat bilden, die wir unseren nachkommenden Generationen übergeben.","601",NA
"Nostes valades é n post olache i ne viun nia ma, mo che é inće adöm cun  nosc lingaz nosta identité. La detlaraziun dl 2011 à desmostrè che i sintiun sterch y viun chësta nosta particolarité de mendranza ladina.",NA,NA
"Heimat – Gegenmodell zu Globalisierung",NA,NA
"Die zunehmende Globalisierung und damit Anonymisierung führt zwangs-läufig zu Verunsicherung: Wo gehören wir hin, was ist unser Platz in dieser  Welt?","601",NA
"Heimat bietet darauf eine Antwort: Familie und Freunde, das Vertrauen in das Umfeld, auch in gesunde und lokale Lebensmittel, die  Verwurzelung in Vereinen – all das sind Werte, die einem der technische Fortschritt, bei all seiner Wichtigkeit, nicht bieten kann.","601",NA
"Nur diese kleinen Strukturen können den Menschen das wichtige Gefühl persönlicher Sicherheit und Geborgenheit geben.","601",NA
"Das schafft Lebensqualität und macht uns stärker gegenüber unsicheren Entwicklungen in der Welt.","601",NA
"Stadt und Land",NA,NA
"Die 116 Südtiroler Gemeinden sind der unmittelbare Lebensraum der Süd-tirolerinnen und Südtiroler.","601",NA
"Lebendige Dörfer brauchen Arbeitsplätze, Kinderbetreuungsangebote, Ausbildungsstätten und Pflegeeinrichtungen  genauso wie einen Wirtschaftsraum, der auch Nahversorgung ermöglicht,  gute Verkehrsanbindung, Kommunikations-Infrastruktur und attraktive  Freizeitmöglichkeiten.","601",NA
"Deshalb war Südtirols Politik in den vergangenen  Jahrzehnten stets darum bemüht, gute Bedingungen auch für geografisch  entlegene und somit benachteiligte Gebiete zu schaffen.","601",NA
"Wenn es um Dienste und Strukturen im ländlichen raum geht, dürfen viele Entscheidungen  nicht nach vordergründigen ökonomischen Aspekten getroffen werden: Den  jungen Südtirolerinnen und Südtirolern muss es möglich sein, in der eigenen  Heimatgemeinde bleiben zu können.","601",NA
"Hier gilt es auch für Bedingungen des  Wohnens zu sorgen, die dies garantieren können.","601",NA
"Wir werden alles unternehmen, die jungen Familien sowie den ländlichen  raum in Südtirol zu stärken und Rahmenbedingungen für Arbeit, Wohnung  und Familie zu schaffen.","601",NA
"Das bedeutet jedoch keineswegs, dass die Interessen der Zentren und Städte hintangestellt werden: Wir setzen konkrete  Maßnahmen, um auch in wachsenden Ballungszentren eine hohe Lebens-qualität sicherzustellen.","601",NA
"»Die zunehmende Globalisierung  und damit Anonymisierung führt zwangsläufig zu Verunsicherung«",NA,NA
"Lebensraum",NA,NA
"Südtirols Kapital ist eine einzigartige Natur- und Kulturlandschaft, die für  uns alle auch Lebens- und Wirtschaftsraum ist.","601",NA
"Gerade diesem Ausgleich  müssen wir gerecht werden: In unserer modernen Gesellschaft, in der viele  Ressourcen immer knapper werden, geht es ganz wesentlich um die Sicherung und Schaffung von Arbeitsplätzen,","701",NA
"aber auch um die Erhaltung unserer  großartigen Natur.","501",NA
"Gerade in einem Tourismusland ist das kein Widerspruch.","412",NA
"Wir wollen eine maßvolle und umsichtige ökonomische Weiterentwicklung  zulassen.","412",NA
"In der Energiepolitik muss die Nutzung regenerativer Energiequellen weiter vorangetrieben werden, allerdings immer im Einklang mit Landschaft und Natur.","412",NA
"Mit dem zur Verfügung stehenden Grund und Boden müssen wir verantwortungsvoll umgehen: Im Vordergrund steht für uns die Aufwertung bestehender Bausubstanz, während eine kontinuierliche Neuausweisung von Flächen langfristig nicht mehr möglich sein wird – eine Tatsache, für die wir auch verstärkt Bewusstsein schaffen müssen.","501",NA
"Dem Ausverkauf der Heimat muss noch stärker Einhalt geboten werden.","601",NA
"»I fajarun döt le poscibl por  sostegnì nostes families jones y i raiuns da munt«",NA,NA
"Kultur und Vielfalt",NA,NA
"Die Sicherung der deutschen und ladinischen Sprache und Kultur war und ist der Kern der Autonomiebemühungen und wird weiterhin unser zentrales Anliegen sein.","301",NA
"Es ist die Grundlage unserer Identität und schafft – unabhängig von unserer Staatszugehörigkeit – ein Gefühl von Heimat und  Vertrautheit.","601",NA
"Das gilt für alle drei hier lebenden Sprachgruppen.","601",NA
"Es ist eine  große historische Leistung, dass es im harten ringen gelungen ist, dem Miteinander ein solides Fundament zu geben und in der Folge die kulturelle Vielfalt als reichtum zu begreifen.","601",NA
"Es ist unsere Aufgabe und Verpflichtung, die erreichten Erfolge für die nachkommende Generation abzusichern und zugleich Austausch und Begegnungen zu fördern, um Hürden im Zusammenleben abzubauen.","606",NA
"Vereine und Tradition",NA,NA
"Über 5.000 Vereine in Südtirol füllen unsere Heimat mit Leben: Sie schaffen  Vielfalt und sie leben beispielhaft Solidarität, pflegen Traditionen und geben  sie an die nächsten Generationen weiter.","601",NA
"Damit leisten sie wertvollste Arbeit für unsere Gemeinschaft und bieten der Jugend orientierung und  Perspektiven.","601",NA
"Traditionen sind dabei nichts Starres oder Unveränderbares,  sondern veranlassen uns auch immer wieder zum kritischen Hinterfragen.","604",NA
"Bewahren, was gut ist, aber auch offen sein für Neues – das ist der Weg, den wir in Südtirol gehen wollen.","0",NA
"Tirol",NA,NA
"Südtirol ist ein Teil des Tiroler Lebens- und Kulturraums.","0",NA
"Die Zusammenarbeit zwischen den Tiroler Landesteilen ist und bleibt daher ein Herzensanliegen.","0",NA
"Wir verstehen darunter aber keineswegs die Schaffung von neuen Grenzen auf dem Papier oder in den Köpfen, sondern die Begegnung zwischen den Menschen.","606",NA
"Initiativen zur Kooperation und zum Austausch sollen im Rahmen der Europaregion weiter gefördert werden.","606",NA
"Dabei sollen insbesondere Gemeinden, Vereine, Verbände und Organisationen intensiv  eingebunden werden.","606",NA
"Die Menschen müssen ganz konkret in ihrem persönlichen Lebensumfeld spüren, dass die Europaregion endlich Formen annimmt und gelebt wird.","606",NA
"Tradition und Moderne",NA,NA
"Die Wertschätzung und Achtung unserer Heimat darf nicht mit einem starren Festklammern an überholten Positionen verwechselt werden.","305",NA
"Darum  geht  es uns  als  Südtiroler  Volkspartei:  um die  richtige Balance  zwischen Kontinuität und Erneuerung, zwischen „Gutem bewahren“ und  „Neuem wagen“.","305",NA
