"text","cmp_code","eu_code"
"In einer Zeit rasanter Veränderungen und Umwälzungen sind unsere Werte eine wichtige Basis, um auch mutig den Weg in die Zukunft zu gehen.","603",NA
"Wir wollen einen lebendigen, intensiven und auch organisierten Austausch mit allen über unsere Heimat führen und sie dynamisch  weiterentwickeln.","601",NA
"Mit unserer Heimat im Herzen, aber mit klarer orientierung an den Herausforderungen der Gegenwart und der Zukunft, wollen wir Südtirol gestalten.","601",NA
"CHANCEN CHANCES",NA,NA
"…Südtirols Chancen nutzen … Anuzé les canches che Südtirol pîta","601",NA
"Südtirol hat viele Stärken.","601",NA
"Aber auch viele Chancen, die noch zu wenig genutzt sind.","601",NA
"Ganz im Sinne unseres Leitgedankens „Gutes bewahren. Neues wagen.“ wollen wir auf diese Stärken setzen, auf unsere Werte und Traditionen bauen und die Chancen für die Zukunft nutzen.","601",NA
"Jede Südtirolerin und jeder Südtiroler muss die Möglichkeit zu einem erfüllten Leben in unserer Heimat haben.","201",NA
"Dazu gehören gleichwertige Chancen im Zugang zu Arbeit und Bildung, die aktive Mitsprache bei der Entwicklung des Landes, mehr Freiraum für Eigeninitiativen und die  Übernahme von mehr Verantwortung für sich selbst, aber auch für andere, die unsere Unterstützung brauchen.","201",NA
"Südtirol nes pîta tröpes poscibilitês te ćiamps desvalîs. I orun tó les ocajiuns che ne vëgn nia ćiamò anuzades por promöie l’inovaziun y ti jì  insciö pormez al nü.",NA,NA
"Der Jugend Chancen bieten",NA,NA
"Den Kindern und Jugendlichen gehört die Zukunft.","0",NA
"Die Politik hat nur dann  gute Arbeit geleistet, wenn sie es der nächsten Generation ermöglicht, ihre Chancen in Südtirol wahrzunehmen und ihr Leben auf der Basis einer guten Bildung und Ausbildung, mit sicheren Arbeitsplätzen und in einer intakten Umwelt zu gestalten.","606",NA
"»Die Herstellung von Chancengleichheit muss eines unserer wichtigsten politischen Vorhaben sein«",NA,NA
"Im Bildungsbereich gilt es die Mehrsprachigkeit als Vorteil und Chance zu begreifen, indem wir die Sprachkompetenzen unserer Kinder stärken.","506",NA
"Im dualen Ausbildungssystem müssen neue Schwerpunkte gesetzt werden: Mit einer Aufwertung des Handwerks und einer Berufsmatura für Lehrlinge  beispielsweise können wir den Jugendlichen noch bessere Ausbildungsangebote bieten und neue Arbeits- und Lebensperspektiven ermöglichen.","506",NA
"Es gilt den Jugendlichen über Betriebspraktika den Einstieg in die Berufswelt zu erleichtern.","506",NA
"Unsere Entscheidungen von heute betreffen das Leben unserer Kinder von morgen.","506",NA
"Eine „generationenverträgliche Politik“ bedeutet  deshalb, dass wir diese Entscheidungen vorher auf ihre Nachhaltigkeit prüfen.","606",NA
"Vor allem aber ist wichtig, dass wir der Jugend auf Augenhöhe begegnen und sie noch stärker als bisher in unsere Politik einbinden und neue  Akzente, die sie einbringen, zulassen und fördern.","202",NA
"Standort Südtirol stärken",NA,NA
"Die wirtschaftliche Entwicklung Südtirols ist die Basis für Sicherheit und Lebensqualität.","410",NA
"Wir  begreifen  die  kleinstrukturierte  Wirtschaft  unseres  Landes, in der Qualität und Tradition eine große rolle spielen, als wichtige  Chance für die Zukunft.","410",NA
"In zunehmend globalisierten und austauschbaren  Märkten unterscheidet uns das von anderen und schafft Glaubwürdigkeit und Vertrauen.","410",NA
"Gleichzeitig aber kommen auch einige Herausforderungen  auf uns zu.","410",NA
"Wir dürfen nicht stehen bleiben, sondern müssen uns weiter-entwickeln und dynamische Unternehmen fördern, die mit neuen Ideen unsere Wirtschaft beleben.","410",NA
"Es gilt lokale Nischenmärkte zu erschließen und  regionale Kreisläufe gezielt zu fördern.","410",NA
"Höchste Priorität dabei hat der Abbau der überbordenden Bürokratie und des übermäßigen Steuerdrucks.","401",NA
"Die bürokratischen Auflagen in Südtirol erschweren die Gründung neuer Unternehmen, den Ausbau bestehender Unternehmen, ebenso wie die Einstellung neuer Arbeitskräfte und hemmen damit die wirtschaftliche und gesellschaftliche Entwicklung Südtirols.","401",NA
"Ein Teil dieser Bürokratie ist hausgemacht, jedoch bei weitem nicht alles.","401",NA
"Der Ausbau der Autonomie durch eine Steuer- und Finanzhoheit ist deshalb  ein wichtiger Schritt","301",NA
"Mehr Selbstverantwortung",NA,NA
"Die Überreglementierung ist auch eine Folge der Übernahme von mehr und  mehr Aufgaben durch die öffentliche Hand.","401",NA
"Es ist jetzt Zeit, ganz bewusst wieder einen Schritt zurückzugehen und offen und ehrlich einzugestehen,  dass die öffentliche Hand nicht für alles da sein kann und soll.","401",NA
"Das entspricht auch dem Wunsch vieler Südtirolerinnen und Südtiroler nach mehr  Freiraum und Eigenverantwortung.","401",NA
"Sie sehen, genauso wie wir, in der Stärkung der Eigeninitiative und der Übertragung von mehr Verantwortung  eine Chance für Südtirol und für jede Einzelne und jeden Einzelnen.","401",NA
"Die öffentliche Verwaltung sollte sich also aus jenen Bereichen zurückziehen, die privat funktionieren – und teilweise sogar besser gelöst werden können.","401",NA
"Außer Frage steht dabei, dass wesentliche Bereiche der Daseins-vorsorge gesichert sein müssen und Bereiche wie die öffentliche Sicherheit  im alleinigen Verantwortungsbereich der öffentlichen Hand bleiben müssen.","401",NA
"Auch eine reduktion der Steuern einerseits und eine Absenkung der Beiträge andererseits bringen nicht nur volkswirtschaftliche Vorteile,  sondern entsprechen dem Gedanken von mehr Eigenverantwortung.","401",NA
"Unser größtes Potential: Die Menschen Südtirols",NA,NA
"Männer und Frauen, Menschen aus unterschiedlichen regionen und mit verschiedensten Fähigkeiten müssen die grundsätzlich gleichen Chancen in Südtirol haben.","503",NA
"Voraussetzung dafür ist in erster Linie ein gerechter Zugang zu einem qualitativ hochwertigen Bildungssystem und die Chance auf einen Arbeitsplatz.","503",NA
"Chancengleichheit bedeutet auch, dass wir die  Vereinbarkeit von Familie und Beruf als Selbstverständlichkeit in einer  modernen Gesellschaft begreifen und dahingehend konkrete, unterstützende Maßnahmen setzen.","503",NA
"Die Südtirolerinnen und Südtiroler haben unsere Heimat zu dem gemacht,  was sie heute ist.","601",NA
"Sie sind unsere wichtigste Stärke, auf die wir gerne bau-en.","601",NA
"Viele Bürgerinnen und Bürger wollen stärker in die politischen Entscheidungen einbezogen werden und sind bereit, sich aktiv einzubringen.","202",NA
"Das unterstützen wir, schaffen mehr Möglichkeiten der Mitsprache und begrüßen Instrumente der direkten Demokratie.","202",NA
"Mit unserem Programmprozess,  bei  dem  wir  die  ganze  Bevölkerung  eingeladen  haben,  mit  uns  zu  diskutieren, haben wir damit bereits begonnen.","202",NA
"Diese Einbindung der Südtirolerinnen und Südtiroler werden wir auch in unserer Politik der nächsten Jahre weiter führen.","202",NA
"Südtirol hat viele Chancen.","601",NA
"Nutzen wir sie gemeinsam!","601",NA
"SÜDTIroL ProGrAMM LE  ProGrAM  Por SÜDTIroL  dala A ala Z von A bis Z",NA,NA
"Vorweg",NA,NA
"Die nachfolgende Auflistung enthält eine Aufzählung wichtiger  Themen  und Aufgaben, die den Menschen in Südtirol ein Anliegen sind und um die wir uns in den nächsten Jahren intensiv bemühen werden. Die übersichtliche Darstellung von A bis Z beinhaltet Einzelthemen ebenso wie größere Themenbereiche, Fragen von zentraler, grundsätzlicher Bedeutung ebenso wie konkrete Einzelanliegen. Daher ist weder die Reihenfolge von A bis Z noch der Umfang der einzelnen Themen als Gewichtung zu verstehen. Die dargestellte Auswahl der Themen ist das Ergebnis des  intensiven Programmprozesses der Südtiroler Volkspartei,  an dem sich zahlreiche Südtirolerinnen und Südtiroler beteiligt haben.",NA,NA
"Arbeit",NA,NA
"Arbeit sichern, ermöglichen und fördern: Gerade in Wirtschaftlich angespannten Zeiten ist dies eine der  wichtigsten Aufgaben der Politik.","701",NA
"Dies gelingt durch steuerliche  Entlastung der Unternehmen,  Abbau von unnötiger Bürokratie,  sowie qualitative Sicherung der  Aus- und Weiterbildung, die den aktuellen Bedürfnissen angepasst  werden.","701",NA
"ArbeitnehmerInnenförderung",NA,NA
"Viele Arbeitnehmerinnen und Arbeitnehmer wissen nicht mehr, wie  sie mit ihrem Einkommen auskommen sollen.","701",NA
"Wer arbeitet, hat einrecht auf angemessene Entlohnung, mit der die zentralen Lebens-haltungskosten gedeckt werden können.","701",NA
"Daher muss die PolitikRahmenbedingungen setzen, damit Spielräume für Lohnerhöhungen geöffnet werden können.","701",NA
"Gleichzeitig verdienen jene Lohnabhängigen eine Unterstützung durch  Fördermaßnahmen, welche aus eigener Kraft nicht für Wohnung oder  Familie aufkommen können.","701",NA
"Armut und Altersarmut",NA,NA
"Der grundsätzlich hohe Wohlstand in Südtirol darf nicht darüber hin-wegtäuschen, dass das nicht für  alle Menschen gilt: Prekäre Beschäftigungssituationen, geringe  Einkommen sowie steigende Preise  für Konsumgüter und Dienstleistungen stellen viele Menschen in  Südtirol vor ernsthafte Probleme.","701",NA
"Gerade die ältere Generation hat dann Schwierigkeiten, wieder den Anschluss – etwa im Berufsleben – zu finden.","701",NA
"Hier braucht es daher  spezielle Maßnahmen, etwa eine  Förderung der Beschäftigung älterer Arbeitnehmerinnen und Arbeitnehmer durch Umschulung und  Weiterbildung.","701",NA
"Es gilt grundsätzliche Maßnahmen zu treffen, die die  Menschen vor Altersarmut schützen, sowohl im Erwerbstätigen- wie im rentenalter.","701",NA
"Aus- und Weiterbildung,  Umschulungen",NA,NA
"Die lebenslange undbegleitende  Aus- und Weiterbildung gewinnt  zunehmend an Bedeutung.","506",NA
"Damit Flexibilität und Mobilität keine leeren Worthülsen bleiben, sind die  Sicherung einer qualitativ hochwertigen Ausbildung Voraussetzung: in  den Grund-, Mittel-, ober- und Berufsschulen, in den Betrieben und in  der Universität sowie mit vermehrten Investitionen in die berufliche und persönliche Weiterbildung. (Schule, Duale Ausbildung)","506",NA
"„ Ausverkauf der Heimat“",NA,NA
"In einigen Südtiroler Gemeinden ist der Anteil an Zweitwohnungen von Provinzfremden im Lauf der  Jahre eklatant angestiegen, während Einheimische zunehmend  Schwierigkeiten haben, ein Eigenheim zu einigermaßen erschwinglichen Preisen zu erwerben.","601",NA
"Dieser  Zweitwohnungstourismus hat sich  auch auf das Leben in der Dorfgemeinschaft ausgewirkt.","601",NA
"Diese Folgeerscheinungen des „ Ausverkaufs der Heimat“ gilt es weiter einzuschränken, wobei entsprechende  Maßnahmen auf Gemeindeebene  unterstützt werden.","601",NA
"Autobahn",NA,NA
"Die Brennerautobahn quert vom  Brenner bis Salurn vier Südtiroler  Bezirke und prägt neben dem Erscheinungsbild auch Wirtschafts- und Lebensraum.","501",NA
"Die von Luft- und  Lärmbelästigung betroffenen Gemeinden verdienen Ausgleichsmaßnahmen – auch des-halb müssen sämtliche Vorgänge  rund um diese Verkehrsader wesentlich von der Südtiroler Politik  gestaltet und entschieden werden.","501",NA
"Langfristiges Ziel ist die Verlagerung des Warenverkehrs von der  Straße auf die Schiene.","501",NA
"Es müssen  alle notwendigen Anstrengungen  unternommen werden, um die  Konzession zur Führung der Autobahn weiter in den bewährten  Händen der Brennerautobahn AG  zu belassen.","501",NA
"Autonomie",NA,NA
"Die Südtiroler Volkspartei hat den Weg der Autonomie maßgeblich  gestaltet und mit Zielstrebigkeit,  Beharrlichkeit,  Geschick  und Geduld Schritt für Schritt mehr Eigenständigkeit für Südtirol erreicht.","301",NA
"Dieser Weg hat ethnischen und sozialen Frieden gebracht, zum Wohl der gesamten Bevölkerung, die sich  in ihrer Identität frei entwickeln konnte.","301",NA
"Die maximale Eigenständigkeit Südtirols soll erreicht werden, der Ausbau zur Vollautonomie ist konkretes Ziel, eigenständige europäische regionen eine gültige Perspektive.","301",NA
"Das Thema „ Autonomie“ ist als zentraler Wert der  SVP ausführlich in den einleitend  angeführten Kernthemen beschrieben.","301",NA
"Die europäische Dimension  wird für Südtirol zunehmend wichtiger, gerade im normativen Bereich.","301",NA
"Der Spielraum in der Gesetzgebung soll deshalb so weit wiemöglich direkt genutzt werden.","301",NA
"Bauern",NA,NA
"Die bäuerlichen Familienbetriebe  sind das rückgrat der gut funktionierenden Landwirtschaft in Süd-tirol.","703",NA
"Ein befriedigendes Einkommen für diese Betriebe, die Erhaltung  und  Schaffung  von attraktiven  Arbeitsplätzen sowie Zu- und  Nebenerwerbsmöglichkeiten sind  deshalb auch weiterhin ein wichtiges Anliegen.","703",NA
"Die landwirtschaftlichen Flächen sind Lebensgrundlage  eines jeden landwirtschaftlichen  Betriebes und Voraussetzung für  die Produktion regionaler, gesunder  Lebensmittel.","703",NA
"Der Erhalt dieser Flächen muss auch angesichts des  knapper werdenden Grund und  Bodens in der raumplanung berücksichtigt werden.","703",NA
"Die Freizeitnutzung dieser Flächen soll grundsätzlich möglich, aber in fairen Ab-kommen geregelt werden.","703",NA
"Beschäftigung",NA,NA
"obwohl die Arbeitslosenzahlen in Südtirol im EU-Vergleich niedrig  sind, ist die gestiegene Arbeitslosigkeit für uns ein Warnsignal, das wir sehr ernst nehmen.","701",NA
"Die Bekämpfung der Arbeitslosigkeit ist für uns ein zentrales Anliegen, wobei insbesondere Maßnahmen für junge und  ältere Menschen getroffen werden müssen.","701",NA
"Auch Frauen müssen beim  Wiedereinstieg ins Erwerbsleben  besonders unterstützt werden.","701",NA
"Voraussetzung für einen funktionierenden Arbeitsmarkt ist eine gesunde  Wirtschaft,  weniger  Bürokratie, eine funktionierende Sozialpartnerschaft und exzellente  Aus- und Weiterbildung sowie  Umschulung.","701",NA
"Dafür schaffen wir  die Rahmenbedingungen.","701",NA
"Berglandwirtschaft",NA,NA
"Die Bergland Wirtschaft verdient  aufgrund der erschwer ten Produk-tionsbedingungen und der Kleinstrukturier theit der Betriebe besondere Beachtung.","703",NA
"Neben der Produk-tion von Lebensmitteln stehen die berglandwirtschaftlichen Betriebe auch für den Erhalt der Kulturland-schaft und BeWirtschaftung von  schwer zu bearbeitenden Flächen.","703",NA
"Die wirtschaftliche Lage der Berg-bauernbetriebe gilt es zu verbessern, die Leistungsentgelte der öffentlichen Hand sind ein unver-zichtbarer Einkommensbestand-teil.","703",NA
"Bildung",NA,NA
"Südtirol hat eine umfassende und bedeutende Bildungslandschaft,  welche auf lernbereite Schülerinnen  und Schüler, lebenslang lernwillige Erwachsene, fähige Lehrkräfte und Weiterbildungspersonal sowie entsprechende strukturelle Rahmenbedingungen aufbaut.","506",NA
"Gerade für  eine sprachliche und kulturelle Minderheit ist es wesentlich, über ein hochwer tiges Bildungswesen zu  ver fügen, wobei der Sprachenerwerb weiter verstärkt werden soll.","506",NA
"Daneben liegen die Schwerpunkte auf der Vermittlung von Allgemeinwissen, Sozialkompetenzen und  Landeskunde, Naturwissenschaft  und Technik.","506",NA
"Zwischen den deutschen, ladinischen und italienischen Bildungsangeboten sollen verstärkt Synergien genutzt werden.","506",NA
"Dazu gehör t etwa die Verschlankung der öffentlichen Verwaltung, indem die Personal- und andere Verwaltungen der drei Schulämter und der verschiedenen Berufsbildungsinstitutionen einheitlich zusammengefasst werden(Aus- und Weiterbildung).","303",NA
"Brauchtum",NA,NA
"Traditionen und Brauchtümer  zeichnen Südtirol aus, hunderte  Vereine und Organisationen pflegen diese, erhalten damit ein Stück  Geschichte aufrecht und entwickeln sie weiter.","601",NA
"Diese gewachsenen Brauchtümer sind Ausdruck  Südtiroler Identität und der Zeit.","601",NA
"Es gilt sie zu fördern, zu unterstützen und in die Zukunft zu führen, um sie lebendig zu erhalten.","601",NA
"Brennerbasistunnel",NA,NA
"Der Brennerbasistunnel ist die Voraussetzung für eine zwingende Verlagerung des Schwerverkehrs von  der Straße auf die Schiene.","501",NA
"Es gilt den Baubetrieb in Abstimmung mit  den italienischen und österreichischen Behörden rasch voranzutreiben, wobei die südlichen Zulauf-strecken zeitgleich im Einvernehmen mit den angrenzenden Gemeinden geplant und realisier t  werden müssen.","501",NA
"Gleichzeitig sind  die Rahmenpolitischen Maßnahmen zur Verlagerung zu setzen.","501",NA
"Bürgerbeteiligung",NA,NA
"Je besser und umfassender die Bevölkerung im Vorfeld politischer Entscheidungen miteinbezogen wird,  desto breiter ist die Mehrheit, die Beschlüsse mitträgt.","202",NA
"Zudem weckt  eine aktive Einbindung  das  Interesse  an gesellschaftspolitischen Themen  und appellier t an die gesellschaftliche Verantwortung eines jeden und  einer jeden Einzelnen.","202",NA
"Wir unterstützen daher Initiativen, die auf ein  Mehr an Beteiligung abzielen, wo  dies gewünscht wird, wobei auf den  Interessensausgleich zwischen den  verschiedenen Sprachgruppen ein  besonderes Augenmerk gelegt wird.","202",NA
"Bürokratie",NA,NA
"Die derzeitigen bürokratischen Auf-lagen stellen für die Unternehmen, für Familien, Senioren  und alle Bürgerinnen und Bürger  eine erhebliche Belastung dar.","303",NA
"Künftige gesetzliche und verwaltungstechnische Maßnahmen sind  daher auf ihre bürokratischen Aus-wirkungen hin zu überprüfen.","303",NA
"Die Vereinheitlichung und Verschlankung aller Abläufe und Informationssysteme sowie der überbehördliche Datenaustausch sind im Rahmen der gesetzlichen Möglichkeiten voranzutreiben, damit Mehr-fachansuchen oder wiederholte  Erklärungen  der Vergangenheit  angehören.","303",NA
"Die einfachste Anwendbarkeit für jede Bürgerin und jeden Bürger ist übergeordnetes Ziel und Entscheidungskriterium.","303",NA
"Chancengleichheit",NA,NA
"Alle Menschen in Südtirol sollen die  gleichen Chancen haben, unabhängig von ihrer Herkunft oder ihrem Geschlecht.","503",NA
"Das betrifft insbesondere den Zugang zu Bildung, Chancen am Arbeitsmarkt und eine gleiche Entlohnung für gleiche Arbeits-leistung.","503",NA
"Die  Politik  ist  gefordert,  Maßnahmen zu setzen, die für alle die gleichen Rahmenbedingungen schaffen.","503",NA
"Das betrifft Männer und  → Frauen ebenso wie → Menschen mit Beeinträchtigungen, auch und im  Besonderen in den Bereichen  Politik und → Wirtschaft.","503",NA
"Demografischer Wandel",NA,NA
"Unsere Gesellschaft wird älter, wes-halb künftig mehr ältere Menschen  weniger jungen Menschen gegen-überstehen werden.","606",NA
"Die gesellschaftspolitischen Folgen dieses  demografischen Wandels sind heute noch  nicht vollständig  absehbar,  keinesfalls darf diese Entwicklung aber zu einem  Generationenkonflikt führen.","606",NA
"Der Generationengerechtigkeit zum Ausgleich und zur Partnerschaft zwischen Jung und  Alt gilt daher ein besonderes Augenmerk.","606",NA
"In besonderer Weise müssen Vorsorgemaßnahmen auf ihre langfristigen Auswirkungen hin  überprüft werden.","606",NA
"Demokratie",NA,NA
"Das allgemeine Verständnis von Demokratie begrenzt sich heute nicht  mehr nur auf die Teilnahme an  Wahlen.","202",NA
"Viele Bürgerinnen und Bürger möchten auch zu konkreten  Entscheidungen angehört und gefragt werden.","202",NA
"Als „Experten“ für ihre  Anliegen und ihr Lebensumfeld  können sie wertvolle Ideen und An-regungen in die Politik einbringen.","202",NA
"Deshalb sollen verstärkt Instrumente der direkten Demokratie und der  Bürgerbeteiligung eingeführt  und genutzt werden.","202",NA
"Bei größeren Vorhaben und weitreichenden Entscheidungen sollen die Betroffenen  auf verschiedenen Ebenen bereits  im Vorfeld stärker eingebunden  werden, um eine breite Unterstützung für die bestmögliche Lösung zu erreichen.","202",NA
"Dezentralisierung",NA,NA
"Bozen ist nicht nur Landeshauptstadt von Südtirol, sondern auch  ein wichtiges Zentrum für Wirtschaft, Verwaltung und viele andere Bereiche des sozialen, gesellschaftlichen und kulturellen Lebens.","0",NA
"Der immer größere Ausbau  der Autonomie und der Auf-schwung der vergangenen Jahr-zehnte haben dazu geführt, dass  immer mehr Strukturen zentral auf  Bozen konzentrier t wurden – vielfach zu Ungunsten der peripheren Gemeinden und Bezirke.","302",NA
"Dies ist künftig neu zu strukturieren: Zahlreiche Angebote, Infrastrukturen  und Kompetenzzentren sollen gezielt in den Bezirken angesiedelt  werden, um Arbeitsplätze und Karrierechancen nahe zu den Menschen zu bringen, die dort wohnen,  vor allem für jene, die Arbeit mit Erziehung oder Pflege kombinieren müssen.","302",NA
"Mit moderner Datentechnik ist eine  Vernetzung der Dienste zu organisieren, die möglichst gleichen Zugang und Service flächendeckend  für alle Bürgerinnen und Bürger  gewährleistet.","302",NA
"Duale Ausbildung",NA,NA
"Die duale Berufsausbildung in Süd-tirol hat sich bewähr t und gilt heute  als Vorzeigemodell für das restliche  Staatsgebiet.","506",NA
"Der Über tritt von der  Ausbildung in die Berufswelt findet häufig problemloser statt als in  anderen Bereichen.","506",NA
"Daher muss die  duale Ausbildung weiter aufgewertet und das Image von Lehrberufen  gesteigert werden.","506",NA
"Gleichzeitig ist  weiter zur Durchlässigkeit dieses  Ausbildungszweiges beizutragen:  kein Abschluss ohne Anschluss!","506",NA
"Ehrenamt und Vereine",NA,NA
"Tausende Südtirolerinnen und Süd-tiroler sind ehrenamtlich tätig und leisten einen unverzichtbaren Beitrag für unsere Gesellschaft.","606",NA
"Solidarität und Nachbarschaftshilfe werden gefördert, die Identifikation mit  den Dörfern und Gemeinden gefestigt, Kultur ge- und belebt.","606",NA
"Es gilt die ehrenamtlichen Vereine von  bürokratischen Auflagen weitgehendst zu befreien, mehr rechtssicherheit zu schaffen und die Anerkennung von ehrenamtlichem Engagement in  Schule und Beruf  weiter voranzutreiben.","303",NA
"Eigenverantwortung/  Eigeninitiative",NA,NA
"Der ruf nach einem Abbau der  Bürokratie und mehr Bürgerbeteiligung wird immer lauter.","202",NA
"Damit verbunden ist auch eine Stärkung der Eigenverantwortung.","202",NA
"Es muss klar sein: Die öffentliche Hand kann  nicht alles leisten und soll es auch nicht.","202",NA
"Sie kann wichtige Rahmen-bedingungen schaffen, in denen  jede und jeder Einzelne sein Umfeld  gestalten kann.","202",NA
"Dies erfordert zugleich mehr Eigeninitiative und Eigenverantwortung von allen Bürgerinnen und  Bürgern,  die  in  dieser  Hinsicht zu stärken und zu fördern sind.","202",NA
"Einwanderung",NA,NA
"In den vergangenen Jahren sind viele Menschen nach Südtirol zugezogen.","0",NA
"Der Mangel an einheimischen Arbeitskräften in Wirtschafts- und Sozialbereichen hat nach ausländischen Arbeitskräften verlangt,  welche sich inzwischen dauerhaft in  Südtirol niedergelassen haben und  hier eine neue Existenz aufbauen.","0",NA
"Hier gilt es, nach dem Motto „fordern und fördern“ Integrationsmaßnahmen sprachlicher und kultureller Natur auch für deren Familienangehörige zu setzen, klare  Spielregeln zu formulieren und  deren Einhaltung verstärkt einzufordern.","608",NA
"Angesichts der  derzeit angespannten Lage am Arbeitsmarkt  sind Politik und Wirtschaft gefordert, in erster Linie die derzeit  Arbeitslosen zu beschäftigen,  bevor neue Kontingente für ausländische Arbeitskräfte vergeben  werden.","706",NA
"Energie / erneuerbare Energie  und Energieeffizienz",NA,NA
"Südtirol hat ein einzigartiges Potential an erneuerbaren Energiequellen – eine gute Voraussetzung,  um seine rolle als europäische Vorzeigeregion in der Energienutzung und -versorgung auszubauen.","501",NA
"Es  gilt Projekte zur Nutzung von Wasser, Wind, Biomasse und Sonne unter besonderem Augenmerk auf die  Auswirkungen auf Natur- und  Kulturlandschaft gezielt zu unterstützen (Wasserkraft).","501",NA
"Parallel  werden alle Anstrengungen unterstützt, um die Energieeffizienz an Gebäuden und in Produktionsprozessen weiter zu steigern.","501",NA
"»Konsequent gehen wir den  erfolgreichen Weg der Autonomie  hin zur Vollautonomie weiter«",NA,NA
"Entlastung",NA,NA
"In einem zunehmend globalisierten  Wettbewerb gilt es die Kräfte zu  bündeln den Einzelnen wie die  Unternehmen weitgehend zu  entlasten und ihnen so mehr Freiheit, Freiraum und Eigenverantwortung zurückzugeben.","401",NA
"Wer seine eigenen Fähigkeiten, Talente und Stärken ohne übermäßige reglementierung ausüben kann,  findet raum für Kreativität und Innovation, die zum eigenen und zum  Erfolg der gesamten Gesellschaft  beitragen können.","401",NA
"In besonderer  Weise sind von diesem Prinzip die Bereiche Bürokratie und Förder-wesen gefragt.","303",NA
"Erreichbarkeit",NA,NA
"In einem Zeitalter zunehmender  Technologisierung und Informatisierung sind Erreichbarkeit und  Mobilität nicht nur Schlagwor te,  sondern eine Notwendigkeit und  politischer Auftrag.","411",NA
"Diese reicht von  Datenmobilität für Haushalte und Betriebe (Informationstechnik)  über die  funktionierende Personen- und Gütermobilität, attraktive Infrastrukturen für die zukünftige regionalentwicklung und Belebung  des ländlichen raums bis hin zur  Vernetzung der geistigen Infrastrukturen (EUrAC, Universität).","411",NA
"EUrAC",NA,NA
"Die Europäische Akademie in Bozen  stellt heute ein Tor Südtirols zu  Europa und zur Welt dar.","506",NA
"Südtirol  ist auf diesem Weg auch für Wissenschaftlerinne und Wissenschaftler aus dem Ausland interessant geworden.","506",NA
"Die Kooperation der EUrAC mit der  Südtiroler  Wirtschaft und Bil-dungslandschaft ist weiter zu stär-ken, um die Anerkennung dieser  Einrichtung im Land weiter zu stei-gern.","506",NA
"Dazu  gehör t  auch  die  noch  bessere Vernetzung mit der Uni-versität Bozen und anderen Forschungszentren in Südtirol und  darüber hinaus.","506",NA
"Europa",NA,NA
